venue,year,identifier,heading,title,authors,page_range,length,electronic_edition,comment
nips,2022,conf/nips/neurips2022,,Exploration via Planning for Information about the Optimal Trajectory.,Viraj Mehta; Ian Char; Joseph Abbate; Rory Conlin; Mark D. Boyer; Stefano Ermon; Jeff Schneider; Willie Neiswanger,,0,http://papers.nips.cc/paper_files/paper/2022/hash/b90cb10d4dae058dd167388e76168c1b-Abstract-Conference.html,
nips,2022,conf/nips/neurips2022,,Subquadratic Kronecker Regression with Applications to Tensor Decomposition.,Matthew Fahrbach; Gang Fu; Mehrdad Ghadiri,,0,http://papers.nips.cc/paper_files/paper/2022/hash/b9121bbb3112975d33c527f046ae68f2-Abstract-Conference.html,
nips,2022,conf/nips/neurips2022,,Robust Anytime Learning of Markov Decision Processes.,Marnix Suilen; Thiago D. Simão; David Parker; Nils Jansen,,0,http://papers.nips.cc/paper_files/paper/2022/hash/b931c44c35ce09e942edab7003eb3daa-Abstract-Conference.html,
nips,2022,conf/nips/neurips2022,,Discovering Design Concepts for CAD Sketches.,Yuezhi Yang; Hao Pan,,0,http://papers.nips.cc/paper_files/paper/2022/hash/b9432d0f94275f0571c6cc99cf8b1664-Abstract-Conference.html,
nips,2022,conf/nips/neurips2022,,Learning Distributed and Fair Policies for Network Load Balancing as Markov Potential Game.,Zhiyuan Yao; Zihan Ding,,0,http://papers.nips.cc/paper_files/paper/2022/hash/b94d8b035e2183e47afef9e2f299ba47-Abstract-Conference.html,
nips,2022,conf/nips/neurips2022,,Para-CFlows: $C^k$-universal diffeomorphism approximators as superior neural surrogates.,Junlong Lyu; Zhitang Chen; Chang Feng; Wenjing Cun; Shengyu Zhu; Yanhui Geng; Zhijie Xu; Chen Yongwei,,0,http://papers.nips.cc/paper_files/paper/2022/hash/b9523d484af624986c2e0c630ac44ecb-Abstract-Conference.html,
nips,2022,conf/nips/neurips2022,,NCP: Neural Correspondence Prior for Effective Unsupervised Shape Matching.,Souhaib Attaiki; Maks Ovsjanikov,,0,http://papers.nips.cc/paper_files/paper/2022/hash/b95c7e24501f5d1dddbc5e8526cda7ae-Abstract-Conference.html,
nips,2022,conf/nips/neurips2022,,Efficient Spatially Sparse Inference for Conditional GANs and Diffusion Models.,Muyang Li; Ji Lin; Chenlin Meng; Stefano Ermon; Song Han; Jun-Yan Zhu,,0,http://papers.nips.cc/paper_files/paper/2022/hash/b9603de9e49d0838e53b6c9cf9d06556-Abstract-Conference.html,
nips,2022,conf/nips/neurips2022,,A Greek Parliament Proceedings Dataset for Computational Linguistics and Political Analysis.,Konstantina Dritsa; Aikaterini Thoma; Ioannis Pavlopoulos; Panos Louridas,,0,http://papers.nips.cc/paper_files/paper/2022/hash/b96ce67b2f2d45e4ab315e13a6b5b9c5-Abstract-Datasets_and_Benchmarks.html,
nips,2022,conf/nips/neurips2022,,Multi-objective Deep Data Generation with Correlated Property Control.,Shiyu Wang; Xiaojie Guo; Xuanyang Lin; Bo Pan; Yuanqi Du; Yinkai Wang; Yanfang Ye; Ashley Ann Petersen; Austin Leitgeb; Saleh AlKhalifa; Kevin Minbiole; William M. Wuest; Amarda Shehu; Liang Zhao,,0,http://papers.nips.cc/paper_files/paper/2022/hash/b9c2e8a0bbed5fcfaf62856a3a719ada-Abstract-Conference.html,
nips,2022,conf/nips/neurips2022,,Domain Adaptation meets Individual Fairness. And they get along.,Debarghya Mukherjee; Felix Petersen; Mikhail Yurochkin; Yuekai Sun,,0,http://papers.nips.cc/paper_files/paper/2022/hash/b9e0ceee9751ae8b5c6603c029e4ca42-Abstract-Conference.html,
nips,2022,conf/nips/neurips2022,,An Asymptotically Optimal Batched Algorithm for the Dueling Bandit Problem.,Arpit Agarwal; Rohan Ghuge; Viswanath Nagarajan,,0,http://papers.nips.cc/paper_files/paper/2022/hash/b9e472cd579c83e2f6aa3459f46aac28-Abstract-Conference.html,
nips,2022,conf/nips/neurips2022,,Enhanced Bilevel Optimization via Bregman Distance.,Feihu Huang; Junyi Li; Shangqian Gao; Heng Huang,,0,http://papers.nips.cc/paper_files/paper/2022/hash/b9e98316cb72fee82cc1160da5810abc-Abstract-Conference.html,
nips,2022,conf/nips/neurips2022,,SAVi++: Towards End-to-End Object-Centric Learning from Real-World Videos.,Gamaleldin F. Elsayed; Aravindh Mahendran; Sjoerd van Steenkiste; Klaus Greff; Michael C. Mozer; Thomas Kipf,,0,http://papers.nips.cc/paper_files/paper/2022/hash/ba1a6ba05319e410f0673f8477a871e3-Abstract-Conference.html,
nips,2022,conf/nips/neurips2022,,Reincarnating Reinforcement Learning: Reusing Prior Computation to Accelerate Progress.,Rishabh Agarwal; Max Schwarzer; Pablo Samuel Castro; Aaron C. Courville; Marc G. Bellemare,,0,http://papers.nips.cc/paper_files/paper/2022/hash/ba1c5356d9164bb64c446a4b690226b0-Abstract-Conference.html,
nips,2022,conf/nips/neurips2022,,Global Linear and Local Superlinear Convergence of IRLS for Non-Smooth Robust Regression.,Liangzu Peng; Christian Kümmerle; René Vidal,,0,http://papers.nips.cc/paper_files/paper/2022/hash/ba3354bcfeae4f166a8bfe75443ac8f7-Abstract-Conference.html,
nips,2022,conf/nips/neurips2022,,Rashomon Capacity: A Metric for Predictive Multiplicity in Classification.,Hsiang Hsu; Flávio P. Calmon,,0,http://papers.nips.cc/paper_files/paper/2022/hash/ba4caa85ecdcafbf9102ab8ec384182d-Abstract-Conference.html,
nips,2022,conf/nips/neurips2022,,Inducing Equilibria via Incentives: Simultaneous Design-and-Play Ensures Global Convergence.,Boyi Liu; Jiayang Li; Zhuoran Yang; Hoi-To Wai; Mingyi Hong; Yu Marco Nie; Zhaoran Wang,,0,http://papers.nips.cc/paper_files/paper/2022/hash/ba5f85ce126aad12075a3ffa68a3e969-Abstract-Conference.html,
nips,2022,conf/nips/neurips2022,,Learning with convolution and pooling operations in kernel methods.,Theodor Misiakiewicz; Song Mei,,0,http://papers.nips.cc/paper_files/paper/2022/hash/ba8aee784ffe0813890288b334444eda-Abstract-Conference.html,
nips,2022,conf/nips/neurips2022,,"In Differential Privacy, There is Truth: on Vote-Histogram Leakage in Ensemble Private Learning.",Jiaqi Wang; Roei Schuster; Ilia Shumailov; David Lie; Nicolas Papernot,,0,http://papers.nips.cc/paper_files/paper/2022/hash/ba8d1b46292c5e82cbfb3b3dc3b968af-Abstract-Conference.html,
nips,2022,conf/nips/neurips2022,,Estimating graphical models for count data with applications to single-cell gene network.,Feiyi Xiao; Junjie Tang; Huaying Fang; Ruibin Xi,,0,http://papers.nips.cc/paper_files/paper/2022/hash/ba92705991cfbbcedc26e27e833ebbae-Abstract-Conference.html,
nips,2022,conf/nips/neurips2022,,Online Minimax Multiobjective Optimization: Multicalibeating and Other Applications.,Daniel Lee; Georgy Noarov; Mallesh M. Pai; Aaron Roth,,0,http://papers.nips.cc/paper_files/paper/2022/hash/ba942323c447c9bbb9d4b638eadefab9-Abstract-Conference.html,
nips,2022,conf/nips/neurips2022,,Roadblocks for Temporarily Disabling Shortcuts and Learning New Knowledge.,Hongjing Niu; Hanting Li; Feng Zhao; Bin Li,,0,http://papers.nips.cc/paper_files/paper/2022/hash/baaa7b5b5bbaadca5023e1ab909b8af5-Abstract-Conference.html,
nips,2022,conf/nips/neurips2022,,Random Rank: The One and Only Strategyproof and Proportionally Fair Randomized Facility Location Mechanism.,Haris Aziz; Alexander Lam; Mashbat Suzuki; Toby Walsh,,0,http://papers.nips.cc/paper_files/paper/2022/hash/bac4d92b3f6decfe47eab9a5893dd1f6-Abstract-Conference.html,
nips,2022,conf/nips/neurips2022,,Distributionally robust weighted k-nearest neighbors.,Shixiang Zhu; Liyan Xie; Minghe Zhang; Rui Gao; Yao Xie,,0,http://papers.nips.cc/paper_files/paper/2022/hash/bb0d37c6210f84abfa0fd7709edb30cb-Abstract-Conference.html,
nips,2022,conf/nips/neurips2022,,A Character-Level Length-Control Algorithm for Non-Autoregressive Sentence Summarization.,Puyuan Liu; Xiang Zhang; Lili Mou,,0,http://papers.nips.cc/paper_files/paper/2022/hash/bb0f9af6a4881ccb6e14c11b8b4be710-Abstract-Conference.html,
nips,2022,conf/nips/neurips2022,,Neural Lyapunov Control of Unknown Nonlinear Systems with Stability Guarantees.,Ruikun Zhou; Thanin Quartz; Hans De Sterck; Jun Liu,,0,http://papers.nips.cc/paper_files/paper/2022/hash/bba3160c42f4c1d23175b5abf04347f5-Abstract-Conference.html,
nips,2022,conf/nips/neurips2022,,Minimax Regret for Cascading Bandits.,Daniel Vial; Sujay Sanghavi; Sanjay Shakkottai; R. Srikant,,0,http://papers.nips.cc/paper_files/paper/2022/hash/bbb397739546de027bc81a2c2a8fb119-Abstract-Conference.html,
nips,2022,conf/nips/neurips2022,,Mean Estimation with User-level Privacy under Data Heterogeneity.,Rachel Cummings; Vitaly Feldman; Audra McMillan; Kunal Talwar,,0,http://papers.nips.cc/paper_files/paper/2022/hash/bbba680acd2826f23928c6675a19f0e7-Abstract-Conference.html,
nips,2022,conf/nips/neurips2022,,Proppo: a Message Passing Framework for Customizable and Composable Learning Algorithms.,Paavo Parmas; Takuma Seno,,0,http://papers.nips.cc/paper_files/paper/2022/hash/bbc9d480a8257889d2af88983e8b126a-Abstract-Conference.html,
nips,2022,conf/nips/neurips2022,,A Lower Bound of Hash Codes' Performance.,Xiaosu Zhu; Jingkuan Song; Yu Lei; Lianli Gao; Hengtao Shen,,0,http://papers.nips.cc/paper_files/paper/2022/hash/bbd7d8bd780fcf7143add2317ba04638-Abstract-Conference.html,
nips,2022,conf/nips/neurips2022,,Self-Supervised Image Restoration with Blurry and Noisy Pairs.,Zhilu Zhang; Rongjian Xu; Ming Liu; Zifei Yan; Wangmeng Zuo,,0,http://papers.nips.cc/paper_files/paper/2022/hash/bc12914d66b41b6bfc2d3a5decdb498b-Abstract-Conference.html,
nips,2022,conf/nips/neurips2022,,Embracing Consistency: A One-Stage Approach for Spatio-Temporal Video Grounding.,Yang Jin; Yongzhi Li; Zehuan Yuan; Yadong Mu,,0,http://papers.nips.cc/paper_files/paper/2022/hash/bc18c538d983cea434f9281148d43e1e-Abstract-Conference.html,
nips,2022,conf/nips/neurips2022,,Pitfalls of Epistemic Uncertainty Quantification through Loss Minimisation.,Viktor Bengs; Eyke Hüllermeier; Willem Waegeman,,0,http://papers.nips.cc/paper_files/paper/2022/hash/bc1d640f841f752c689aae20b31198c1-Abstract-Conference.html,
nips,2022,conf/nips/neurips2022,,Pile of Law: Learning Responsible Data Filtering from the Law and a 256GB Open-Source Legal Dataset.,Peter Henderson; Mark S. Krass; Lucia Zheng; Neel Guha; Christopher D. Manning; Dan Jurafsky; Daniel E. Ho,,0,http://papers.nips.cc/paper_files/paper/2022/hash/bc218a0c656e49d4b086975a9c785f47-Abstract-Datasets_and_Benchmarks.html,
nips,2022,conf/nips/neurips2022,,Active-Passive SimStereo - Benchmarking the Cross-Generalization Capabilities of Deep Learning-based Stereo Methods.,Laurent Valentin Jospin; Allen Antony; Lian Xu; Hamid Laga; Farid Boussaïd; Mohammed Bennamoun,,0,http://papers.nips.cc/paper_files/paper/2022/hash/bc3a68a20e5c8ba5cbefc1ecf74bfaaa-Abstract-Datasets_and_Benchmarks.html,
nips,2022,conf/nips/neurips2022,,Back Razor: Memory-Efficient Transfer Learning by Self-Sparsified Backpropagation.,Ziyu Jiang; Xuxi Chen; Xueqin Huang; Xianzhi Du; Denny Zhou; Zhangyang Wang,,0,http://papers.nips.cc/paper_files/paper/2022/hash/bc6a1f968f8b1dae3e880f3f723d7d46-Abstract-Conference.html,
nips,2022,conf/nips/neurips2022,,Patching open-vocabulary models by interpolating weights.,Gabriel Ilharco; Mitchell Wortsman; Samir Yitzhak Gadre; Shuran Song; Hannaneh Hajishirzi; Simon Kornblith; Ali Farhadi; Ludwig Schmidt,,0,http://papers.nips.cc/paper_files/paper/2022/hash/bc6cddcd5d325e1c0f826066c1ad0215-Abstract-Conference.html,
nips,2022,conf/nips/neurips2022,,Training stochastic stabilized supralinear networks by dynamics-neutral growth.,Wayne Soo; Máté Lengyel,,0,http://papers.nips.cc/paper_files/paper/2022/hash/bc827452450356f9f558f4e4568d553b-Abstract-Conference.html,
nips,2022,conf/nips/neurips2022,,Post-hoc estimators for learning to defer to an expert.,Harikrishna Narasimhan; Wittawat Jitkrittum; Aditya Krishna Menon; Ankit Singh Rawat; Sanjiv Kumar,,0,http://papers.nips.cc/paper_files/paper/2022/hash/bc8f76d9caadd48f77025b1c889d2e2d-Abstract-Conference.html,
nips,2022,conf/nips/neurips2022,,Learning Generalizable Part-based Feature Representation for 3D Point Clouds.,Xin Wei; Xiang Gu; Jian Sun,,0,http://papers.nips.cc/paper_files/paper/2022/hash/bc943cd038a5531d5433b1431c822c01-Abstract-Conference.html,
nips,2022,conf/nips/neurips2022,,FourierFormer: Transformer Meets Generalized Fourier Integral Theorem.,Tan Nguyen; Minh Pham; Tam Nguyen; Khai Nguyen; Stanley J. Osher; Nhat Ho,,0,http://papers.nips.cc/paper_files/paper/2022/hash/bc968adbdff4a2551649d464b83f264a-Abstract-Conference.html,
nips,2022,conf/nips/neurips2022,,Learning Multi-resolution Functional Maps with Spectral Attention for Robust Shape Matching.,Lei Li; Nicolas Donati; Maks Ovsjanikov,,0,http://papers.nips.cc/paper_files/paper/2022/hash/bcade016e3004543b289b33e7deb7472-Abstract-Conference.html,
nips,2022,conf/nips/neurips2022,,Label-invariant Augmentation for Semi-Supervised Graph Classification.,Han Yue; Chunhui Zhang; Chuxu Zhang; Hongfu Liu,,0,http://papers.nips.cc/paper_files/paper/2022/hash/bcc0b4fc47c21e143461bb98c1d55926-Abstract-Conference.html,
nips,2022,conf/nips/neurips2022,,Practical Adversarial Multivalid Conformal Prediction.,Osbert Bastani; Varun Gupta; Christopher Jung; Georgy Noarov; Ramya Ramalingam; Aaron Roth,,0,http://papers.nips.cc/paper_files/paper/2022/hash/bcdaaa1aec3ae2aa39542acefdec4e4b-Abstract-Conference.html,
nips,2022,conf/nips/neurips2022,,Test-Time Training with Masked Autoencoders.,Yossi Gandelsman; Yu Sun; Xinlei Chen; Alexei A. Efros,,0,http://papers.nips.cc/paper_files/paper/2022/hash/bcdec1c2d60f94a93b6e36f937aa0530-Abstract-Conference.html,
nips,2022,conf/nips/neurips2022,,Constraining Gaussian Processes to Systems of Linear Ordinary Differential Equations.,Andreas Besginow; Markus Lange-Hegermann,,0,http://papers.nips.cc/paper_files/paper/2022/hash/bcef27c5825d1ed8757290f237b2d851-Abstract-Conference.html,
nips,2022,conf/nips/neurips2022,,So3krates: Equivariant attention for interactions on arbitrary length-scales in molecular systems.,J. Thorben Frank; Oliver T. Unke; Klaus-Robert Müller,,0,http://papers.nips.cc/paper_files/paper/2022/hash/bcf4ca90a8d405201d29dd47d75ac896-Abstract-Conference.html,
nips,2022,conf/nips/neurips2022,,HyperDomainNet: Universal Domain Adaptation for Generative Adversarial Networks.,Aibek Alanov; Vadim Titov; Dmitry P. Vetrov,,0,http://papers.nips.cc/paper_files/paper/2022/hash/bd1fc5cbedfe4d90d0ac2d23966fa27e-Abstract-Conference.html,
nips,2022,conf/nips/neurips2022,,Multiagent Q-learning with Sub-Team Coordination.,Wenhan Huang; Kai Li; Kun Shao; Tianze Zhou; Matthew E. Taylor; Jun Luo; Dongge Wang; Hangyu Mao; Jianye Hao; Jun Wang; Xiaotie Deng,,0,http://papers.nips.cc/paper_files/paper/2022/hash/bd31bfd4caa85bffe07a35568182cdfa-Abstract-Conference.html,
nips,2022,conf/nips/neurips2022,,CLiMB: A Continual Learning Benchmark for Vision-and-Language Tasks.,Tejas Srinivasan; Ting-Yun Chang; Leticia Leonor Pinto Alva; Georgios Chochlakis; Mohammad Rostami; Jesse Thomason,,0,http://papers.nips.cc/paper_files/paper/2022/hash/bd3611971089d466ab4ca96a20f7ab13-Abstract-Datasets_and_Benchmarks.html,
nips,2022,conf/nips/neurips2022,,Bidirectional Learning for Offline Infinite-width Model-based Optimization.,Can Chen; Yingxue Zhang; Jie Fu; Xue (Steve) Liu; Mark Coates,,0,http://papers.nips.cc/paper_files/paper/2022/hash/bd391cf5bdc4b63674d6da3edc1bde0d-Abstract-Conference.html,
nips,2022,conf/nips/neurips2022,,Differentially Private Model Compression.,Fatemehsadat Mireshghallah; Arturs Backurs; Huseyin A. Inan; Lukas Wutschitz; Janardhan Kulkarni,,0,http://papers.nips.cc/paper_files/paper/2022/hash/bd6bb13e78da078d8adcabbe6d9ca737-Abstract-Conference.html,
nips,2022,conf/nips/neurips2022,,Dual-Curriculum Contrastive Multi-Instance Learning for Cancer Prognosis Analysis with Whole Slide Images.,Chao Tu; Yu Zhang; Zhenyuan Ning,,0,http://papers.nips.cc/paper_files/paper/2022/hash/bd8b52c2fefdb37e3b3953a37408e9dc-Abstract-Conference.html,
nips,2022,conf/nips/neurips2022,,Meta-Complementing the Semantics of Short Texts in Neural Topic Models.,Delvin Ce Zhang; Hady W. Lauw,,0,http://papers.nips.cc/paper_files/paper/2022/hash/bda5c35eded86adaf0231748e3ce071c-Abstract-Conference.html,
nips,2022,conf/nips/neurips2022,,Unified Optimal Transport Framework for Universal Domain Adaptation.,Wanxing Chang; Ye Shi; Hoang Tuan; Jingya Wang,,0,http://papers.nips.cc/paper_files/paper/2022/hash/bda6843dbbca0b09b8769122e0928fad-Abstract-Conference.html,
nips,2022,conf/nips/neurips2022,,GBA: A Tuning-free Approach to Switch between Synchronous and Asynchronous Training for Recommendation Models.,Wenbo Su; Yuanxing Zhang; Yufeng Cai; Kaixu Ren; Pengjie Wang; Huimin Yi; Yue Song; Jing Chen; Hongbo Deng; Jian Xu; Lin Qu; Bo Zheng,,0,http://papers.nips.cc/paper_files/paper/2022/hash/be0a8ecf8b2743a4117557c5eca0fb79-Abstract-Conference.html,
nips,2022,conf/nips/neurips2022,,TUSK: Task-Agnostic Unsupervised Keypoints.,Yuhe Jin; Weiwei Sun; Jan Hosang; Eduard Trulls; Kwang Moo Yi,,0,http://papers.nips.cc/paper_files/paper/2022/hash/be53aed1708d5828441087e5c7b97440-Abstract-Conference.html,
nips,2022,conf/nips/neurips2022,,Multi-block Min-max Bilevel Optimization with Applications in Multi-task Deep AUC Maximization.,Quanqi Hu; Yongjian Zhong; Tianbao Yang,,0,http://papers.nips.cc/paper_files/paper/2022/hash/be76ca290f1b30bd16cef178bfa8adbe-Abstract-Conference.html,
nips,2022,conf/nips/neurips2022,,Coresets for Vertical Federated Learning: Regularized Linear Regression and $K$-Means Clustering.,Lingxiao Huang; Zhize Li; Jialin Sun; Haoyu Zhao,,0,http://papers.nips.cc/paper_files/paper/2022/hash/be7b70477c8fca697f14b1dbb1c086d1-Abstract-Conference.html,
nips,2022,conf/nips/neurips2022,,Class-Aware Adversarial Transformers for Medical Image Segmentation.,Chenyu You; Ruihan Zhao; Fenglin Liu; Siyuan Dong; Sandeep Chinchali; Ufuk Topcu; Lawrence H. Staib; James S. Duncan,,0,http://papers.nips.cc/paper_files/paper/2022/hash/be99227ef4a4de84bb45d7dc7b53f808-Abstract-Conference.html,
nips,2022,conf/nips/neurips2022,,MCL-GAN: Generative Adversarial Networks with Multiple Specialized Discriminators.,Jinyoung Choi; Bohyung Han,,0,http://papers.nips.cc/paper_files/paper/2022/hash/beac6bfb7eac3d651307c16ac747df01-Abstract-Conference.html,
nips,2022,conf/nips/neurips2022,,Unsupervised Visual Representation Learning via Mutual Information Regularized Assignment.,Dong Hoon Lee; Sungik Choi; Hyunwoo J. Kim; Sae-Young Chung,,0,http://papers.nips.cc/paper_files/paper/2022/hash/bedc61a9936af18cb51b7c5e8f3b89a3-Abstract-Conference.html,
nips,2022,conf/nips/neurips2022,,Mind Reader: Reconstructing complex images from brain activities.,Sikun Lin; Thomas Sprague; Ambuj K. Singh,,0,http://papers.nips.cc/paper_files/paper/2022/hash/bee5125b773414d3d6eeb4334fbc5453-Abstract-Conference.html,
nips,2022,conf/nips/neurips2022,,A Few Expert Queries Suffices for Sample-Efficient RL with Resets and Linear Value Approximation.,Philip Amortila; Nan Jiang; Dhruv Madeka; Dean P. Foster,,0,http://papers.nips.cc/paper_files/paper/2022/hash/bef8e5620c699630405adafaa86cb038-Abstract-Conference.html,
nips,2022,conf/nips/neurips2022,,Subsidiary Prototype Alignment for Universal Domain Adaptation.,Jogendra Nath Kundu; Suvaansh Bhambri; Akshay R. Kulkarni; Hiran Sarkar; Varun Jampani; Venkatesh Babu R.,,0,http://papers.nips.cc/paper_files/paper/2022/hash/bf121b033db3bac31c3193e8a0dcbf66-Abstract-Conference.html,
nips,2022,conf/nips/neurips2022,,Dynamic Inverse Reinforcement Learning for Characterizing Animal Behavior.,Zoe Ashwood; Aditi Jha; Jonathan W. Pillow,,0,http://papers.nips.cc/paper_files/paper/2022/hash/bf215fa7fe70a38c5e967e59c44a99d0-Abstract-Conference.html,
nips,2022,conf/nips/neurips2022,,FedRolex: Model-Heterogeneous Federated Learning with Rolling Sub-Model Extraction.,Samiul Alam; Luyang Liu; Ming Yan; Mi Zhang,,0,http://papers.nips.cc/paper_files/paper/2022/hash/bf5311df07f3efce97471921e6d2f159-Abstract-Conference.html,
nips,2022,conf/nips/neurips2022,,Multi-Lingual Acquisition on Multimodal Pre-training for Cross-modal Retrieval.,Liang Zhang; Anwen Hu; Qin Jin,,0,http://papers.nips.cc/paper_files/paper/2022/hash/bfadef437ed27372648714c930c3a77a-Abstract-Conference.html,
nips,2022,conf/nips/neurips2022,,Manifold Interpolating Optimal-Transport Flows for Trajectory Inference.,Guillaume Huguet; Daniel Sumner Magruder; Alexander Tong; Oluwadamilola Fasina; Manik Kuchroo; Guy Wolf; Smita Krishnaswamy,,0,http://papers.nips.cc/paper_files/paper/2022/hash/bfc03f077688d8885c0a9389d77616d0-Abstract-Conference.html,
nips,2022,conf/nips/neurips2022,,Depth is More Powerful than Width with Prediction Concatenation in Deep Forest.,Shen-Huan Lyu; Yi-Xiao He; Zhi-Hua Zhou,,0,http://papers.nips.cc/paper_files/paper/2022/hash/c017e92288b5056c578bb6b0b69d9e76-Abstract-Conference.html,
nips,2022,conf/nips/neurips2022,,Logical Activation Functions: Logit-space equivalents of Probabilistic Boolean Operators.,Scott C. Lowe; Robert Earle; Jason d'Eon; Thomas Trappenberg; Sageev Oore,,0,http://papers.nips.cc/paper_files/paper/2022/hash/c05144b635df16ac9bbf8246bbbd55ca-Abstract-Conference.html,
nips,2022,conf/nips/neurips2022,,An Investigation into Whitening Loss for Self-supervised Learning.,Xi Weng; Lei Huang; Lei Zhao; Rao Muhammad Anwer; Salman H. Khan; Fahad Shahbaz Khan,,0,http://papers.nips.cc/paper_files/paper/2022/hash/c057cb81b8d3c67093427bf1c16a4e9f-Abstract-Conference.html,
nips,2022,conf/nips/neurips2022,,Geometric Knowledge Distillation: Topology Compression for Graph Neural Networks.,Chenxiao Yang; Qitian Wu; Junchi Yan,,0,http://papers.nips.cc/paper_files/paper/2022/hash/c06f788963f0ce069f5b2dbf83fe7822-Abstract-Conference.html,
nips,2022,conf/nips/neurips2022,,A Benchmark for Compositional Visual Reasoning.,Aimen Zerroug; Mohit Vaishnav; Julien Colin; Sebastian Musslick; Thomas Serre,,0,http://papers.nips.cc/paper_files/paper/2022/hash/c08ee8fe3d19521f3bfa4102898329fd-Abstract-Datasets_and_Benchmarks.html,
nips,2022,conf/nips/neurips2022,,Learning Articulated Rigid Body Dynamics with Lagrangian Graph Neural Network.,Ravinder Bhattoo; Sayan Ranu; N. M. Anoop Krishnan,,0,http://papers.nips.cc/paper_files/paper/2022/hash/c0a9c840d651c295c095dad40e06fed9-Abstract-Conference.html,
nips,2022,conf/nips/neurips2022,,Myriad: a real-world testbed to bridge trajectory optimization and deep learning.,Nikolaus H. R. Howe; Simon Dufort-Labbé; Nitarshan Rajkumar; Pierre-Luc Bacon,,0,http://papers.nips.cc/paper_files/paper/2022/hash/c0b91f9a3587bf35287f41dba5d20233-Abstract-Datasets_and_Benchmarks.html,
nips,2022,conf/nips/neurips2022,,Batch Bayesian optimisation via density-ratio estimation with guarantees.,Rafael Oliveira; Louis C. Tiao; Fabio T. Ramos,,0,http://papers.nips.cc/paper_files/paper/2022/hash/c0d5a28eb3949efbedbe3e41751e3ffc-Abstract-Conference.html,
nips,2022,conf/nips/neurips2022,,Amplifying Membership Exposure via Data Poisoning.,Yufei Chen; Chao Shen; Yun Shen; Cong Wang; Yang Zhang,,0,http://papers.nips.cc/paper_files/paper/2022/hash/c0f240bb986df54b38026398da1ae72a-Abstract-Conference.html,
nips,2022,conf/nips/neurips2022,,Boosting the Transferability of Adversarial Attacks with Reverse Adversarial Perturbation.,Zeyu Qin; Yanbo Fan; Yi Liu; Li Shen; Yong Zhang; Jue Wang; Baoyuan Wu,,0,http://papers.nips.cc/paper_files/paper/2022/hash/c0f9419caa85d7062c7e6d621a335726-Abstract-Conference.html,
nips,2022,conf/nips/neurips2022,,Extra-Newton: A First Approach to Noise-Adaptive Accelerated Second-Order Methods.,Kimon Antonakopoulos; Ali Kavis; Volkan Cevher,,0,http://papers.nips.cc/paper_files/paper/2022/hash/c10804702be5a0cca89331315413f1a2-Abstract-Conference.html,
nips,2022,conf/nips/neurips2022,,FETA: Towards Specializing Foundational Models for Expert Task Applications.,Amit Alfassy; Assaf Arbelle; Oshri Halimi; Sivan Harary; Roei Herzig; Eli Schwartz; Rameswar Panda; Michele Dolfi; Christoph Auer; Peter W. J. Staar; Kate Saenko; Rogério Feris; Leonid Karlinsky,,0,http://papers.nips.cc/paper_files/paper/2022/hash/c12dd3034259fc000d80db823041c187-Abstract-Datasets_and_Benchmarks.html,
nips,2022,conf/nips/neurips2022,,Global Convergence of Federated Learning for Mixed Regression.,Lili Su; Jiaming Xu; Pengkun Yang,,0,http://papers.nips.cc/paper_files/paper/2022/hash/c132c02176577c4319a878f6417a331a-Abstract-Conference.html,
nips,2022,conf/nips/neurips2022,,BayesPCN: A Continually Learnable Predictive Coding Associative Memory.,Jinsoo Yoo; Frank Wood,,0,http://papers.nips.cc/paper_files/paper/2022/hash/c13d5a10028586fdc15ee7da97b7563f-Abstract-Conference.html,
nips,2022,conf/nips/neurips2022,,Optimizing Data Collection for Machine Learning.,Rafid Mahmood; James Lucas; José M. Álvarez; Sanja Fidler; Marc T. Law,,0,http://papers.nips.cc/paper_files/paper/2022/hash/c1449acc2e64050d79c2830964f8515f-Abstract-Conference.html,
nips,2022,conf/nips/neurips2022,,DP-PCA: Statistically Optimal and Differentially Private PCA.,Xiyang Liu; Weihao Kong; Prateek Jain; Sewoong Oh,,0,http://papers.nips.cc/paper_files/paper/2022/hash/c150ebe1b9d1ca0eb61502bf979fa87d-Abstract-Conference.html,
nips,2022,conf/nips/neurips2022,,Semantic Probabilistic Layers for Neuro-Symbolic Learning.,Kareem Ahmed; Stefano Teso; Kai-Wei Chang; Guy Van den Broeck; Antonio Vergari,,0,http://papers.nips.cc/paper_files/paper/2022/hash/c182ec594f38926b7fcb827635b9a8f4-Abstract-Conference.html,
nips,2022,conf/nips/neurips2022,,Adapting to Online Label Shift with Provable Guarantees.,Yong Bai; Yu-Jie Zhang; Peng Zhao; Masashi Sugiyama; Zhi-Hua Zhou,,0,http://papers.nips.cc/paper_files/paper/2022/hash/c19c4def293b6a63db1ff27143dd4f10-Abstract-Conference.html,
nips,2022,conf/nips/neurips2022,,CAGroup3D: Class-Aware Grouping for 3D Object Detection on Point Clouds.,Haiyang Wang; Lihe Ding; Shaocong Dong; Shaoshuai Shi; Aoxue Li; Jianan Li; Zhenguo Li; Liwei Wang,,0,http://papers.nips.cc/paper_files/paper/2022/hash/c1aaf7c3f306fe94f77236dc0756d771-Abstract-Conference.html,
nips,2022,conf/nips/neurips2022,,Revisiting Injective Attacks on Recommender Systems.,Haoyang Li; Shimin Di; Lei Chen,,0,http://papers.nips.cc/paper_files/paper/2022/hash/c1bb0e3b062f0a443f2cc8a4ec4bb30d-Abstract-Conference.html,
