venue,year,identifier,heading,title,authors,page_range,length,electronic_edition,comment
nips,2022,conf/nips/neurips2022,,Low-rank lottery tickets: finding efficient low-rank neural networks via matrix differential equations.,Steffen Schotthöfer; Emanuele Zangrando; Jonas Kusch; Gianluca Ceruti; Francesco Tudisco,,0,http://papers.nips.cc/paper_files/paper/2022/hash/7e98b00eeafcdaeb0c5661fb9355be3a-Abstract-Conference.html,
nips,2022,conf/nips/neurips2022,,Causality-driven Hierarchical Structure Discovery for Reinforcement Learning.,Shaohui Peng; Xing Hu; Rui Zhang; Ke Tang; Jiaming Guo; Qi Yi; Ruizhi Chen; Xishan Zhang; Zidong Du; Ling Li; Qi Guo; Yunji Chen,,0,http://papers.nips.cc/paper_files/paper/2022/hash/7e9fbd01b3084956dd8a070c7bf30bad-Abstract-Conference.html,
nips,2022,conf/nips/neurips2022,,Pay attention to your loss : understanding misconceptions about Lipschitz neural networks.,Louis Béthune; Thibaut Boissin; Mathieu Serrurier; Franck Mamalet; Corentin Friedrich; Alberto González-Sanz,,0,http://papers.nips.cc/paper_files/paper/2022/hash/7eb3d8ae592966543170a65e6b698828-Abstract-Conference.html,
nips,2022,conf/nips/neurips2022,,Large-Scale Retrieval for Reinforcement Learning.,Peter Conway Humphreys; Arthur Guez; Olivier Tieleman; Laurent Sifre; Theophane Weber; Timothy P. Lillicrap,,0,http://papers.nips.cc/paper_files/paper/2022/hash/7eca17ef54789b0663cab421f2e9dbf5-Abstract-Conference.html,
nips,2022,conf/nips/neurips2022,,Gradient flow dynamics of shallow ReLU networks for square loss and orthogonal inputs.,Etienne Boursier; Loucas Pillaud-Vivien; Nicolas Flammarion,,0,http://papers.nips.cc/paper_files/paper/2022/hash/7eeb9af3eb1f48e29c05e8dd3342b286-Abstract-Conference.html,
nips,2022,conf/nips/neurips2022,,Weisfeiler and Leman Go Walking: Random Walk Kernels Revisited.,Nils M. Kriege,,0,http://papers.nips.cc/paper_files/paper/2022/hash/7eed2822411dc37b3768ae04561caafa-Abstract-Conference.html,
nips,2022,conf/nips/neurips2022,,Outsourcing Training without Uploading Data via Efficient Collaborative Open-Source Sampling.,Junyuan Hong; Lingjuan Lyu; Jiayu Zhou; Michael Spranger,,0,http://papers.nips.cc/paper_files/paper/2022/hash/7efe88bb4138d602e56637cfcf713654-Abstract-Conference.html,
nips,2022,conf/nips/neurips2022,,Multi-agent Dynamic Algorithm Configuration.,Ke Xue; Jiacheng Xu; Lei Yuan; Miqing Li; Chao Qian; Zongzhang Zhang; Yang Yu,,0,http://papers.nips.cc/paper_files/paper/2022/hash/7f02b39c0424cc4a422994289ca03e46-Abstract-Conference.html,
nips,2022,conf/nips/neurips2022,,TaSIL: Taylor Series Imitation Learning.,Daniel Pfrommer; Thomas T. C. K. Zhang; Stephen Tu; Nikolai Matni,,0,http://papers.nips.cc/paper_files/paper/2022/hash/7f10c3d66c3b7863a9cda255dcac5bb7-Abstract-Conference.html,
nips,2022,conf/nips/neurips2022,,Experimental Design for Linear Functionals in Reproducing Kernel Hilbert Spaces.,Mojmir Mutny; Andreas Krause,,0,http://papers.nips.cc/paper_files/paper/2022/hash/7f2223201858b6ff4cc1832d8856459b-Abstract-Conference.html,
nips,2022,conf/nips/neurips2022,,Continuous MDP Homomorphisms and Homomorphic Policy Gradient.,Sahand Rezaei-Shoshtari; Rosie Zhao; Prakash Panangaden; David Meger; Doina Precup,,0,http://papers.nips.cc/paper_files/paper/2022/hash/7f44f98e5e70dea605d0c5baca231c58-Abstract-Conference.html,
nips,2022,conf/nips/neurips2022,,Score-based Generative Modeling Secretly Minimizes the Wasserstein Distance.,Dohyun Kwon; Ying Fan; Kangwook Lee,,0,http://papers.nips.cc/paper_files/paper/2022/hash/7f52f6b8f107931127eefe15429ee278-Abstract-Conference.html,
nips,2022,conf/nips/neurips2022,,Uncertainty-Aware Reinforcement Learning for Risk-Sensitive Player Evaluation in Sports Game.,Guiliang Liu; Yudong Luo; Oliver Schulte; Pascal Poupart,,0,http://papers.nips.cc/paper_files/paper/2022/hash/7f6e51d8298aa01b084b700ab91aff94-Abstract-Conference.html,
nips,2022,conf/nips/neurips2022,,End-to-end Algorithm Synthesis with Recurrent Networks: Extrapolation without Overthinking.,Arpit Bansal; Avi Schwarzschild; Eitan Borgnia; Zeyad Emam; Furong Huang; Micah Goldblum; Tom Goldstein,,0,http://papers.nips.cc/paper_files/paper/2022/hash/7f70331dbe58ad59d83941dfa7d975aa-Abstract-Conference.html,
nips,2022,conf/nips/neurips2022,,Smooth Fictitious Play in Stochastic Games with Perturbed Payoffs and Unknown Transitions.,Lucas Baudin; Rida Laraki,,0,http://papers.nips.cc/paper_files/paper/2022/hash/7f7fa581cc8a1970a4332920cdf87395-Abstract-Conference.html,
nips,2022,conf/nips/neurips2022,,OOD Link Prediction Generalization Capabilities of Message-Passing GNNs in Larger Test Graphs.,Yangze Zhou; Gitta Kutyniok; Bruno Ribeiro,,0,http://papers.nips.cc/paper_files/paper/2022/hash/7f88a8478c4ae97819ccffa1e80e7a7b-Abstract-Conference.html,
nips,2022,conf/nips/neurips2022,,Algorithms with Prediction Portfolios.,Michael Dinitz; Sungjin Im; Thomas Lavastida; Benjamin Moseley; Sergei Vassilvitskii,,0,http://papers.nips.cc/paper_files/paper/2022/hash/7f9220f90cc85b0da693643add6618e6-Abstract-Conference.html,
nips,2022,conf/nips/neurips2022,,A Unified Hard-Constraint Framework for Solving Geometrically Complex PDEs.,Songming Liu; Zhongkai Hao; Chengyang Ying; Hang Su; Jun Zhu; Ze Cheng,,0,http://papers.nips.cc/paper_files/paper/2022/hash/7f970edb14104b81e70e3b03e1f5214f-Abstract-Conference.html,
nips,2022,conf/nips/neurips2022,,Instability and Local Minima in GAN Training with Kernel Discriminators.,Evan Becker; Parthe Pandit; Sundeep Rangan; Alyson K. Fletcher,,0,http://papers.nips.cc/paper_files/paper/2022/hash/7f9a44cb707ede42a659ad85d940dd55-Abstract-Conference.html,
nips,2022,conf/nips/neurips2022,,Versatile Multi-stage Graph Neural Network for Circuit Representation.,Shuwen Yang; Zhihao Yang; Dong Li; Yingxue Zhang; Zhanguang Zhang; Guojie Song; Jianye Hao,,0,http://papers.nips.cc/paper_files/paper/2022/hash/7fa548155f40c014372146be387c4f6a-Abstract-Conference.html,
nips,2022,conf/nips/neurips2022,,Non-Stationary Bandits under Recharging Payoffs: Improved Planning with Sublinear Regret.,Orestis Papadigenopoulos; Constantine Caramanis; Sanjay Shakkottai,,0,http://papers.nips.cc/paper_files/paper/2022/hash/7fccdff3f1457cb7b846596c76c23abd-Abstract-Conference.html,
nips,2022,conf/nips/neurips2022,,Optimal and Adaptive Monteiro-Svaiter Acceleration.,Yair Carmon; Danielle Hausler; Arun Jambulapati; Yujia Jin; Aaron Sidford,,0,http://papers.nips.cc/paper_files/paper/2022/hash/7ff97417474268e6b5a38bcbfae04944-Abstract-Conference.html,
nips,2022,conf/nips/neurips2022,,Chroma-VAE: Mitigating Shortcut Learning with Generative Classifiers.,Wanqian Yang; Polina Kirichenko; Micah Goldblum; Andrew Gordon Wilson,,0,http://papers.nips.cc/paper_files/paper/2022/hash/80098914b3b3bad79b80377751a85430-Abstract-Conference.html,
nips,2022,conf/nips/neurips2022,,SparCL: Sparse Continual Learning on the Edge.,Zifeng Wang; Zheng Zhan; Yifan Gong; Geng Yuan; Wei Niu; Tong Jian; Bin Ren; Stratis Ioannidis; Yanzhi Wang; Jennifer G. Dy,,0,http://papers.nips.cc/paper_files/paper/2022/hash/80133d0f6eccaace15508f91e3c5a93c-Abstract-Conference.html,
nips,2022,conf/nips/neurips2022,,Adaptively Exploiting d-Separators with Causal Bandits.,Blair L. Bilodeau; Linbo Wang; Daniel M. Roy,,0,http://papers.nips.cc/paper_files/paper/2022/hash/801ec05b0aae9fcd2ef35c168bd538e0-Abstract-Conference.html,
nips,2022,conf/nips/neurips2022,,Spectrum Random Masking for Generalization in Image-based Reinforcement Learning.,Yangru Huang; Peixi Peng; Yifan Zhao; Guangyao Chen; Yonghong Tian,,0,http://papers.nips.cc/paper_files/paper/2022/hash/802a4350ca4fced76b13b8b320af1543-Abstract-Conference.html,
nips,2022,conf/nips/neurips2022,,Contrastive Graph Structure Learning via Information Bottleneck for Recommendation.,Chunyu Wei; Jian Liang; Di Liu; Fei Wang,,0,http://papers.nips.cc/paper_files/paper/2022/hash/803b9c4a8e4784072fdd791c54d614e2-Abstract-Conference.html,
nips,2022,conf/nips/neurips2022,,Pyramid Attention For Source Code Summarization.,Lei Chai; Ming Li,,0,http://papers.nips.cc/paper_files/paper/2022/hash/803cb038c7df56122e55a06c2856938f-Abstract-Conference.html,
nips,2022,conf/nips/neurips2022,,SIREN: Shaping Representations for Detecting Out-of-Distribution Objects.,Xuefeng Du; Gabriel Gozum; Yifei Ming; Yixuan Li,,0,http://papers.nips.cc/paper_files/paper/2022/hash/804dbf8d3b8eee1ef875c6857efc64eb-Abstract-Conference.html,
nips,2022,conf/nips/neurips2022,,CLOOB: Modern Hopfield Networks with InfoLOOB Outperform CLIP.,Andreas Fürst; Elisabeth Rumetshofer; Johannes Lehner; Viet T. Tran; Fei Tang; Hubert Ramsauer; David P. Kreil; Michael Kopp; Günter Klambauer; Angela Bitto; Sepp Hochreiter,,0,http://papers.nips.cc/paper_files/paper/2022/hash/8078e76f913e31b8467e85b4c0f0d22b-Abstract-Conference.html,
nips,2022,conf/nips/neurips2022,,I2Q: A Fully Decentralized Q-Learning Algorithm.,Jiechuan Jiang; Zongqing Lu,,0,http://papers.nips.cc/paper_files/paper/2022/hash/8078e8c3055303a884ffae2d3ea00338-Abstract-Conference.html,
nips,2022,conf/nips/neurips2022,,Planning to the Information Horizon of BAMDPs via Epistemic State Abstraction.,Dilip Arumugam; Satinder Singh,,0,http://papers.nips.cc/paper_files/paper/2022/hash/80b7bec60081f95d900973509744a306-Abstract-Conference.html,
nips,2022,conf/nips/neurips2022,,AutoST: Towards the Universal Modeling of Spatio-temporal Sequences.,Jianxin Li; Shuai Zhang; Hui Xiong; Haoyi Zhou,,0,http://papers.nips.cc/paper_files/paper/2022/hash/80d46bb66ea003f4b29fa6013905d50a-Abstract-Conference.html,
nips,2022,conf/nips/neurips2022,,Constrained Langevin Algorithms with L-mixing External Random Variables.,Yuping Zheng; Andrew G. Lamperski,,0,http://papers.nips.cc/paper_files/paper/2022/hash/811d35e47edbb191c19151f3c5f80f53-Abstract-Conference.html,
nips,2022,conf/nips/neurips2022,,Language Conditioned Spatial Relation Reasoning for 3D Object Grounding.,Shizhe Chen; Pierre-Louis Guhur; Makarand Tapaswi; Cordelia Schmid; Ivan Laptev,,0,http://papers.nips.cc/paper_files/paper/2022/hash/819aaee144cb40e887a4aa9e781b1547-Abstract-Conference.html,
nips,2022,conf/nips/neurips2022,,MVP-N: A Dataset and Benchmark for Real-World Multi-View Object Classification.,Ren Wang; Jiayue Wang; Tae Sung Kim; Jinsung Kim; Hyuk-Jae Lee,,0,http://papers.nips.cc/paper_files/paper/2022/hash/819b8452be7d6af1351d4c4f9cbdbd9b-Abstract-Datasets_and_Benchmarks.html,
nips,2022,conf/nips/neurips2022,,Data Augmentation for Compositional Data: Advancing Predictive Models of the Microbiome.,Elliott Gordon-Rodríguez; Thomas P. Quinn; John P. Cunningham,,0,http://papers.nips.cc/paper_files/paper/2022/hash/81a28be483155f802ddef448d6fc4b57-Abstract-Conference.html,
nips,2022,conf/nips/neurips2022,,On the Robustness of Deep Clustering Models: Adversarial Attacks and Defenses.,Anshuman Chhabra; Ashwin Sekhari; Prasant Mohapatra,,0,http://papers.nips.cc/paper_files/paper/2022/hash/81b8390039b7302c909cb769f8b6cd93-Abstract-Conference.html,
nips,2022,conf/nips/neurips2022,,Exploiting the Relationship Between Kendall's Rank Correlation and Cosine Similarity for Attribution Protection.,Fan Wang; Adams Wai-Kin Kong,,0,http://papers.nips.cc/paper_files/paper/2022/hash/81cca94f16f20d5548c76c3344b27dea-Abstract-Conference.html,
nips,2022,conf/nips/neurips2022,,Wavelet Feature Maps Compression for Image-to-Image CNNs.,Shahaf E. Finder; Yair Zohav; Maor Ashkenazi; Eran Treister,,0,http://papers.nips.cc/paper_files/paper/2022/hash/81f19c0e9f3e06c831630ab6662fd8ea-Abstract-Conference.html,
nips,2022,conf/nips/neurips2022,,Biologically plausible solutions for spiking networks with efficient coding.,Veronika Koren; Stefano Panzeri,,0,http://papers.nips.cc/paper_files/paper/2022/hash/820c61a0cd419163ccbd2c33b268816e-Abstract-Conference.html,
nips,2022,conf/nips/neurips2022,,Finding Optimal Arms in Non-stochastic Combinatorial Bandits with Semi-bandit Feedback and Finite Budget.,Jasmin Brandt; Viktor Bengs; Björn Haddenhorst; Eyke Hüllermeier,,0,http://papers.nips.cc/paper_files/paper/2022/hash/820e95997d050178323230e316897c38-Abstract-Conference.html,
nips,2022,conf/nips/neurips2022,,Graph Neural Networks are Dynamic Programmers.,Andrew Joseph Dudzik; Petar Velickovic,,0,http://papers.nips.cc/paper_files/paper/2022/hash/8248b1ded388fcdbbd121bcdfea3068c-Abstract-Conference.html,
nips,2022,conf/nips/neurips2022,,Evaluated CMI Bounds for Meta Learning: Tightness and Expressiveness.,Fredrik Hellström; Giuseppe Durisi,,0,http://papers.nips.cc/paper_files/paper/2022/hash/824c9b06e0b21b2a8bb74fcc8a558be4-Abstract-Conference.html,
nips,2022,conf/nips/neurips2022,,SPD: Synergy Pattern Diversifying Oriented Unsupervised Multi-agent Reinforcement Learning.,Yuhang Jiang; Jianzhun Shao; Shuncheng He; Hongchang Zhang; Xiangyang Ji,,0,http://papers.nips.cc/paper_files/paper/2022/hash/825341ab91db01bf063add41ac022702-Abstract-Conference.html,
nips,2022,conf/nips/neurips2022,,Self-Aware Personalized Federated Learning.,Huili Chen; Jie Ding; Eric W. Tramel; Shuang Wu; Anit Kumar Sahu; Salman Avestimehr; Tao Zhang,,0,http://papers.nips.cc/paper_files/paper/2022/hash/8265d7bb2db42e86637001db2c46619f-Abstract-Conference.html,
nips,2022,conf/nips/neurips2022,,Additive MIL: Intrinsically Interpretable Multiple Instance Learning for Pathology.,Syed Ashar Javed; Dinkar Juyal; Harshith Padigela; Amaro Taylor-Weiner; Limin Yu; Aaditya Prakash,,0,http://papers.nips.cc/paper_files/paper/2022/hash/82764461a05e933cc2fd9d312e107d12-Abstract-Conference.html,
nips,2022,conf/nips/neurips2022,,Model-Based Imitation Learning for Urban Driving.,Anthony Hu; Gianluca Corrado; Nicolas Griffiths; Zachary Murez; Corina Gurau; Hudson Yeo; Alex Kendall; Roberto Cipolla; Jamie Shotton,,0,http://papers.nips.cc/paper_files/paper/2022/hash/827cb489449ea216e4a257c47e407d18-Abstract-Conference.html,
nips,2022,conf/nips/neurips2022,,Online Training Through Time for Spiking Neural Networks.,Mingqing Xiao; Qingyan Meng; Zongpeng Zhang; Di He; Zhouchen Lin,,0,http://papers.nips.cc/paper_files/paper/2022/hash/82846e19e6d42ebfd4ace4361def29ae-Abstract-Conference.html,
nips,2022,conf/nips/neurips2022,,SCONE: Surface Coverage Optimization in Unknown Environments by Volumetric Integration.,Antoine Guédon; Pascal Monasse; Vincent Lepetit,,0,http://papers.nips.cc/paper_files/paper/2022/hash/828c6d69bdf91fca7f2b97c4dc214e94-Abstract-Conference.html,
nips,2022,conf/nips/neurips2022,,WebShop: Towards Scalable Real-World Web Interaction with Grounded Language Agents.,Shunyu Yao; Howard Chen; John Yang; Karthik Narasimhan,,0,http://papers.nips.cc/paper_files/paper/2022/hash/82ad13ec01f9fe44c01cb91814fd7b8c-Abstract-Conference.html,
nips,2022,conf/nips/neurips2022,,Boosting Out-of-distribution Detection with Typical Features.,Yao Zhu; Yuefeng Chen; Chuanlong Xie; Xiaodan Li; Rong Zhang; Hui Xue; Xiang Tian; Bolun Zheng; Yaowu Chen,,0,http://papers.nips.cc/paper_files/paper/2022/hash/82b0c1b954b6ef9f3cfb664a82b201bb-Abstract-Conference.html,
nips,2022,conf/nips/neurips2022,,Dynamic Learning in Large Matching Markets.,Anand Kalvit; Assaf Zeevi,,0,http://papers.nips.cc/paper_files/paper/2022/hash/82d3258eb58ceac31744a88005b7ddef-Abstract-Conference.html,
nips,2022,conf/nips/neurips2022,,Invariant and Transportable Representations for Anti-Causal Domain Shifts.,Yibo Jiang; Victor Veitch,,0,http://papers.nips.cc/paper_files/paper/2022/hash/82e330c1b962ee1e6adb60d01f695366-Abstract-Conference.html,
nips,2022,conf/nips/neurips2022,,Symplectic Spectrum Gaussian Processes: Learning Hamiltonians from Noisy and Sparse Data.,Yusuke Tanaka; Tomoharu Iwata; Naonori Ueda,,0,http://papers.nips.cc/paper_files/paper/2022/hash/82f05a105c928c10706213952bf0c8b7-Abstract-Conference.html,
nips,2022,conf/nips/neurips2022,,Multiclass Learnability Beyond the PAC Framework: Universal Rates and Partial Concept Classes.,Alkis Kalavasis; Grigoris Velegkas; Amin Karbasi,,0,http://papers.nips.cc/paper_files/paper/2022/hash/82f0dae85424eb743017c90380e7ab9b-Abstract-Conference.html,
nips,2022,conf/nips/neurips2022,,MetaTeacher: Coordinating Multi-Model Domain Adaptation for Medical Image Classification.,Zhenbin Wang; Mao Ye; Xiatian Zhu; Liuhan Peng; Liang Tian; Yingying Zhu,,0,http://papers.nips.cc/paper_files/paper/2022/hash/8313b1920ee9c78d846c5798c1ce48be-Abstract-Conference.html,
nips,2022,conf/nips/neurips2022,,Biological Learning of Irreducible Representations of Commuting Transformations.,Alexander Genkin; David Lipshutz; Siavash Golkar; Tiberiu Tesileanu; Dmitri B. Chklovskii,,0,http://papers.nips.cc/paper_files/paper/2022/hash/834f4c0b8d241b4943a9dcb77fd85675-Abstract-Conference.html,
nips,2022,conf/nips/neurips2022,,A Fourier Approach to Mixture Learning.,Mingda Qiao; Guru Guruganesh; Ankit Singh Rawat; Kumar Avinava Dubey; Manzil Zaheer,,0,http://papers.nips.cc/paper_files/paper/2022/hash/8353c5035fe18b4fadd350228b4e0688-Abstract-Conference.html,
nips,2022,conf/nips/neurips2022,,Structured Energy Network As a Loss.,Jay Yoon Lee; Dhruvesh Patel; Purujit Goyal; Wenlong Zhao; Zhiyang Xu; Andrew McCallum,,0,http://papers.nips.cc/paper_files/paper/2022/hash/83ae75c127e2a3ea3315379020f8c19f-Abstract-Conference.html,
nips,2022,conf/nips/neurips2022,,Bayesian inference via sparse Hamiltonian flows.,Naitong Chen; Zuheng Xu; Trevor Campbell,,0,http://papers.nips.cc/paper_files/paper/2022/hash/83b17fb3369b1effa97ca5409526b02e-Abstract-Conference.html,
nips,2022,conf/nips/neurips2022,,SAPA: Similarity-Aware Point Affiliation for Feature Upsampling.,Hao Lu; Wenze Liu; Zixuan Ye; Hongtao Fu; Yuliang Liu; Zhiguo Cao,,0,http://papers.nips.cc/paper_files/paper/2022/hash/83ccb398f3ce9c4d137011f36a03c7d4-Abstract-Conference.html,
nips,2022,conf/nips/neurips2022,,Losses Can Be Blessings: Routing Self-Supervised Speech Representations Towards Efficient Multilingual and Multitask Speech Processing.,Yonggan Fu; Yang Zhang; Kaizhi Qian; Zhifan Ye; Zhongzhi Yu; Cheng-I Jeff Lai; Celine Lin,,0,http://papers.nips.cc/paper_files/paper/2022/hash/83d349b6eb8125588b5f091e2d47525c-Abstract-Conference.html,
nips,2022,conf/nips/neurips2022,,Gradient Methods Provably Converge to Non-Robust Networks.,Gal Vardi; Gilad Yehudai; Ohad Shamir,,0,http://papers.nips.cc/paper_files/paper/2022/hash/83e6913572ba09b0ab53c64c016c7d1a-Abstract-Conference.html,
nips,2022,conf/nips/neurips2022,,Diversity vs. Recognizability: Human-like generalization in one-shot generative models.,Victor Boutin; Lakshya Singhal; Xavier Thomas; Thomas Serre,,0,http://papers.nips.cc/paper_files/paper/2022/hash/8402cf3031d649066ada24514739f0dd-Abstract-Conference.html,
nips,2022,conf/nips/neurips2022,,Task-level Differentially Private Meta Learning.,Xinyu Zhou; Raef Bassily,,0,http://papers.nips.cc/paper_files/paper/2022/hash/842b82470c93a6c72284a3e83bdaced5-Abstract-Conference.html,
nips,2022,conf/nips/neurips2022,,On the Statistical Efficiency of Reward-Free Exploration in Non-Linear RL.,Jinglin Chen; Aditya Modi; Akshay Krishnamurthy; Nan Jiang; Alekh Agarwal,,0,http://papers.nips.cc/paper_files/paper/2022/hash/8433bb4f7477bf8202614ce1ae8b1169-Abstract-Conference.html,
nips,2022,conf/nips/neurips2022,,Pessimism for Offline Linear Contextual Bandits using $\ell_p$ Confidence Sets.,Gene Li; Cong Ma; Nati Srebro,,0,http://papers.nips.cc/paper_files/paper/2022/hash/8443219a991f068c34d9491ad68ffa94-Abstract-Conference.html,
nips,2022,conf/nips/neurips2022,,Discrete-Convex-Analysis-Based Framework for Warm-Starting Algorithms with Predictions.,Shinsaku Sakaue; Taihei Oki,,0,http://papers.nips.cc/paper_files/paper/2022/hash/844e61124d9e1f58632bf0c8968ad728-Abstract-Conference.html,
nips,2022,conf/nips/neurips2022,,CAESAR: An Embodied Simulator for Generating Multimodal Referring Expression Datasets.,Md Mofijul Islam; Reza Mirzaiee; Alexi Gladstone; Haley N. Green; Tariq Iqbal,,0,http://papers.nips.cc/paper_files/paper/2022/hash/844f722dbbcb27933ff5baf58a1f00c8-Abstract-Datasets_and_Benchmarks.html,
nips,2022,conf/nips/neurips2022,,Generalizing Bayesian Optimization with Decision-theoretic Entropies.,Willie Neiswanger; Lantao Yu; Shengjia Zhao; Chenlin Meng; Stefano Ermon,,0,http://papers.nips.cc/paper_files/paper/2022/hash/8451a20c5a7e0ee5671dda28f7daf7f3-Abstract-Conference.html,
nips,2022,conf/nips/neurips2022,,Ordered Subgraph Aggregation Networks.,Chendi Qian; Gaurav Rattan; Floris Geerts; Mathias Niepert; Christopher Morris,,0,http://papers.nips.cc/paper_files/paper/2022/hash/8471dc3f5180df17e2fa84f106f1ee8e-Abstract-Conference.html,
nips,2022,conf/nips/neurips2022,,Neuron with Steady Response Leads to Better Generalization.,Qiang Fu; Lun Du; Haitao Mao; Xu Chen; Wei Fang; Shi Han; Dongmei Zhang,,0,http://papers.nips.cc/paper_files/paper/2022/hash/848784373188ddf641079524e89e0ac9-Abstract-Conference.html,
nips,2022,conf/nips/neurips2022,,Laplacian Autoencoders for Learning Stochastic Representations.,Marco Miani; Frederik Warburg; Pablo Moreno-Muñoz; Nicki Skafte Detlefsen; Søren Hauberg,,0,http://papers.nips.cc/paper_files/paper/2022/hash/84880289c9fcba0d4bdb198cdb8f5080-Abstract-Conference.html,
nips,2022,conf/nips/neurips2022,,Alleviating the Sample Selection Bias in Few-shot Learning by Removing Projection to the Centroid.,Jing Xu; Xu Luo; Xinglin Pan; Yanan Li; Wenjie Pei; Zenglin Xu,,0,http://papers.nips.cc/paper_files/paper/2022/hash/84b686f7cc7b7751e9aaac0da74f755a-Abstract-Conference.html,
nips,2022,conf/nips/neurips2022,,A Coupled Design of Exploiting Record Similarity for Practical Vertical Federated Learning.,Zhaomin Wu; Qinbin Li; Bingsheng He,,0,http://papers.nips.cc/paper_files/paper/2022/hash/84b744165a0597360caad96b06e69313-Abstract-Conference.html,
nips,2022,conf/nips/neurips2022,,Cooperative Distribution Alignment via JSD Upper Bound.,Wonwoong Cho; Ziyu Gong; David I. Inouye,,0,http://papers.nips.cc/paper_files/paper/2022/hash/84b8d9fcb4e262fcd429544697e1e720-Abstract-Conference.html,
nips,2022,conf/nips/neurips2022,,An Analytical Theory of Curriculum Learning in Teacher-Student Networks.,Luca Saglietti; Stefano Sarao Mannelli; Andrew M. Saxe,,0,http://papers.nips.cc/paper_files/paper/2022/hash/84bad835faaf48f24d990072bb5b80ee-Abstract-Conference.html,
nips,2022,conf/nips/neurips2022,,RSA: Reducing Semantic Shift from Aggressive Augmentations for Self-supervised Learning.,Yingbin Bai; Erkun Yang; Zhaoqing Wang; Yuxuan Du; Bo Han; Cheng Deng; Dadong Wang; Tongliang Liu,,0,http://papers.nips.cc/paper_files/paper/2022/hash/850e8063d902e0825d3c5504d183bafe-Abstract-Conference.html,
nips,2022,conf/nips/neurips2022,,Evaluating Latent Space Robustness and Uncertainty of EEG-ML Models under Realistic Distribution Shifts.,Neeraj Wagh; Jionghao Wei; Samarth Rawal; Brent M. Berry; Yogatheesan Varatharajah,,0,http://papers.nips.cc/paper_files/paper/2022/hash/8511d06d5590f4bda24d42087802cc81-Abstract-Conference.html,
nips,2022,conf/nips/neurips2022,,u-HuBERT: Unified Mixed-Modal Speech Pretraining And Zero-Shot Transfer to Unlabeled Modality.,Wei-Ning Hsu; Bowen Shi,,0,http://papers.nips.cc/paper_files/paper/2022/hash/853e781cb2af58956ed5c89aa59da3fc-Abstract-Conference.html,
nips,2022,conf/nips/neurips2022,,Hierarchical Graph Transformer with Adaptive Node Sampling.,Zaixi Zhang; Qi Liu; Qingyong Hu; Chee-Kong Lee,,0,http://papers.nips.cc/paper_files/paper/2022/hash/854a9ab0f323b841955e70ca383b27d1-Abstract-Conference.html,
nips,2022,conf/nips/neurips2022,,Learning Options via Compression.,Yiding Jiang; Evan Zheran Liu; Benjamin Eysenbach; J. Zico Kolter; Chelsea Finn,,0,http://papers.nips.cc/paper_files/paper/2022/hash/8567a53e58a9fa4823af356c76ed943c-Abstract-Conference.html,
nips,2022,conf/nips/neurips2022,,Fixed-Distance Hamiltonian Monte Carlo.,Hadi Mohasel Afshar; Sally Cripps,,0,http://papers.nips.cc/paper_files/paper/2022/hash/857b34d81f0a8bfe3e18879dee3b5086-Abstract-Conference.html,
nips,2022,conf/nips/neurips2022,,"GlanceNets: Interpretable, Leak-proof Concept-based Models.",Emanuele Marconato; Andrea Passerini; Stefano Teso,,0,http://papers.nips.cc/paper_files/paper/2022/hash/85b2ff7574ef265f3a4800db9112ce14-Abstract-Conference.html,
nips,2022,conf/nips/neurips2022,,3DOS: Towards 3D Open Set Learning - Benchmarking and Understanding Semantic Novelty Detection on Point Clouds.,Antonio Alliegro; Francesco Cappio Borlino; Tatiana Tommasi,,0,http://papers.nips.cc/paper_files/paper/2022/hash/85b6841eaf79327b1777f9e64af3835d-Abstract-Datasets_and_Benchmarks.html,
nips,2022,conf/nips/neurips2022,,Masked Prediction: A Parameter Identifiability View.,Bingbin Liu; Daniel J. Hsu; Pradeep Ravikumar; Andrej Risteski,,0,http://papers.nips.cc/paper_files/paper/2022/hash/85dd09d356ca561169b2c03e43cf305e-Abstract-Conference.html,
nips,2022,conf/nips/neurips2022,,Self-Supervised Learning of Brain Dynamics from Broad Neuroimaging Data.,Armin W. Thomas; Christopher Ré; Russell A. Poldrack,,0,http://papers.nips.cc/paper_files/paper/2022/hash/8600a9df1a087a9a66900cc8c948c3f0-Abstract-Conference.html,
nips,2022,conf/nips/neurips2022,,Characterization of Excess Risk for Locally Strongly Convex Population Risk.,Mingyang Yi; Ruoyu Wang; Zhi-Ming Ma,,0,http://papers.nips.cc/paper_files/paper/2022/hash/8607450734c14f1e0e1c89d35e1a9218-Abstract-Conference.html,
nips,2022,conf/nips/neurips2022,,A Non-Asymptotic Moreau Envelope Theory for High-Dimensional Generalized Linear Models.,Lijia Zhou; Frederic Koehler; Pragya Sur; Danica J. Sutherland; Nati Srebro,,0,http://papers.nips.cc/paper_files/paper/2022/hash/861f7dad098aec1c3560fb7add468d41-Abstract-Conference.html,
nips,2022,conf/nips/neurips2022,,Towards Efficient 3D Object Detection with Knowledge Distillation.,Jihan Yang; Shaoshuai Shi; Runyu Ding; Zhe Wang; Xiaojuan Qi,,0,http://papers.nips.cc/paper_files/paper/2022/hash/8625a8c2be8ba5197b7a14833dbea8ac-Abstract-Conference.html,
