venue,year,identifier,heading,title,authors,page_range,length,electronic_edition,comment
nips,2022,conf/nips/neurips2022,,LION: Latent Point Diffusion Models for 3D Shape Generation.,Xiaohui Zeng; Arash Vahdat; Francis Williams; Zan Gojcic; Or Litany; Sanja Fidler; Karsten Kreis,,0,http://papers.nips.cc/paper_files/paper/2022/hash/40e56dabe12095a5fc44a6e4c3835948-Abstract-Conference.html,
nips,2022,conf/nips/neurips2022,,Distribution-Informed Neural Networks for Domain Adaptation Regression.,Jun Wu; Jingrui He; Sheng Wang; Kaiyu Guan; Elizabeth A. Ainsworth,,0,http://papers.nips.cc/paper_files/paper/2022/hash/410bbba8388369d8bb5875544d1d4428-Abstract-Conference.html,
nips,2022,conf/nips/neurips2022,,Momentum Adversarial Distillation: Handling Large Distribution Shifts in Data-Free Knowledge Distillation.,Kien Do; Hung Le; Dung Nguyen; Dang Nguyen; Haripriya Harikumar; Truyen Tran; Santu Rana; Svetha Venkatesh,,0,http://papers.nips.cc/paper_files/paper/2022/hash/41128e5b3a7622da5b17588757599077-Abstract-Conference.html,
nips,2022,conf/nips/neurips2022,,Hard ImageNet: Segmentations for Objects with Strong Spurious Cues.,Mazda Moayeri; Sahil Singla; Soheil Feizi,,0,http://papers.nips.cc/paper_files/paper/2022/hash/4120362f930b0b683cd30b71af56fad1-Abstract-Datasets_and_Benchmarks.html,
nips,2022,conf/nips/neurips2022,,VideoMAE: Masked Autoencoders are Data-Efficient Learners for Self-Supervised Video Pre-Training.,Zhan Tong; Yibing Song; Jue Wang; Limin Wang,,0,http://papers.nips.cc/paper_files/paper/2022/hash/416f9cb3276121c42eebb86352a4354a-Abstract-Conference.html,
nips,2022,conf/nips/neurips2022,,Scalable design of Error-Correcting Output Codes using Discrete Optimization with Graph Coloring.,Samarth Gupta; Saurabh Amin,,0,http://papers.nips.cc/paper_files/paper/2022/hash/41792f041a3a0774418791993cf887fe-Abstract-Conference.html,
nips,2022,conf/nips/neurips2022,,A New Family of Generalization Bounds Using Samplewise Evaluated CMI.,Fredrik Hellström; Giuseppe Durisi,,0,http://papers.nips.cc/paper_files/paper/2022/hash/41b6674c28a9b93ec8d22a53ca25bc3b-Abstract-Conference.html,
nips,2022,conf/nips/neurips2022,,Maximum-Likelihood Inverse Reinforcement Learning with Finite-Time Guarantees.,Siliang Zeng; Chenliang Li; Alfredo García; Mingyi Hong,,0,http://papers.nips.cc/paper_files/paper/2022/hash/41bd71e7bf7f9fe68f1c936940fd06bd-Abstract-Conference.html,
nips,2022,conf/nips/neurips2022,,Lost in Latent Space: Examining failures of disentangled models at combinatorial generalisation.,Milton Llera Montero; Jeffrey S. Bowers; Rui Ponte Costa; Casimir J. H. Ludwig; Gaurav Malhotra,,0,http://papers.nips.cc/paper_files/paper/2022/hash/41ca8a0eb2bc4927a499b910934b9b81-Abstract-Conference.html,
nips,2022,conf/nips/neurips2022,,MultiGuard: Provably Robust Multi-label Classification against Adversarial Examples.,Jinyuan Jia; Wenjie Qu; Neil Zhenqiang Gong,,0,http://papers.nips.cc/paper_files/paper/2022/hash/41fb2ecb5b7d1b505bca787de0a603dc-Abstract-Conference.html,
nips,2022,conf/nips/neurips2022,,On Measuring Excess Capacity in Neural Networks.,Florian Graf; Sebastian Zeng; Bastian Rieck; Marc Niethammer; Roland Kwitt,,0,http://papers.nips.cc/paper_files/paper/2022/hash/420492060687ca7448398c4c3fa10366-Abstract-Conference.html,
nips,2022,conf/nips/neurips2022,,On Leave-One-Out Conditional Mutual Information For Generalization.,Mohamad Rida Rammal; Alessandro Achille; Aditya Golatkar; Suhas N. Diggavi; Stefano Soatto,,0,http://papers.nips.cc/paper_files/paper/2022/hash/421fa4f5e0bef2f044f1f4616fd17343-Abstract-Conference.html,
nips,2022,conf/nips/neurips2022,,Near-Isometric Properties of Kronecker-Structured Random Tensor Embeddings.,Qijia Jiang,,0,http://papers.nips.cc/paper_files/paper/2022/hash/423295ba2cea13cda44dc0a7d48ae244-Abstract-Conference.html,
nips,2022,conf/nips/neurips2022,,MExMI: Pool-based Active Model Extraction Crossover Membership Inference.,Yaxin Xiao; Qingqing Ye; Haibo Hu; Huadi Zheng; Chengfang Fang; Jie Shi,,0,http://papers.nips.cc/paper_files/paper/2022/hash/4241c27d3161c7a7064bfc1a6e539563-Abstract-Conference.html,
nips,2022,conf/nips/neurips2022,,Parameter-Efficient Masking Networks.,Yue Bai; Huan Wang; Xu Ma; Yitian Zhang; Zhiqiang Tao; Yun Fu,,0,http://papers.nips.cc/paper_files/paper/2022/hash/427048354ac2db22d43149c51346bafd-Abstract-Conference.html,
nips,2022,conf/nips/neurips2022,,How Sampling Impacts the Robustness of Stochastic Neural Networks.,Sina Däubener; Asja Fischer,,0,http://papers.nips.cc/paper_files/paper/2022/hash/429d69979c22b06d6baa65caf3ab1e10-Abstract-Conference.html,
nips,2022,conf/nips/neurips2022,,Toward Robust Spiking Neural Network Against Adversarial Perturbation.,Ling Liang; Kaidi Xu; Xing Hu; Lei Deng; Yuan Xie,,0,http://papers.nips.cc/paper_files/paper/2022/hash/42bc612558891859b1b8717051f2c7b0-Abstract-Conference.html,
nips,2022,conf/nips/neurips2022,,GRASP: Navigating Retrosynthetic Planning with Goal-driven Policy.,Yemin Yu; Ying Wei; Kun Kuang; Zhengxing Huang; Huaxiu Yao; Fei Wu,,0,http://papers.nips.cc/paper_files/paper/2022/hash/42beaab8aa8da1c77581609a61eced93-Abstract-Conference.html,
nips,2022,conf/nips/neurips2022,,End-to-end Symbolic Regression with Transformers.,Pierre-Alexandre Kamienny; Stéphane d'Ascoli; Guillaume Lample; François Charton,,0,http://papers.nips.cc/paper_files/paper/2022/hash/42eb37cdbefd7abae0835f4b67548c39-Abstract-Conference.html,
nips,2022,conf/nips/neurips2022,,Gold-standard solutions to the Schrödinger equation using deep learning: How much physics do we need?,Leon Gerard; Michael Scherbela; Philipp Marquetand; Philipp Grohs,,0,http://papers.nips.cc/paper_files/paper/2022/hash/430894999584d0bd358611e2ecf00b15-Abstract-Conference.html,
nips,2022,conf/nips/neurips2022,,EcoFormer: Energy-Saving Attention with Linear Complexity.,Jing Liu; Zizheng Pan; Haoyu He; Jianfei Cai; Bohan Zhuang,,0,http://papers.nips.cc/paper_files/paper/2022/hash/4310ae054ce265e56d8ea897971149b5-Abstract-Conference.html,
nips,2022,conf/nips/neurips2022,,Wild-Time: A Benchmark of in-the-Wild Distribution Shift over Time.,Huaxiu Yao; Caroline Choi; Bochuan Cao; Yoonho Lee; Pang Wei Koh; Chelsea Finn,,0,http://papers.nips.cc/paper_files/paper/2022/hash/43119db5d59f07cc08fca7ba6820179a-Abstract-Datasets_and_Benchmarks.html,
nips,2022,conf/nips/neurips2022,,Sound and Complete Causal Identification with Latent Variables Given Local Background Knowledge.,Tian-Zuo Wang; Tian Qin; Zhi-Hua Zhou,,0,http://papers.nips.cc/paper_files/paper/2022/hash/4334031bd9d518af18a6aba32ad70c8e-Abstract-Conference.html,
nips,2022,conf/nips/neurips2022,,A Unified Diversity Measure for Multiagent Reinforcement Learning.,Zongkai Liu; Chao Yu; Yaodong Yang; Peng Sun; Zifan Wu; Yuan Li,,0,http://papers.nips.cc/paper_files/paper/2022/hash/435cce71b4007699041dfffa4f034079-Abstract-Conference.html,
nips,2022,conf/nips/neurips2022,,HorNet: Efficient High-Order Spatial Interactions with Recursive Gated Convolutions.,Yongming Rao; Wenliang Zhao; Yansong Tang; Jie Zhou; Ser-Nam Lim; Jiwen Lu,,0,http://papers.nips.cc/paper_files/paper/2022/hash/436d042b2dd81214d23ae43eb196b146-Abstract-Conference.html,
nips,2022,conf/nips/neurips2022,,Learning Tractable Probabilistic Models from Inconsistent Local Estimates.,Shasha Jin; Vasundhara Komaragiri; Tahrima Rahman; Vibhav Gogate,,0,http://papers.nips.cc/paper_files/paper/2022/hash/437d9bde2999f6e3e854e09f250261a5-Abstract-Conference.html,
nips,2022,conf/nips/neurips2022,,Decomposed Knowledge Distillation for Class-Incremental Semantic Segmentation.,Donghyeon Baek; Youngmin Oh; Sanghoon Lee; Junghyup Lee; Bumsub Ham,,0,http://papers.nips.cc/paper_files/paper/2022/hash/439bf902de1807088d8b731ca20b0777-Abstract-Conference.html,
nips,2022,conf/nips/neurips2022,,Minimax Optimal Algorithms for Fixed-Budget Best Arm Identification.,Junpei Komiyama; Taira Tsuchiya; Junya Honda,,0,http://papers.nips.cc/paper_files/paper/2022/hash/43c18853329c7504996b255252b6cb1f-Abstract-Conference.html,
nips,2022,conf/nips/neurips2022,,Reduced Representation of Deformation Fields for Effective Non-rigid Shape Matching.,Ramana Sundararaman; Riccardo Marin; Emanuele Rodolà; Maks Ovsjanikov,,0,http://papers.nips.cc/paper_files/paper/2022/hash/43d1d3bdd92204c96fa4ac3c578f6a33-Abstract-Conference.html,
nips,2022,conf/nips/neurips2022,,BEVFusion: A Simple and Robust LiDAR-Camera Fusion Framework.,Tingting Liang; Hongwei Xie; Kaicheng Yu; Zhongyu Xia; Zhiwei Lin; Yongtao Wang; Tao Tang; Bing Wang; Zhi Tang,,0,http://papers.nips.cc/paper_files/paper/2022/hash/43d2b7fbee8431f7cef0d0afed51c691-Abstract-Conference.html,
nips,2022,conf/nips/neurips2022,,Automatic Differentiation of Programs with Discrete Randomness.,Gaurav Arya; Moritz Schauer; Frank Schäfer; Christopher Rackauckas,,0,http://papers.nips.cc/paper_files/paper/2022/hash/43d8e5fc816c692f342493331d5e98fc-Abstract-Conference.html,
nips,2022,conf/nips/neurips2022,,A Closer Look at the Adversarial Robustness of Deep Equilibrium Models.,Zonghan Yang; Tianyu Pang; Yang Liu,,0,http://papers.nips.cc/paper_files/paper/2022/hash/43da8cca8f14139774bcbd935d51e0f2-Abstract-Conference.html,
nips,2022,conf/nips/neurips2022,,Near-Optimal Private and Scalable $k$-Clustering.,Vincent Cohen-Addad; Alessandro Epasto; Vahab Mirrokni; Shyam Narayanan; Peilin Zhong,,0,http://papers.nips.cc/paper_files/paper/2022/hash/43f55776896a2e33239c2954519f605e-Abstract-Conference.html,
nips,2022,conf/nips/neurips2022,,NS3: Neuro-symbolic Semantic Code Search.,Shushan Arakelyan; Anna Hakhverdyan; Miltiadis Allamanis; Luis Garcia; Christophe Hauser; Xiang Ren,,0,http://papers.nips.cc/paper_files/paper/2022/hash/43f5f6c5cb333115914c8448b8506411-Abstract-Conference.html,
nips,2022,conf/nips/neurips2022,,Revisiting Sparse Convolutional Model for Visual Recognition.,Xili Dai; Mingyang Li; Pengyuan Zhai; Shengbang Tong; Xingjian Gao; Shao-Lun Huang; Zhihui Zhu; Chong You; Yi Ma,,0,http://papers.nips.cc/paper_files/paper/2022/hash/4418f6a54f4314202688d77956e731ce-Abstract-Conference.html,
nips,2022,conf/nips/neurips2022,,Temporal Latent Bottleneck: Synthesis of Fast and Slow Processing Mechanisms in Sequence Learning.,Aniket Didolkar; Kshitij Gupta; Anirudh Goyal; Nitesh B. Gundavarapu; Alex Lamb; Nan Rosemary Ke; Yoshua Bengio,,0,http://papers.nips.cc/paper_files/paper/2022/hash/4446b84fdf15b17c091582e4b86f8a05-Abstract-Conference.html,
nips,2022,conf/nips/neurips2022,,A Near-Optimal Primal-Dual Method for Off-Policy Learning in CMDP.,Fan Chen; Junyu Zhang; Zaiwen Wen,,0,http://papers.nips.cc/paper_files/paper/2022/hash/444d69470b24ded080183c907b711bbf-Abstract-Conference.html,
nips,2022,conf/nips/neurips2022,,DReS-FL: Dropout-Resilient Secure Federated Learning for Non-IID Clients via Secret Data Sharing.,Jiawei Shao; Yuchang Sun; Songze Li; Jun Zhang,,0,http://papers.nips.cc/paper_files/paper/2022/hash/448fc91f669c15d10364ee01d512cc10-Abstract-Conference.html,
nips,2022,conf/nips/neurips2022,,BackdoorBench: A Comprehensive Benchmark of Backdoor Learning.,Baoyuan Wu; Hongrui Chen; Mingda Zhang; Zihao Zhu; Shaokui Wei; Danni Yuan; Chao Shen,,0,http://papers.nips.cc/paper_files/paper/2022/hash/4491ea1c91aa2b22c373e5f1dfce234f-Abstract-Datasets_and_Benchmarks.html,
nips,2022,conf/nips/neurips2022,,REVIVE: Regional Visual Representation Matters in Knowledge-Based Visual Question Answering.,Yuanze Lin; Yujia Xie; Dongdong Chen; Yichong Xu; Chenguang Zhu; Lu Yuan,,0,http://papers.nips.cc/paper_files/paper/2022/hash/44956951349095f74492a5471128a7e0-Abstract-Conference.html,
nips,2022,conf/nips/neurips2022,,FedAvg with Fine Tuning: Local Updates Lead to Representation Learning.,Liam Collins; Hamed Hassani; Aryan Mokhtari; Sanjay Shakkottai,,0,http://papers.nips.cc/paper_files/paper/2022/hash/449590dfd5789cc7043f85f8bb7afa47-Abstract-Conference.html,
nips,2022,conf/nips/neurips2022,,Modeling Transitivity and Cyclicity in Directed Graphs via Binary Code Box Embeddings.,Dongxu Zhang; Michael Boratko; Cameron Musco; Andrew McCallum,,0,http://papers.nips.cc/paper_files/paper/2022/hash/44a1f18afd6d5cc34d7e5c3d8a80f63b-Abstract-Conference.html,
nips,2022,conf/nips/neurips2022,,Generalization Bounds for Gradient Methods via Discrete and Continuous Prior.,Xuanyuan Luo; Bei Luo; Jian Li,,0,http://papers.nips.cc/paper_files/paper/2022/hash/44cdeb5ab7da31d9b5cd88fd44e3da84-Abstract-Conference.html,
nips,2022,conf/nips/neurips2022,,On Deep Generative Models for Approximation and Estimation of Distributions on Manifolds.,Biraj Dahal; Alexander Havrilla; Minshuo Chen; Tuo Zhao; Wenjing Liao,,0,http://papers.nips.cc/paper_files/paper/2022/hash/44d20d542f3f4e3b7097e5e3f78f99f1-Abstract-Conference.html,
nips,2022,conf/nips/neurips2022,,Memory Efficient Continual Learning with Transformers.,Beyza Ermis; Giovanni Zappella; Martin Wistuba; Aditya Rawal; Cédric Archambeau,,0,http://papers.nips.cc/paper_files/paper/2022/hash/4522de4178bddb36b49aa26efad537cf-Abstract-Conference.html,
nips,2022,conf/nips/neurips2022,,Counterfactual Neural Temporal Point Process for Estimating Causal Influence of Misinformation on Social Media.,Yizhou Zhang; Defu Cao; Yan Liu,,0,http://papers.nips.cc/paper_files/paper/2022/hash/45542d647974ca6af58441c4817c9b5b-Abstract-Conference.html,
nips,2022,conf/nips/neurips2022,,Curriculum Reinforcement Learning using Optimal Transport via Gradual Domain Adaptation.,Peide Huang; Mengdi Xu; Jiacheng Zhu; Laixi Shi; Fei Fang; Ding Zhao,,0,http://papers.nips.cc/paper_files/paper/2022/hash/4556f5398bd2c61bd7500e306b4e560a-Abstract-Conference.html,
nips,2022,conf/nips/neurips2022,,Temporally-Consistent Survival Analysis.,Lucas Maystre; Daniel Russo,,0,http://papers.nips.cc/paper_files/paper/2022/hash/455e1e30edf721bd7fa334fffabdcad8-Abstract-Conference.html,
nips,2022,conf/nips/neurips2022,,Symbolic Distillation for Learned TCP Congestion Control.,S. P. Sharan; Wenqing Zheng; Kuo-Feng Hsu; Jiarong Xing; Ang Chen; Zhangyang Wang,,0,http://papers.nips.cc/paper_files/paper/2022/hash/4574ac9854d4defe3bf119d07b817084-Abstract-Conference.html,
nips,2022,conf/nips/neurips2022,,A Probabilistic Graph Coupling View of Dimension Reduction.,Hugues Van Assel; Thibault Espinasse; Julien Chiquet; Franck Picard,,0,http://papers.nips.cc/paper_files/paper/2022/hash/45994782a61bb51cad5c2bae36834265-Abstract-Conference.html,
nips,2022,conf/nips/neurips2022,,Hardness of Noise-Free Learning for Two-Hidden-Layer Neural Networks.,Sitan Chen; Aravind Gollakota; Adam R. Klivans; Raghu Meka,,0,http://papers.nips.cc/paper_files/paper/2022/hash/45a7ca247462d9e465ee88c8a302ca70-Abstract-Conference.html,
nips,2022,conf/nips/neurips2022,,Convergence beyond the over-parameterized regime using Rayleigh quotients.,David A. R. Robin; Kevin Scaman; Marc Lelarge,,0,http://papers.nips.cc/paper_files/paper/2022/hash/45d74e190008c7bff2845ffc8e3facd3-Abstract-Conference.html,
nips,2022,conf/nips/neurips2022,,Optimistic Posterior Sampling for Reinforcement Learning with Few Samples and Tight Guarantees.,Daniil Tiapkin; Denis Belomestny; Daniele Calandriello; Eric Moulines; Rémi Munos; Alexey Naumov; Mark Rowland; Michal Valko; Pierre Ménard,,0,http://papers.nips.cc/paper_files/paper/2022/hash/45e15bae91a6f213d45e203b8a29be48-Abstract-Conference.html,
nips,2022,conf/nips/neurips2022,,"On Convergence of FedProx: Local Dissimilarity Invariant Bounds, Non-smoothness and Beyond.",Xiaotong Yuan; Ping Li,,0,http://papers.nips.cc/paper_files/paper/2022/hash/45ecdd6cf1f507d378a3442ed89e580b-Abstract-Conference.html,
nips,2022,conf/nips/neurips2022,,Can Push-forward Generative Models Fit Multimodal Distributions?,Antoine Salmona; Valentin De Bortoli; Julie Delon; Agnès Desolneux,,0,http://papers.nips.cc/paper_files/paper/2022/hash/45f0d179ef7e10eb7366550cd4e574ae-Abstract-Conference.html,
nips,2022,conf/nips/neurips2022,,Improved Imaging by Invex Regularizers with Global Optima Guarantees.,Samuel Pinilla; Tingting Mu; Neil Bourne; Jeyan Thiyagalingam,,0,http://papers.nips.cc/paper_files/paper/2022/hash/45f7927942098d14e473fc5d000031e2-Abstract-Conference.html,
nips,2022,conf/nips/neurips2022,,The Neural Covariance SDE: Shaped Infinite Depth-and-Width Networks at Initialization.,Mufan (Bill) Li; Mihai Nica; Daniel M. Roy,,0,http://papers.nips.cc/paper_files/paper/2022/hash/45fc4a0da7e7f6fbabaabe2d20a441d1-Abstract-Conference.html,
nips,2022,conf/nips/neurips2022,,Rethinking and Scaling Up Graph Contrastive Learning: An Extremely Efficient Approach with Group Discrimination.,Yizhen Zheng; Shirui Pan; Vincent C. S. Lee; Yu Zheng; Philip S. Yu,,0,http://papers.nips.cc/paper_files/paper/2022/hash/46027e3de0db3617a911f1a647def3bf-Abstract-Conference.html,
nips,2022,conf/nips/neurips2022,,Diverse Weight Averaging for Out-of-Distribution Generalization.,Alexandre Ramé; Matthieu Kirchmeyer; Thibaud Rahier; Alain Rakotomamonjy; Patrick Gallinari; Matthieu Cord,,0,http://papers.nips.cc/paper_files/paper/2022/hash/46108d807b50ad4144eb353b5d0e8851-Abstract-Conference.html,
nips,2022,conf/nips/neurips2022,,Bivariate Causal Discovery for Categorical Data via Classification with Optimal Label Permutation.,Yang Ni,,0,http://papers.nips.cc/paper_files/paper/2022/hash/4620a66570e554a3ff0e39dc59bcb07a-Abstract-Conference.html,
nips,2022,conf/nips/neurips2022,,Phase transitions in when feedback is useful.,Lokesh Boominathan; Xaq Pitkow,,0,http://papers.nips.cc/paper_files/paper/2022/hash/4627150df8d491015cfb67c48f99c97a-Abstract-Conference.html,
nips,2022,conf/nips/neurips2022,,Stochastic Second-Order Methods Improve Best-Known Sample Complexity of SGD for Gradient-Dominated Functions.,Saeed Masiha; Saber Salehkaleybar; Niao He; Negar Kiyavash; Patrick Thiran,,0,http://papers.nips.cc/paper_files/paper/2022/hash/46323351ebc2afa42b30a6122815cb95-Abstract-Conference.html,
nips,2022,conf/nips/neurips2022,,Posterior and Computational Uncertainty in Gaussian Processes.,Jonathan Wenger; Geoff Pleiss; Marvin Pförtner; Philipp Hennig; John P. Cunningham,,0,http://papers.nips.cc/paper_files/paper/2022/hash/4683beb6bab325650db13afd05d1a14a-Abstract-Conference.html,
nips,2022,conf/nips/neurips2022,,Understanding the Evolution of Linear Regions in Deep Reinforcement Learning.,Setareh Cohan; Nam Hee Kim; David Rolnick; Michiel van de Panne,,0,http://papers.nips.cc/paper_files/paper/2022/hash/4685275b9a6a2c55d78135563dfd50bb-Abstract-Conference.html,
nips,2022,conf/nips/neurips2022,,Causal Discovery in Heterogeneous Environments Under the Sparse Mechanism Shift Hypothesis.,Ronan Perry; Julius von Kügelgen; Bernhard Schölkopf,,0,http://papers.nips.cc/paper_files/paper/2022/hash/46a126492ea6fb87410e55a58df2e189-Abstract-Conference.html,
nips,2022,conf/nips/neurips2022,,Towards Practical Control of Singular Values of Convolutional Layers.,Alexandra Senderovich; Ekaterina Bulatova; Anton Obukhov; Maxim V. Rakhuba,,0,http://papers.nips.cc/paper_files/paper/2022/hash/46b1be2b90c6addc84efdf5d7e90eebc-Abstract-Conference.html,
nips,2022,conf/nips/neurips2022,,Deep Multi-Modal Structural Equations For Causal Effect Estimation With Unstructured Proxies.,Shachi Deshpande; Kaiwen Wang; Dhruv Sreenivas; Zheng Li; Volodymyr Kuleshov,,0,http://papers.nips.cc/paper_files/paper/2022/hash/46e654963ca9f2b9ff05d1bbfce2420c-Abstract-Conference.html,
nips,2022,conf/nips/neurips2022,,Generic bounds on the approximation error for physics-informed (and) operator learning.,Tim De Ryck; Siddhartha Mishra,,0,http://papers.nips.cc/paper_files/paper/2022/hash/46f0114c06524debc60ef2a72769f7a9-Abstract-Conference.html,
nips,2022,conf/nips/neurips2022,,Learning Distributions Generated by Single-Layer ReLU Networks in the Presence of Arbitrary Outliers.,Saikiran Bulusu; Geethu Joseph; Mustafa Cenk Gursoy; Pramod K. Varshney,,0,http://papers.nips.cc/paper_files/paper/2022/hash/470e23d14e330ab0daa5387916b95f9c-Abstract-Conference.html,
nips,2022,conf/nips/neurips2022,,GenerSpeech: Towards Style Transfer for Generalizable Out-Of-Domain Text-to-Speech.,Rongjie Huang; Yi Ren; Jinglin Liu; Chenye Cui; Zhou Zhao,,0,http://papers.nips.cc/paper_files/paper/2022/hash/4730d10b22261faa9a95ebf7497bc556-Abstract-Conference.html,
nips,2022,conf/nips/neurips2022,,On Non-Linear operators for Geometric Deep Learning.,Grégoire Sergeant-Perthuis; Jakob Maier; Joan Bruna; Edouard Oyallon,,0,http://papers.nips.cc/paper_files/paper/2022/hash/474815daf1d4096ff78b7e4fdd2086a5-Abstract-Conference.html,
nips,2022,conf/nips/neurips2022,,Momentum Aggregation for Private Non-convex ERM.,Hoang Tran; Ashok Cutkosky,,0,http://papers.nips.cc/paper_files/paper/2022/hash/47547ee84e3fbbcbbbbad7c1fd9a973b-Abstract-Conference.html,
nips,2022,conf/nips/neurips2022,,Learning in Congestion Games with Bandit Feedback.,Qiwen Cui; Zhihan Xiong; Maryam Fazel; Simon S. Du,,0,http://papers.nips.cc/paper_files/paper/2022/hash/47561f5e1dc53c7d119185e217b523d0-Abstract-Conference.html,
nips,2022,conf/nips/neurips2022,,LOG: Active Model Adaptation for Label-Efficient OOD Generalization.,Jie-Jing Shao; Lan-Zhe Guo; Xiaowen Yang; Yufeng Li,,0,http://papers.nips.cc/paper_files/paper/2022/hash/4757094e8ccc17e3e25b40efaf06c746-Abstract-Conference.html,
nips,2022,conf/nips/neurips2022,,PolarMix: A General Data Augmentation Technique for LiDAR Point Clouds.,Aoran Xiao; Jiaxing Huang; Dayan Guan; Kaiwen Cui; Shijian Lu; Ling Shao,,0,http://papers.nips.cc/paper_files/paper/2022/hash/475b85eb74d201bead9927807e713e95-Abstract-Conference.html,
nips,2022,conf/nips/neurips2022,,Learning from Distributed Users in Contextual Linear Bandits Without Sharing the Context.,Osama A. Hanna; Lin Yang; Christina Fragouli,,0,http://papers.nips.cc/paper_files/paper/2022/hash/4761fab863f0900d90cf601fce6d5155-Abstract-Conference.html,
nips,2022,conf/nips/neurips2022,,Provably Feedback-Efficient Reinforcement Learning via Active Reward Learning.,Dingwen Kong; Lin Yang,,0,http://papers.nips.cc/paper_files/paper/2022/hash/476c289f685e27936aa089e9d53a4213-Abstract-Conference.html,
nips,2022,conf/nips/neurips2022,,Recurrent Memory Transformer.,Aydar Bulatov; Yuri Kuratov; Mikhail Burtsev,,0,http://papers.nips.cc/paper_files/paper/2022/hash/47e288629a6996a17ce50b90a056a0e1-Abstract-Conference.html,
nips,2022,conf/nips/neurips2022,,Hierarchical Lattice Layer for Partially Monotone Neural Networks.,Hiroki Yanagisawa; Kohei Miyaguchi; Takayuki Katsuki,,0,http://papers.nips.cc/paper_files/paper/2022/hash/47ed62021460f2e9bba7be3e74260090-Abstract-Conference.html,
nips,2022,conf/nips/neurips2022,,Class-Dependent Label-Noise Learning with Cycle-Consistency Regularization.,De Cheng; Yixiong Ning; Nannan Wang; Xinbo Gao; Heng Yang; Yuxuan Du; Bo Han; Tongliang Liu,,0,http://papers.nips.cc/paper_files/paper/2022/hash/47f75e809409709c6d226ab5ca0c9703-Abstract-Conference.html,
nips,2022,conf/nips/neurips2022,,SeqPATE: Differentially Private Text Generation via Knowledge Distillation.,Zhiliang Tian; Yingxiu Zhao; Ziyue Huang; Yu-Xiang Wang; Nevin L. Zhang; He He,,0,http://papers.nips.cc/paper_files/paper/2022/hash/480045ad846b44bf31441c1f1d9dd768-Abstract-Conference.html,
nips,2022,conf/nips/neurips2022,,Bayesian Persuasion for Algorithmic Recourse.,Keegan Harris; Valerie Chen; Joon Sik Kim; Ameet Talwalkar; Hoda Heidari; Zhiwei Steven Wu,,0,http://papers.nips.cc/paper_files/paper/2022/hash/480150047ecb2187a3a8b8dccfd8f2de-Abstract-Conference.html,
nips,2022,conf/nips/neurips2022,,Instance-Based Uncertainty Estimation for Gradient-Boosted Regression Trees.,Jonathan Brophy; Daniel Lowd,,0,http://papers.nips.cc/paper_files/paper/2022/hash/48088756ec0ce6ba362bddc7ebeb3915-Abstract-Conference.html,
nips,2022,conf/nips/neurips2022,,Transcormer: Transformer for Sentence Scoring with Sliding Language Modeling.,Kaitao Song; Yichong Leng; Xu Tan; Yicheng Zou; Tao Qin; Dongsheng Li,,0,http://papers.nips.cc/paper_files/paper/2022/hash/486ff0b164cf92b0255fe39863bcf99e-Abstract-Conference.html,
nips,2022,conf/nips/neurips2022,,Models Out of Line: A Fourier Lens on Distribution Shift Robustness.,Sara Fridovich-Keil; Brian R. Bartoldson; James Diffenderfer; Bhavya Kailkhura; Timo Bremer,,0,http://papers.nips.cc/paper_files/paper/2022/hash/48736dba3b8d933fabbfdb4f22a7be71-Abstract-Conference.html,
nips,2022,conf/nips/neurips2022,,Deep Learning Methods for Proximal Inference via Maximum Moment Restriction.,Benjamin Kompa; David R. Bellamy; Thomas Kolokotrones; James M. Robins; Andrew Beam,,0,http://papers.nips.cc/paper_files/paper/2022/hash/487c9d6ef55e73aa9dfd4b48fe3713a6-Abstract-Conference.html,
nips,2022,conf/nips/neurips2022,,Nest Your Adaptive Algorithm for Parameter-Agnostic Nonconvex Minimax Optimization.,Junchi Yang; Xiang Li; Niao He,,0,http://papers.nips.cc/paper_files/paper/2022/hash/488b8db9ec118c3d750c34d1812a5a3a-Abstract-Conference.html,
nips,2022,conf/nips/neurips2022,,Brownian Noise Reduction: Maximizing Privacy Subject to Accuracy Constraints.,Justin Whitehouse; Aaditya Ramdas; Zhiwei Steven Wu; Ryan M. Rogers,,0,http://papers.nips.cc/paper_files/paper/2022/hash/48aaa5ea741ae8430bd58e25917d267d-Abstract-Conference.html,
nips,2022,conf/nips/neurips2022,,Are AlphaZero-like Agents Robust to Adversarial Perturbations?,Li-Cheng Lan; Huan Zhang; Ti-Rong Wu; Meng-Yu Tsai; I-Chen Wu; Cho-Jui Hsieh,,0,http://papers.nips.cc/paper_files/paper/2022/hash/48adb34f7ee39177c4c23a8e4253a492-Abstract-Conference.html,
nips,2022,conf/nips/neurips2022,,AnimeSR: Learning Real-World Super-Resolution Models for Animation Videos.,Yanze Wu; Xintao Wang; Gen Li; Ying Shan,,0,http://papers.nips.cc/paper_files/paper/2022/hash/48cca987b3af66e1a607abd4820b330d-Abstract-Conference.html,
nips,2022,conf/nips/neurips2022,,On the Spectral Bias of Convolutional Neural Tangent and Gaussian Process Kernels.,Amnon Geifman; Meirav Galun; David Jacobs; Ronen Basri,,0,http://papers.nips.cc/paper_files/paper/2022/hash/48fd58527b29c5c0ef2cae43065636e6-Abstract-Conference.html,
