uuid,title,response
uss_2021_85,Explanation-Guided Backdoor Poisoning Attacks Against Malware Classifiers.,"Yes, the abstract is related to AML as it discusses the susceptibility of machine learning-based malware classifiers to backdoor poisoning attacks and explores the creation of effective backdoor triggers to manipulate ML models."
uss_2021_86,Blind Backdoors in Deep Learning Models.,"Yes, the abstract is related to AML because it discusses the development of sophisticated backdoor attacks on machine learning models, which is a form of adversarial attack."
uss_2021_87,Graph Backdoor.,"Yes, the abstract is related to AML as it discusses the vulnerability of neural networks, specifically graph neural networks, to backdoor attacks, which are a form of adversarial attack."
uss_2021_88,Demon in the Variant: Statistical Analysis of DNNs for Robust Backdoor Contamination Detection.,"Yes, the abstract is related to AML because it discusses a data contamination attack on deep neural networks, a type of adversarial attack, and explores vulnerabilities in existing defenses against such attacks."
uss_2021_89,You Autocomplete Me: Poisoning Vulnerabilities in Neural Code Completion.,No. The abstract discusses code autocompletion using neural language models but does not mention any adversarial attacks or defenses related to machine learning systems.
uss_2021_90,Poisoning the Unlabeled Dataset of Semi-Supervised Learning.,"No, the abstract is not related to AML as it discusses semi-supervised learning efficiencies, with no mention of adversarial attacks or defenses."
uss_2021_91,Double-Cross Attacks: Subverting Active Learning Systems.,"No. The abstract discusses active learning, which is a technique for optimizing data labeling processes for machine learning, but it does not mention or relate to adversarial attacks or defenses."
uss_2021_92,Fine Grained Dataflow Tracking with Proximal Gradients.,"No. The abstract focuses on Dynamic Taint Analysis (DTA), which is a method used in systems security for tracking dataflows, and does not mention or relate to adversarial attacks or defenses against machine learning systems."
uss_2021_93,Static Detection of Unsafe DMA Accesses in Device Drivers.,"No. The abstract focuses on the challenges and risks associated with Direct Memory Access in hardware I/O performance and driver code, rather than adversarial machine learning attacks or defenses."
uss_2021_94,MAZE: Towards Automated Heap Feng Shui.,"No. The abstract discusses automated heap layout manipulation and exploit generation related to memory corruption vulnerabilities, which pertains to software security and exploitation rather than adversarial machine learning."
uss_2021_95,SelectiveTaint: Efficient Data Flow Tracking With Static Binary Rewriting.,"No, the abstract is not related to AML. It focuses on improving the efficiency of taint analysis using static binary rewriting, which is more relevant to software security and binary analysis rather than adversarial machine learning."
uss_2021_96,Breaking Through Binaries: Compiler-quality Instrumentation for Better Binary-only Fuzzing.,"No, the abstract is not related to Adversarial Machine Learning. It focuses on improving binary-only fuzzing techniques for software security testing, which is concerned with finding software vulnerabilities but does not directly involve machine learning models or adversarial attacks on them."
uss_2021_97,MBA-Blast: Unveiling and Simplifying Mixed Boolean-Arithmetic Obfuscation.,"No, the given abstract is not related to AML. It primarily focuses on obfuscation techniques for hiding code and data, which are more related to software security and reverse engineering rather than adversarial attacks on machine learning systems."
uss_2021_98,VScape: Assessing and Escaping Virtual Call Protections.,"No. The abstract is focused on control-flow integrity (CFI) solutions and the challenges in assessing their security guarantees, which are more related to system security rather than adversarial machine learning."
uss_2021_99,Pretty Good Phone Privacy.,No. The abstract focuses on privacy violations and data handling in cellular networks rather than discussing attacks or defenses related to machine learning models.
uss_2021_100,KeyForge: Non-Attributable Email from Forward-Forgeable Signatures.,"No. The abstract discusses issues related to email security, particularly the implications of email breaches and DKIM's impact on message authenticity, but it does not address adversarial attacks or defenses within machine learning systems."
uss_2021_101,Express: Lowering the Cost of Metadata-hiding Communication with Cryptographic Privacy.,No. The abstract focuses on a communication system for metadata-hiding with cryptographic security and does not discuss adversarial attacks or machine learning systems.
uss_2021_102,Kalεido: Real-Time Privacy Control for Eye-Tracking Systems.,No. The abstract focuses on privacy protection for eye-tracking data and does not discuss adversarial machine learning attacks or defenses on machine learning models.
uss_2021_103,Communication-Computation Trade-offs in PIR.,"No, the abstract is related to private information retrieval (PIR) and does not discuss any aspects of adversarial machine learning, attacks, or defenses involving machine learning systems."
uss_2021_104,"I Always Feel Like Somebody's Sensing Me! A Framework to Detect, Identify, and Localize Clandestine Wireless Sensors.","No, the abstract is not related to Adversarial Machine Learning (AML) because it focuses on detecting and localizing wireless sensors in the environment for privacy concerns, rather than discussing malicious attacks or defenses on machine learning systems."
uss_2021_105,The Complexities of Healing in Secure Group Messaging: Why Cross-Group Effects Matter.,"No, the abstract is not related to AML. It focuses on secure messaging protocols and post-compromise security, which are more relevant to cryptography and secure communications rather than adversarial machine learning attacks or defenses."
uss_2021_106,SLAP: Improving Physical Adversarial Examples with Short-Lived Adversarial Perturbations.,"Yes, the abstract is related to Adversarial Machine Learning (AML) because it discusses adversarial examples and patches, which are methods used to perform adversarial attacks on machine learning systems."
uss_2021_107,Adversarial Policy Training against Deep Reinforcement Learning.,"Yes, the abstract is related to AML because it discusses adversarial attacks on deep reinforcement learning agents, highlighting how these attacks can manipulate the agent's behavior by altering inputs or exploiting weaknesses."
uss_2021_108,DRMI: A Dataset Reduction Technology based on Mutual Information for Black-box Attacks.,"Yes, the abstract is related to AML as it discusses black-box attacks against deep neural networks, focusing on improving the efficiency of adversarial queries and enhancing attack effectiveness through data reduction techniques."
uss_2021_109,Deep-Dup: An Adversarial Weight Duplication Attack Framework to Crush Deep Neural Network in Multi-Tenant FPGA.,"Yes, the abstract is related to AML as it describes an adversarial attack framework, Deep-Dup, which targets DNN model vulnerabilities in multi-tenant FPGAs to manipulate DNN functionalities."
uss_2021_110,Entangled Watermarks as a Defense against Model Extraction.,"Yes, the abstract is related to AML because it discusses model extraction attacks and how watermarking can be used as a defense strategy, both of which are aspects of adversarial machine learning."
uss_2021_111,Mind Your Weight(s): A Large-scale Study on Insufficient Machine Learning Model Protection in Mobile Apps.,"No. The abstract focuses on the protection and potential theft of on-device ML models on mobile apps, rather than directly addressing adversarial attacks on the models themselves."
uss_2021_112,Hermes Attack: Steal DNN Models with Lossless Inference Accuracy.,"Yes, the given abstract is related to AML because it describes the Hermes Attack, a novel model-extraction attack that targets DNN models, which pertains to adversarial efforts to exploit machine learning systems."
uss_2021_113,ARCUS: Symbolic Root Cause Analysis of Exploits in Production Systems.,"No. The abstract discusses a framework for root cause analysis and bug localization in execution flagged by end-host monitors, but it does not specifically address adversarial machine learning or attacks on machine learning models."
uss_2021_114,Automatic Firmware Emulation through Invalidity-guided Knowledge Inference.,"No. The abstract focuses on emulating firmware for microcontrollers and improving firmware analysis techniques, rather than discussing adversarial attacks or defenses related to machine learning systems."
uss_2021_115,Finding Bugs Using Your Own Code: Detecting Functionally-similar yet Inconsistent Code.,"No, the abstract is not related to AML because it describes a machine learning-based bug detection technique without mentioning any adversarial attacks or defenses against such attacks on machine learning systems."
uss_2021_116,Understanding and Detecting Disordered Error Handling with Precise Function Pairing.,"No, the given abstract is not related to AML. It focuses on error handling in software programs rather than discussing adversarial attacks or defenses in machine learning systems."
uss_2021_117,Precise and Scalable Detection of Use-after-Compacting-Garbage-Collection Bugs.,"No, the abstract is not related to AML because it discusses memory management and garbage collection issues in computer systems rather than adversarial attacks or defenses involving machine learning models."
uss_2021_118,Reducing Test Cases with Attention Mechanism of Neural Networks.,"No. The abstract focuses on test case reduction for crash triage in software testing, which is unrelated to manipulating or defending machine learning models against adversarial attacks."
uss_2021_119,FlowDist: Multi-Staged Refinement-Based Dynamic Information Flow Analysis for Distributed Software Systems.,"No. The abstract is not related to AML as it focuses on dynamic information flow analysis for distributed software, primarily addressing issues of applicability, portability, and scalability rather than adversarial machine learning attacks or defenses."
uss_2021_120,Privacy and Integrity Preserving Computations with CRISP.,"No, the abstract is not related to AML because it focuses on privacy, integrity, and encryption techniques rather than on adversarial attacks or defenses in machine learning systems."
uss_2021_121,Senate: A Maliciously-Secure MPC Platform for Collaborative Analytics.,"No. The abstract discusses the challenges of data sharing across organizations due to privacy, regulatory, or competition concerns, but does not mention adversarial attacks or techniques for manipulating or defending against machine learning models."
uss_2021_122,GForce: GPU-Friendly Oblivious and Rapid Neural Network Inference.,"No, the abstract is not related to AML. It focuses on privacy-preserving methods (oblivious inference) in neural networks using cryptographic solutions, without mentioning adversarial attacks or manipulations to the model's inputs."
uss_2021_123,ABY2.0: Improved Mixed-Protocol Secure Two-Party Computation.,"No. The abstract is about improving the efficiency of secure multi-party computation, which is more related to cryptography and privacy rather than adversarial machine learning."
uss_2021_124,Fantastic Four: Honest-Majority Four-Party Secure Computation With Malicious Security.,"No, the abstract is not related to AML because it focuses on developing a multi-party computation (MPC) protocol for secure computation, which is more aligned with cryptographic techniques rather than adversarial machine learning."
uss_2021_125,Muse: Secure Inference Resilient to Malicious Clients.,"No. The abstract addresses the development of secure inference protocols for preserving privacy during machine learning inference, but it does not focus on adversarial attacks or manipulations typical of adversarial machine learning."
uss_2021_126,ObliCheck: Efficient Verification of Oblivious Algorithms with Unobservable State.,"No. The abstract discusses encryption and data security, focusing on how an adversary might infer information from access patterns, rather than engaging with adversarial attacks or defenses in machine learning systems."
uss_2021_127,PatchGuard: A Provably Robust Defense against Adversarial Patches via Small Receptive Fields and Masking.,"Yes, the abstract is related to AML as it discusses defenses against adversarial patches, which are a type of attack that manipulates inputs to mislead machine learning models."
uss_2021_128,T-Miner: A Generative Approach to Defend Against Trojan Attacks on DNN-based Text Classification.,"Yes. The abstract is related to AML as it discusses Trojan or backdoor attacks on Deep Neural Network classifiers, highlighting vulnerabilities and mentioning defenses specifically in the context of text domain classifiers."
uss_2021_129,WaveGuard: Understanding and Mitigating Audio Adversarial Examples.,"Yes. The abstract is related to AML because it discusses a defense framework, WaveGuard, for detecting adversarial inputs targeting deep learning-based automatic speech recognition (ASR) systems, which is a direct example of adversarial machine learning."
uss_2021_130,Cost-Aware Robust Tree Ensembles for Security Applications.,"Yes, the abstract is related to AML because it discusses increasing the attack cost for evading classifiers by implementing a robust cost-aware training method, which is a defense strategy against adversarial attacks on machine learning models."
uss_2021_131,Dompteur: Taming Audio Adversarial Examples.,"Yes. The abstract is related to AML because it discusses adversarial examples and their impact on machine learning systems, specifically highlighting the threat they pose to Automatic Speech Recognition (ASR) systems."
uss_2021_132,CADE: Detecting and Explaining Concept Drift Samples for Security Applications.,"Yes. The abstract is related to AML because it discusses the challenge of concept drift in security problems, highlighting the dynamic changes in attacker behavior that can affect the performance and reliability of machine learning models."
uss_2021_133,SIGL: Securing Software Installations Through Deep Graph Learning.,"No, the abstract is not related to AML because it focuses on detecting malicious behavior in software installation using system call activity and data provenance graphs, rather than addressing adversarial attacks or defenses specifically targeting machine learning models."
uss_2021_134,ExpRace: Exploiting Kernel Races through Raising Interrupts.,"No, the given abstract is not related to AML as it discusses kernel data races and privilege escalation attacks, which are security vulnerabilities rather than adversarial attacks on machine learning models."
uss_2021_135,Undo Workarounds for Kernel Bugs.,"No, the abstract is not related to AML as it primarily focuses on developing a technique to mitigate kernel bugs and vulnerabilities, without involving adversarial attacks or defenses in machine learning systems."
uss_2021_136,An Analysis of Speculative Type Confusion Vulnerabilities in the Wild.,"No, the given abstract is not related to AML. It discusses a hardware-based security vulnerability, Spectre v1, which exploits branch misprediction, rather than focusing on attacks or defenses in the context of machine learning systems."
uss_2021_137,Blinder: Partition-Oblivious Hierarchical Scheduling.,"No. The abstract discusses temporal isolation and covert timing channels in hierarchical scheduling, which pertains to operating systems and security rather than adversarial machine learning."
uss_2021_138,SHARD: Fine-Grained Kernel Specialization with Context-Aware Hardening.,"No, the abstract is not related to AML. It discusses kernel specialization and debloating for security purposes, but does not involve any aspect of machine learning or adversarial interactions."
uss_2021_139,Preventing Use-After-Free Attacks with Fast Forward Allocation.,"No. The abstract discusses memory safety issues and vulnerabilities in programming languages, which are related to cybersecurity, but it does not mention or involve adversarial attacks or defenses in machine learning systems."
uss_2021_140,Detecting Kernel Refcount Bugs with Two-Dimensional Consistency Checking.,"No. The abstract discusses reference counting bugs within the Linux kernel related to resource management and security impacts, not adversarial machine learning or attacks on ML systems."
uss_2021_141,"Effective Notification Campaigns on the Web: A Matter of Trust, Framing, and Support.","No, the abstract is not related to AML. It focuses on evaluating the effectiveness of security notifications for website misconfigurations, which is unrelated to adversarial machine learning attacks or defenses."
uss_2021_142,Fingerprinting in Style: Detecting Browser Extensions via Injected Style Sheets.,"No. The abstract focuses on privacy issues and online tracking related to browser extensions, but it does not specifically address adversarial attacks or defenses in the context of machine learning systems."
uss_2021_143,JAW: Studying Client-side CSRF with Hybrid Property Graphs and Declarative Traversals.,"No, the abstract is not related to AML. It focuses on a new type of Cross-Site Request Forgery (CSRF) vulnerability in JavaScript-based web applications and does not discuss attacks or defenses related to machine learning models."
uss_2021_144,AdCube: WebVR Ad Fraud and Practical Confinement of Third-Party Ads.,"No. The abstract focuses on ad fraud attacks in WebVR technology and proposes a solution to mitigate these threats, which is more relevant to web security than adversarial machine learning."
uss_2021_145,CACTI: Captcha Avoidance via Client-side TEE Integration.,"No, the abstract is not related to Adversarial Machine Learning (AML) because it discusses the use of Trusted Execution Environments (TEEs) to potentially replace or improve CAPTCHA mechanisms, without mentioning any specific adversarial attacks or defense mechanisms on machine learning systems."
uss_2021_146,PolyScope: Multi-Policy Access Control Analysis to Compute Authorized Attack Operations in Android Systems.,"No, the abstract is not related to Adversarial Machine Learning because it focuses on filesystem access control policies and vulnerabilities in Android systems without discussing attacks or defenses specific to machine learning models."
uss_2021_147,Nyx: Greybox Hypervisor Fuzzing using Fast Snapshots and Affine Types.,"No. The abstract is related to cloud infrastructure security and focuses on detecting vulnerabilities in hypervisors, but it does not discuss machine learning systems or adversarial machine learning attacks or defenses."
uss_2021_148,Systematic Evaluation of Privacy Risks of Machine Learning Models.,"Yes, this abstract is related to AML because it focuses on membership inference attacks, a type of adversarial attack on machine learning models, and discusses methods to evaluate and defend against these privacy risks."
uss_2021_149,Extracting Training Data from Large Language Models.,"Yes, the abstract is related to AML because it discusses an adversarial attack, specifically a training data extraction attack, which targets machine learning models to recover private training data."
uss_2021_150,SWIFT: Super-fast and Robust Privacy-Preserving Machine Learning.,"No. The abstract discusses a privacy-preserving machine learning framework that ensures output delivery even in the presence of adversaries, but it does not address the manipulation or exploitation of machine learning models as studied in adversarial machine learning."
uss_2021_151,Stealing Links from Graph Neural Networks.,"Yes, the abstract is related to Adversarial Machine Learning because it proposes attacks to infer confidential information from the outputs of a Graph Neural Network (GNN) model, which aligns with the concept of understanding or manipulating the behavior of machine learning systems."
uss_2021_152,Leakage of Dataset Properties in Multi-Party Machine Learning.,"Yes. The abstract is related to AML as it discusses an attack that leaks sensitive global dataset properties in a secure multi-party machine learning setting, which can infer private information about other parties' data."
uss_2021_153,Defeating DNN-Based Traffic Analysis Systems in Real-Time With Blind Adversarial Perturbations.,"Yes. The abstract is related to AML because it discusses the vulnerability of deep neural networks to adversarial examples, specifically in the context of traffic analysis, which is a form of adversarial attack."
uss_2021_154,Cerebro: A Platform for Multi-Party Cryptographic Collaborative Learning.,"No. The abstract is about a collaborative learning platform using secure multi-party computation (MPC) to protect sensitive data during joint ML computations, which is focused on data privacy and security rather than adversarial attacks on machine learning systems."
uss_2021_155,SyzVegas: Beating Kernel Fuzzing Odds with Reinforcement Learning.,"No, the abstract is not related to AML. It describes improvements to a kernel fuzzing tool (SYZVEGAS) for better coverage and crash discovery, without mentioning adversarial attacks or manipulation of machine learning models."
uss_2021_156,Android SmartTVs Vulnerability Discovery via Log-Guided Fuzzing.,"No. The abstract is focused on evaluating the security of Android SmartTVs through dynamic fuzzing, but it does not discuss or involve adversarial attacks or defenses specifically related to machine learning systems."
uss_2021_157,UNIFUZZ: A Holistic and Pragmatic Metrics-Driven Platform for Evaluating Fuzzers.,"No, the abstract is not related to AML because it focuses on evaluating and improving fuzzing tools for detecting software vulnerabilities, without specifically addressing machine learning models or adversarial attacks and defenses."
uss_2021_158,Token-Level Fuzzing.,No. The abstract discusses fuzzing techniques in the context of identifying bugs in interpreters but does not involve machine learning systems or adversarial attacks on them.
uss_2021_159,APICraft: Fuzz Driver Generation for Closed-source SDK Libraries.,"No, the abstract is not related to AML as it discusses techniques for automatically generating fuzz drivers for fuzzing closed-source libraries, which is more related to software testing and security rather than adversarial machine learning."
uss_2021_160,The Use of Likely Invariants as Feedback for Fuzzers.,"No, the given abstract is not related to AML because it discusses fuzz testing, a technique for finding software bugs, without mentioning any adversarial attacks or machine learning aspects."
uss_2021_161,ICSFuzz: Manipulating I/Os and Repurposing Binary Code to Enable Instrumented Fuzzing in ICS Control Applications.,"No. The abstract is related to security evaluation of industrial control systems and vulnerability exploitation, but it does not discuss manipulating machine learning models or systems, which is central to adversarial machine learning."
uss_2021_162,"Prime+Probe 1, JavaScript 0: Overcoming Browser-based Side-Channel Defenses.","No. The abstract focuses on cache-based side-channel attacks related to browser security and countermeasures, which are not directly related to adversarial machine learning."
uss_2021_163,Saphire: Sandboxing PHP Applications with Tailored System Call Allowlists.,"No. The abstract focuses on vulnerabilities and privilege separation issues in interpreted languages like PHP, which are more relevant to software security rather than adversarial machine learning."
uss_2021_164,SandTrap: Securing JavaScript-driven Trigger-Action Platforms.,"No. The abstract focuses on security and privacy concerns of Trigger-Action Platforms and the development of a tool for secure JavaScript integration, but does not specifically address adversarial machine learning or attacks on machine learning models."
uss_2021_165,Can I Take Your Subdomain? Exploring Same-Site Attacks in the Modern Web.,"No, the abstract is not related to AML. It is focused on related-domain attackers and their impact on web application security, which involves web vulnerabilities and cybersecurity rather than adversarial machine learning attacks or defenses."
uss_2021_166,U Can't Debug This: Detecting JavaScript Anti-Debugging Techniques in the Wild.,No. The abstract discusses security threats related to browser exploits and evasive malware but does not mention machine learning models or adversarial attacks related to them.
uss_2021_167,Abusing Hidden Properties to Attack the Node.js Ecosystem.,"No. The abstract discusses the security risks associated with sharing objects in Node.js and JavaScript programs, which pertains to general software security rather than adversarial machine learning."
uss_2021_168,mID: Tracing Screen Photos via Moiré Patterns.,"No. The abstract discusses a watermarking technique to trace file leakage via screen photographs, which focuses on digital security rather than adversarial machine learning or manipulating machine learning models."
uss_2021_169,SEAL: Storage-efficient Causality Analysis on Enterprise Logs with Query-friendly Compression.,"No, the abstract is not related to AML. It focuses on causality analysis for attack forensics and behavioral detection in network systems, rather than addressing adversarial attacks or defenses in machine learning models."
