uuid,title,response
uss_2021_0,"30th USENIX Security Symposium, USENIX Security 2021, August 11-13, 2021.","No. The abstract ""nan"" does not provide any information about its content, making it impossible to determine if it is related to Adversarial Machine Learning."
uss_2021_1,"Susan Landau, Tufts University.",No. The abstract describes the timeline and impact of the COVID-19 pandemic and does not relate to adversarial machine learning or any form of attack or defense in ML systems.
uss_2021_2,"Effect of Mood, Location, Trust, and Presence of Others on Video-Based Social Authentication.","No. The abstract focuses on exploring social authentication using video chat as a fallback mechanism, which is related to human-computer interaction and authentication, not adversarial machine learning or attacks against ML systems."
uss_2021_3,'Passwords Keep Me Safe' - Understanding What Children Think about Passwords.,"No, the given abstract is not related to AML as it focuses on children's password practices and cybersecurity education rather than discussing adversarial attacks or defenses on machine learning systems."
uss_2021_4,On the Usability of Authenticity Checks for Hardware Security Tokens.,"No. The abstract is related to the security and authenticity of hardware security tokens, rather than adversarial attacks on machine learning systems."
uss_2021_5,Inexpensive Brainwave Authentication: New Techniques and Insights on User Acceptance.,"No. The abstract discusses brainwave authentication using consumer devices, focusing on biometric identification and performance improvements, not on manipulating or defending against machine learning models."
uss_2021_6,Why Older Adults (Don't) Use Password Managers.,"No. The abstract focuses on the adoption and use of password managers among older adults, rather than discussing adversarial attacks, defenses, or the manipulation of machine learning models."
uss_2021_7,"""It's Stored, Hopefully, on an Encrypted Server"": Mitigating Users' Misconceptions About FIDO2 Biometric WebAuthn.","No, the abstract is not related to AML as it focuses on understanding misconceptions and improving usability of biometric WebAuthn, a passwordless authentication protocol, without discussing adversarial attacks or defenses on machine learning systems."
uss_2021_8,Driving 2FA Adoption at Scale: Optimizing Two-Factor Authentication Notification Design Patterns.,"No. The abstract is focused on examining the adoption of two-factor authentication to enhance security, rather than discussing the manipulation or defense of machine learning systems against adversarial attacks."
uss_2021_9,Hiding the Access Pattern is Not Enough: Exploiting Search Pattern Leakage in Searchable Encryption.,"No, the abstract is not related to AML. It focuses on encryption and privacy issues in secure data search, not on attacking or defending machine learning systems."
uss_2021_10,A Highly Accurate Query-Recovery Attack against Searchable Encryption using Non-Indexed Documents.,"No, this abstract is not related to AML because it focuses on query recovery attacks in searchable encryption schemes, which involves data security and encryption rather than manipulating or extracting information from machine learning models."
uss_2021_11,Fragment and Forge: Breaking Wi-Fi Through Frame Aggregation and Fragmentation.,"No, the abstract is not related to Adversarial Machine Learning. It focuses on design flaws in the 802.11 standard for Wi-Fi security, rather than on attacks or defenses related to manipulating machine learning systems."
uss_2021_12,Card Brand Mixup Attack: Bypassing the PIN in non-Visa Cards by Using Them for Visa Transactions.,"No, the abstract is not related to AML because it describes a security vulnerability in EMV payment systems and card brand mixup attacks, rather than adversarial manipulation or defenses specific to machine learning models."
uss_2021_13,Partitioning Oracle Attacks.,"No, this abstract is not related to AML because it focuses on cryptographic attacks involving partitioning oracles and decryption, rather than manipulation or exploitation of machine learning models."
uss_2021_14,Raccoon Attack: Finding and Exploiting Most-Significant-Bit-Oracles in TLS-DH(E).,"No. The abstract discusses cryptographic key exchange methods and their security aspects, which are related to cryptography and secure communications, not adversarial machine learning."
uss_2021_15,A Side Journey To Titan.,"No. The abstract focuses on a side-channel attack on a hardware security device, which falls under hardware security rather than adversarial machine learning."
uss_2021_16,PASAN: Detecting Peripheral Access Concurrency Bugs within Bare-Metal Embedded Applications.,"No, the abstract is not related to AML because it focuses on concurrency bugs and the challenges in protecting embedded systems from concurrent accesses, rather than adversarial machine learning attacks or defenses.
"
uss_2021_17,On the Design and Misuse of Microcoded (Embedded) Processors - A Cautionary Note.,"No. The abstract is focused on security issues and attack vectors related to microcode in microprocessors, rather than adversarial attacks or defenses on machine learning models."
uss_2021_18,M2MON: Building an MMIO-based Security Reference Monitor for Unmanned Vehicles.,"No, the abstract is focused on building a security framework for unmanned vehicles to defend against attacks through monitoring I/O activities, which is more related to cybersecurity rather than adversarial machine learning."
uss_2021_19,Sharing More and Checking Less: Leveraging Common Input Keywords to Detect Bugs in Embedded Systems.,"No. The abstract discusses security vulnerabilities in IoT devices and embedded systems, but does not mention any machine learning models or adversarial attacks related to these vulnerabilities."
uss_2021_20,Jetset: Targeted Firmware Rehosting for Embedded Systems.,"No. The abstract is focused on rehosting firmware for embedded systems via emulation, which is more related to vulnerability testing rather than adversarial machine learning."
uss_2021_21,LIGHTBLUE: Automatic Profile-Aware Debloating of Bluetooth Stacks.,"No, the abstract is not related to AML. It discusses security vulnerabilities in Bluetooth implementations but does not mention machine learning systems or adversarial attacks on them."
uss_2021_22,PACStack: an Authenticated Call Stack.,"No, the abstract is not related to AML. It discusses control-flow integrity and shadow stacks, which are concerned with general program security and protection against run-time attacks, rather than adversarial attacks on machine learning systems."
uss_2021_23,"""It's stressful having all these phones"": Investigating Sex Workers' Safety Goals, Risks, and Practices Online.","No, the given abstract is not related to AML because it focuses on how sex workers manage their digital privacy and security, rather than discussing adversarial attacks or defenses on machine learning systems."
uss_2021_24,"""Now I'm a bit angry: "" Individuals' Awareness, Perception, and Responses to Data Breaches that Affected Them.","No. The abstract focuses on individuals' awareness and responses to data breaches rather than discussing manipulation or attacks on machine learning models, which is the focus of adversarial machine learning."
uss_2021_25,"""It's the Company, the Government, You and I"": User Perceptions of Responsibility for Smart Home Privacy and Security.","No. The abstract focuses on users' perception of responsibility and concerns about privacy and security in smart home technology, but it does not discuss adversarial attacks or the manipulation of machine learning systems."
uss_2021_26,The Role of Computer Security Customer Support in Helping Survivors of Intimate Partner Violence.,"No. The abstract focuses on addressing tech-enabled intimate partner violence and improving customer support practices, which is unrelated to adversarial machine learning techniques or attacks."
uss_2021_27,Evaluating In-Workflow Messages for Improving Mental Models of End-to-End Encryption.,"No. The abstract focuses on improving users' understanding of end-to-end encryption in messaging apps, which is unrelated to adversarial machine learning or attacks on machine learning systems."
uss_2021_28,PriSEC: A Privacy Settings Enforcement Controller.,"No, the abstract is not related to AML as it focuses on enhancing user control over online privacy settings using machine learning techniques, rather than discussing any form of adversarial attacks or defenses in machine learning."
uss_2021_29,Are Privacy Dashboards Good for End Users? Evaluating User Perceptions and Reactions to Google's My Activity.,"No. The abstract discusses privacy transparency tools and user perceptions of data collection, but it does not involve adversarial attacks or defense strategies related to machine learning systems."
uss_2021_30,Mystique: Efficient Conversions for Zero-Knowledge Proofs with Applications to Machine Learning.,"No, the abstract is not related to AML. It focuses on improving the efficiency of zero-knowledge proofs for large-scale computations, which is more about cryptographic methods rather than adversarial attacks or defenses in machine learning."
uss_2021_31,Poseidon: A New Hash Function for Zero-Knowledge Proof Systems.,"No. The abstract focuses on computational integrity proof systems and their application in cryptographic hash functions, particularly in the context of cryptocurrencies, which is not related to adversarial machine learning."
uss_2021_32,Dynamic proofs of retrievability with low server storage.,"No. The abstract focuses on Proofs of Retrievability protocols, which are related to data integrity and cloud storage verification, not adversarial machine learning."
uss_2021_33,Where's Crypto?: Automated Identification and Classification of Proprietary Cryptographic Primitives in Binary Code.,"No. The abstract is focused on security evaluation of proprietary cryptography in embedded systems, which is not directly related to adversarial machine learning attacks or defenses."
uss_2021_34,Towards Formal Verification of State Continuity for Enclave Programs.,"No, the given abstract is not related to AML as it focuses on verifying state continuity in Intel SGX enclave programs, which pertains to hardware and software security rather than adversarial machine learning attacks or defenses."
uss_2021_35,Protecting Cryptography Against Compelled Self-Incrimination.,"No, this abstract is not related to Adversarial Machine Learning because it focuses on legal and privacy issues surrounding compelled decryption and self-incrimination, rather than attacks or defenses related to machine learning systems."
uss_2021_36,CSProp: Ciphertext and Signature Propagation Low-Overhead Public-Key Cryptosystem for IoT Environments.,"No, the abstract is not related to AML because it focuses on introducing a cryptographic primitive to improve security and efficiency for IoT devices, without any mention of adversarial attacks, defenses, or machine learning systems."
uss_2021_37,Automatic Extraction of Secrets from the Transistor Jungle using Laser-Assisted Side-Channel Attacks.,"No. The abstract is focused on side-channel attacks and physical security of hardware devices, not on adversarial attacks or defenses related to machine learning systems."
uss_2021_38,Lord of the Ring(s): Side Channel Attacks on the CPU On-Chip Ring Interconnect Are Practical.,"No, this abstract is not related to Adversarial Machine Learning as it discusses microarchitectural side-channel attacks on CPU ring interconnects rather than adversarial attacks or defenses within machine learning systems."
uss_2021_39,Frontal Attack: Leaking Control-Flow in SGX via the CPU Frontend.,"No. The abstract describes a side-channel attack on Intel CPUs, specifically targeting instruction execution times and SGX enclaves, but does not involve manipulating or attacking a machine learning system or model."
uss_2021_40,Charger-Surfing: Exploiting a Power Line Side-Channel for Smartphone Information Leakage.,"No, the abstract is not related to AML because it focuses on a side-channel attack that leverages power line leakage to infer touchscreen interactions, rather than attacks that manipulate or extract information from machine learning models."
uss_2021_41,VoltPillager: Hardware-based fault injection attacks against Intel SGX Enclaves using the SVID voltage scaling interface.,"No, the given abstract is related to hardware-based fault injection attacks on Intel CPUs, specifically using the VoltPillager tool, rather than discussing attacks or defenses related to machine learning systems."
uss_2021_42,CIPHERLEAKS: Breaking Constant-time Cryptography on AMD SEV via the Ciphertext Side Channel.,"No, the given abstract is related to hardware and encryption vulnerabilities in AMD's Secure Encrypted Virtualization technology, not to adversarial attacks or defenses in machine learning."
uss_2021_43,Cross-VM and Cross-Processor Covert Channels Exploiting Processor Idle Power Management.,"No, the given abstract is not related to Adversarial Machine Learning. It discusses power-efficient computing and a covert channel threat in multi-core processors, which pertains to hardware security rather than adversarial attacks on machine learning systems."
uss_2021_44,Can Systems Explain Permissions Better? Understanding Users' Misperceptions under Smartphone Runtime Permission Model.,"No, the abstract is not related to AML as it focuses on user permission management in smartphone operating systems, which pertains to privacy and user control rather than adversarial attacks or defenses in machine learning systems."
uss_2021_45,"""Shhh...be quiet!"" Reducing the Unwanted Interruptions of Notification Permission Prompts on Chrome.","No. The abstract is about improving the user interface and mechanism for notification permission prompts in Chrome, focusing on user experience rather than adversarial attacks or defenses in machine learning systems."
uss_2021_46,Explanation Beats Context: The Effect of Timing & Rationales on Users' Runtime Permission Decisions.,"No, the abstract is not related to AML because it focuses on user decision-making regarding mobile app permissions, not on adversarial machine learning techniques or defenses."
uss_2021_47,"A Large Scale Study of User Behavior, Expectations and Engagement with Android Permissions.","No. The abstract is about studying user behavior regarding Android app permissions and privacy decisions, which is not related to adversarial machine learning attacks or defenses."
uss_2021_48,Reducing Bias in Modeling Real-world Password Strength via Deep Learning and Dynamic Dictionaries.,"No, the given abstract is not related to AML because it focuses on analyzing password security and dictionary attacks without addressing machine learning systems or adversarial attacks against them."
uss_2021_49,Using Amnesia to Detect Credential Database Breaches.,"No. The abstract focuses on a framework for detecting and managing credential database breaches using decoy passwords, which is more related to cybersecurity and does not involve adversarial attacks or defenses within a machine learning context."
uss_2021_50,Incrementally Updateable Honey Password Vaults.,No. The abstract discusses a security mechanism related to password vaults and does not involve machine learning models or adversarial attacks and defenses.
uss_2021_51,Private Blocklist Lookups with Checklist.,"No, the abstract is not related to Adversarial Machine Learning (AML) because it focuses on improving privacy in blocklist lookups rather than addressing adversarial attacks or defenses in a machine learning context."
uss_2021_52,Identifying Harmful Media in End-to-End Encrypted Communication: Efficient Private Membership Computation.,"No. The abstract focuses on the challenges posed by end-to-end encryption for detecting harmful media, which is a security and privacy issue rather than an adversarial machine learning problem."
uss_2021_53,Fuzzy Labeled Private Set Intersection with Applications to Private Real-Time Biometric Search.,"No, the abstract is not related to AML because it focuses on private querying and secure set intersection for biometric data rather than discussing adversarial techniques or attacks on machine learning systems."
uss_2021_54,PrivSyn: Differentially Private Data Synthesis.,"No, the abstract is not related to AML. It focuses on generating synthetic datasets using differential privacy techniques for preserving privacy in data sharing, rather than addressing issues related to adversarial attacks or defenses in machine learning systems."
uss_2021_55,Data Poisoning Attacks to Local Differential Privacy Protocols.,"No. The abstract discusses Local Differential Privacy (LDP) protocols in the context of privacy-preserving data analysis, focusing on security and utility rather than adversarial manipulation or attacks on machine learning models."
uss_2021_56,"How to Make Private Distributed Cardinality Estimation Practical, and Get Differential Privacy for Free.","No. The abstract discusses secure computation and sketches for scalable data processing and differential privacy, but does not mention adversarial attacks or machine learning."
uss_2021_57,Locally Differentially Private Analysis of Graph Statistics.,"No. The abstract is focused on differentially private analysis of graphs in a decentralized model, which pertains to privacy and security concerns rather than adversarial manipulation or attacks on machine learning systems."
uss_2021_58,SMASH: Synchronized Many-sided Rowhammer Attacks from JavaScript.,No. The abstract is focused on exploiting Rowhammer vulnerabilities in hardware memory modules via JavaScript rather than describing attacks or defenses specifically targeting machine learning models.
uss_2021_59,Database Reconstruction from Noisy Volumes: A Cache Side-Channel Attack on SQLite.,"No, the abstract is not related to AML because it describes a cache side-channel attack on a database system, which is more closely associated with security vulnerabilities rather than manipulating or attacking machine learning models."
uss_2021_60,PTAuth: Temporal Memory Safety via Robust Points-to Authentication.,No. The abstract focuses on software vulnerabilities and memory corruption issues rather than machine learning systems or adversarial attacks.
uss_2021_61,Does logic locking work with EDA tools?,"No, the abstract is not related to AML as it focuses on logic locking techniques for hardware security, which involves protecting Boolean circuits at the hardware level rather than dealing with adversarial attacks on machine learning models."
uss_2021_62,CURE: A Security Architecture with CUstomizable and Resilient Enclaves.,"No. The abstract is about the security limitations of Trusted Execution Environments (TEEs) in general, not specifically about adversarial machine learning or how ML models can be attacked or defended against adversarial inputs."
uss_2021_63,DICE*: A Formally Verified Implementation of DICE Measured Boot.,"No. The abstract is related to ensuring secure boot processes in devices using the DICE standard, focusing on verification and memory safety, rather than adversarial machine learning or attacks on machine learning models."
uss_2021_64,PEARL: Plausibly Deniable Flash Translation Layer using WOM coding.,"No. The abstract is focused on plausible deniability and the protection of encrypted data, not on adversarial attacks or defenses concerning machine learning systems."
uss_2021_65,Examining the Efficacy of Decoy-based and Psychological Cyber Deception.,"No. The abstract focuses on cyber deception and its effects on attacker behavior in general, without specifically discussing techniques or strategies related to adversarial machine learning or attacks targeted at machine learning systems."
uss_2021_66,"Helping Users Automatically Find and Manage Sensitive, Expendable Files in Cloud Storage.","No, the abstract focuses on developing a tool for classifying and managing cloud-stored files based on perceived sensitivity and usefulness, rather than exploring adversarial machine learning attacks or defenses."
uss_2021_67,Adapting Security Warnings to Counter Online Disinformation.,"No. The abstract focuses on designing and evaluating warnings for disinformation on the internet, which pertains more to information security and user awareness rather than adversarial attacks or defenses specific to machine learning models."
uss_2021_68,"""Why wouldn't someone think of democracy as a target?"": Security practices & challenges of people involved with U.S. political campaigns.",No. The abstract focuses on digital security practices and challenges faced by political campaigns rather than on adversarial attacks or defenses against machine learning systems.
uss_2021_69,Security Obstacles and Motivations for Small Businesses from a CISO's Perspective.,"No. The abstract focuses on the challenges faced by CISOs in guiding small businesses against online threats and improving the usability of security guidance, but it does not address adversarial machine learning or related attack/defense mechanisms."
uss_2021_70,Strategies and Perceived Risks of Sending Sensitive Documents.,"No. The abstract is focused on the methods and perceptions of transmitting sensitive documents securely, rather than any aspects of adversarial machine learning or manipulating machine learning models."
uss_2021_71,A Large-Scale Interview Study on Information Security in and Attacks against Small and Medium-sized Enterprises.,"No, the abstract is not related to AML because it focuses on the general cybersecurity challenges and information security measures in SMEs, without addressing adversarial machine learning attacks or defenses on machine learning systems."
uss_2021_72,On the Routing-Aware Peering against Network-Eclipse Attacks in Bitcoin.,"No. The abstract focuses on safeguarding blockchain networks against network attacks, specifically the Erebus attack, and does not involve manipulating or defending machine learning models against adversarial inputs."
uss_2021_73,EOSAFE: Security Analysis of EOSIO Smart Contracts.,"No, the abstract is not related to AML. The focus is on analyzing and detecting vulnerabilities in EOSIO smart contracts on a blockchain platform, rather than discussing adversarial attacks or defenses specific to machine learning systems."
uss_2021_74,EVMPatch: Timely and Automated Patching of Ethereum Smart Contracts.,"No, the abstract is not related to AML, as it focuses on smart contract vulnerabilities and their mitigation in blockchain technology rather than addressing adversarial attacks or defenses in machine learning systems."
uss_2021_75,Evil Under the Sun: Understanding and Discovering Attacks on Ethereum Decentralized Applications.,"No. The abstract focuses on security risks and cybercrime related to Ethereum decentralized applications, rather than machine learning systems or adversarial attacks on them."
uss_2021_76,Smart Contract Vulnerabilities: Vulnerable Does Not Imply Exploited.,"No. The abstract is related to vulnerabilities in smart contracts on the Ethereum blockchain, rather than adversarial machine learning attacks or defenses."
uss_2021_77,Frontrunner Jones and the Raiders of the Dark Forest: An Empirical Study of Frontrunning on the Ethereum Blockchain.,"No. The abstract is related to blockchain and cryptocurrency security, specifically focusing on frontrunning attacks in Ethereum transactions, rather than adversarial machine learning."
uss_2021_78,SmarTest: Effectively Hunting Vulnerable Transaction Sequences in Smart Contracts through Language Model-Guided Symbolic Execution.,"No. The abstract focuses on symbolic execution techniques and detecting vulnerabilities in smart contracts, which does not specifically involve adversarial attacks or defenses against machine learning models."
uss_2021_79,MIRAGE: Mitigating Conflict-Based Cache Attacks with a Practical Fully-Associative Design.,"No. The abstract discusses side-channel attacks on processor caches, which pertain more to hardware security rather than adversarial machine learning."
uss_2021_80,DOLMA: Securing Speculation with the Principle of Transient Non-Observability.,"No. The abstract is related to microarchitectural and speculative execution vulnerabilities in processors, not adversarial machine learning attacks or defenses."
uss_2021_81,Osiris: Automated Discovery of Microarchitectural Side Channels.,"No, the abstract is not related to AML. It focuses on side-channel attacks targeting CPUs and cryptographic implementations, which are more relevant to hardware security rather than adversarial machine learning."
uss_2021_82,Swivel: Hardening WebAssembly against Spectre.,"No, the abstract is focused on hardening WebAssembly against Spectre attacks, which are related to microarchitectural vulnerabilities, rather than adversarial machine learning attacks or defenses."
uss_2021_83,Rage Against the Machine Clear: A Systematic Analysis of Machine Clears and Their Implications for Transient Execution Attacks.,"No, the abstract is not directly related to AML as it focuses on transient execution attacks related to hardware vulnerabilities, rather than on adversarial manipulations or defenses against machine learning models."
uss_2021_84,Coco: Co-Design and Co-Verification of Masked Software Implementations on CPUs.,"No. The abstract focuses on protecting cryptographic implementations from power analysis attacks, which are hardware-based side-channel attacks, and does not involve manipulating or attacking machine learning models."
