uuid,title,response
uss_2023_0,"32nd USENIX Security Symposium, USENIX Security 2023, Anaheim, CA, USA, August 9-11, 2023.","No, the input ""nan"" is not a valid abstract and provides no information related to adversarial machine learning."
uss_2023_1,PhyAuth: Physical-Layer Message Authentication for ZigBee Networks.,"No. The abstract is not related to AML as it focuses on securing communication in ZigBee networks from packet-injection attacks using PHY hop-by-hop message authentication, rather than discussing manipulations or defenses involving machine learning models."
uss_2023_2,Time for Change: How Clocks Break UWB Secure Ranging.,"No. The abstract is related to Ultra-Wide Band (UWB) technology vulnerabilities and transceiver clock imperfections, not on adversarial attacks on machine learning systems."
uss_2023_3,Formal Analysis and Patching of BLE-SC Pairing.,"No, the given abstract is not related to AML. It focuses on a security issue within the BLE-SC pairing protocol, which is a cryptographic and protocol-level flaw, rather than anything related to manipulating or defending against machine learning models."
uss_2023_4,Framing Frames: Bypassing Wi-Fi Encryption by Manipulating Transmit Queues.,"No, the abstract is not related to Adversarial Machine Learning (AML) as it primarily discusses vulnerabilities in Wi-Fi security protocols and frames handling rather than attacks or methods related to manipulating or understanding machine learning systems."
uss_2023_5,Abuse Vectors: A Framework for Conceptualizing IoT-Enabled Interpersonal Abuse.,"No. The abstract is focused on understanding and addressing tech-enabled interpersonal abuse through smart devices, rather than on adversarial attacks or defenses related to machine learning systems."
uss_2023_6,The Digital-Safety Risks of Financial Technologies for Survivors of Intimate Partner Violence.,"No, the abstract is not related to AML as it focuses on digital financial technologies in the context of intimate partner violence (IPV), rather than on manipulating machine learning models or systems."
uss_2023_7,"""It's the Equivalent of Feeling Like You're in Jail"": Lessons from Firsthand and Secondhand Accounts of IoT-Enabled Intimate Partner Abuse.","No, the abstract is not related to Adversarial Machine Learning because it focuses on the misuse of IoT devices for intimate partner violence, rather than discussing or addressing malicious attacks on machine learning systems."
uss_2023_8,Sneaky Spy Devices and Defective Detectors: The Ecosystem of Intimate Partner Surveillance with Covert Devices.,"No. The abstract focuses on the prevalence and detection of covert spy devices used in intimate partner surveillance, rather than on adversarial attacks or machine learning systems."
uss_2023_9,Towards a General Video-based Keystroke Inference Attack.,"Yes. The abstract is related to AML because it discusses a keystroke inference attack that uses machine learning models to extract typed content, which is an example of an adversarial inference attack on a system to compromise privacy."
uss_2023_10,Going through the motions: AR/VR keylogging from user head motions.,Yes. The abstract is related to AML because it discusses a method to infer sensitive text input using machine learning and highlights a security vulnerability in AR/VR systems.
uss_2023_11,Auditory Eyesight: Demystifying μs-Precision Keystroke Tracking Attacks on Unconstrained Keyboard Inputs.,"No. The abstract discusses revealing keyboard inputs through auditory interfaces, not manipulating machine learning systems or extracting insights about their behaviors."
uss_2023_12,Watch your Watch: Inferring Personality Traits from Wearable Activity Trackers.,"No, the given abstract is not related to AML because it focuses on the correlation between wearable activity tracker data and personality traits, without discussing any adversarial attacks or defenses in machine learning systems."
uss_2023_13,Squint Hard Enough: Attacking Perceptual Hashing with Adversarial Machine Learning.,"Yes. The abstract discusses evaluating perceptual hash functions from an adversarial perspective, which involves examining potential vulnerabilities and misuses relevant to Adversarial Machine Learning."
uss_2023_14,How to Cover up Anomalous Accesses to Electronic Health Records.,"Yes, the abstract is related to AML because it discusses the use of adversarial machine learning strategies, such as evasion and poisoning attacks, to manipulate and evaluate the effectiveness of anomaly detection systems in hospital access logs."
uss_2023_15,KENKU: Towards Efficient and Stealthy Black-box Adversarial Attacks against ASR Systems.,"Yes, the abstract is related to AML as it discusses the vulnerabilities of automatic speech recognition (ASR) systems to adversarial examples and critiques existing attack methods."
uss_2023_16,Tubes Among Us: Analog Attack on Automatic Speaker Identification.,"Yes. The abstract discusses the vulnerability of machine learning systems used in acoustics-enabled personal devices to adversarial examples created by humans, highlighting a new form of attack on ML models for tasks like speaker identification."
uss_2023_17,Efficient Unbalanced Private Set Intersection Cardinality and User-friendly Privacy-preserving Contact Tracing.,"No, the abstract is unrelated to AML because it focuses on creating a protocol for secure set intersection using cryptographic techniques without discussing machine learning or adversarial attacks."
uss_2023_18,"Near-Optimal Oblivious Key-Value Stores for Efficient PSI, PSU and Volume-Hiding Multi-Maps.","No, the given abstract is unrelated to AML as it focuses on oblivious key-value stores and data encoding efficiency, which does not involve adversarial attacks or defenses in machine learning contexts."
uss_2023_19,Distance-Aware Private Set Intersection.,"No. The abstract focuses on developing a cryptographic protocol for private set intersection in metric spaces, which does not involve adversarial attacks or defenses in machine learning systems."
uss_2023_20,Linear Private Set Union from Multi-Query Reverse Private Membership Test.,"No. The abstract discusses private set union protocols, which are concerned with securely computing the union of datasets without revealing the underlying data, a topic related to cryptography and privacy, not adversarial machine learning."
uss_2023_21,Auditing Frameworks Need Resource Isolation: A Systematic Study on the Super Producer Threat to System Auditing and Its Mitigation.,"No, the given abstract is not related to AML because it focuses on system auditing frameworks to counter APT attacks and discusses architectural improvements for data isolation rather than adversarial attacks or defenses on machine learning systems."
uss_2023_22,AIRTAG: Towards Automated Attack Investigation by Unsupervised Learning with Log Texts.,No. The abstract discusses improving the efficiency and accuracy of attack investigation using deep learning techniques without directly addressing adversarial attacks or defenses in machine learning systems.
uss_2023_23,Rethinking System Audit Architectures for High Event Coverage and Synchronous Log Availability.,"No. The abstract focuses on improving the integrity and availability of system audit logs in the presence of operating system compromises, and does not explicitly discuss adversarial attacks or defenses in the context of machine learning systems."
uss_2023_24,Improving Logging to Reduce Permission Over-Granting Mistakes.,"No. The abstract focuses on access control configurations and the challenges faced by system administrators, which is more related to security and access management rather than adversarial attacks or defenses in a machine learning context."
uss_2023_25,Diving into Robocall Content with SnorCall.,"No. The abstract is related to analyzing the content of robocalls to identify trends and improve defenses against them, but it does not involve manipulating or attacking a machine learning system, which is a key aspect of adversarial machine learning."
uss_2023_26,UCBlocker: Unwanted Call Blocking Using Anonymous Authentication.,"No. The abstract focuses on a system to block unwanted phone calls using caller authentication and policy definition, and does not involve attacking or defending machine learning models, which is central to adversarial machine learning."
uss_2023_27,Combating Robocalls with Phone Virtual Assistant Mediated Interaction.,No. This abstract is not related to Adversarial Machine Learning as it discusses a defense mechanism against robocalls using NLP and machine learning but does not mention any adversarial attacks or manipulations against machine learning models.
uss_2023_28,"BotScreen: Trust Everybody, but Cut the Aimbots Yourself.","No. The abstract is about detecting aimbots in a video game using deep learning for unusual behavior, but it doesn't involve manipulating or attacking a machine learning system itself to exploit or influence its behavior, which is a core aspect of adversarial machine learning."
uss_2023_29,"""If I could do this, I feel anyone could: "" The Design and Evaluation of a Secondary Authentication Factor Manager.","No, the given abstract is not related to AML because it focuses on improving user experience and efficiency with two-factor authentication management, rather than discussing adversarial attacks or defenses on machine learning systems."
uss_2023_30,Exploring Privacy and Incentives Considerations in Adoption of COVID-19 Contact Tracing Apps.,"No, the abstract is not related to AML because it focuses on improving the adoption and design of mHealth apps for contact tracing by analyzing privacy concerns and user preferences, without addressing adversarial attacks or defenses in machine learning systems."
uss_2023_31,Exploring Tenants' Preferences of Privacy Negotiation in Airbnb.,No. This abstract is related to privacy negotiation in smart homes and does not discuss adversarial attacks or the manipulation of machine learning systems.
uss_2023_32,"Know Your Cybercriminal: Evaluating Attacker Preferences by Measuring Profile Sales on an Active, Leading Criminal Market for User Impersonation at Scale.","No. While the abstract discusses cybercrime and user impersonation, it does not directly address adversarial attacks or manipulations against machine learning models, which are central to AML."
uss_2023_33,HorusEye: A Realtime IoT Malicious Traffic Detection Framework using Programmable Switches.,"No, the abstract is not related to AML. It discusses an anomaly detection framework for IoT traffic, but does not involve adversarial machine learning techniques, attacks, or defenses."
uss_2023_34,An Input-Agnostic Hierarchical Deep Learning Framework for Traffic Fingerprinting.,"No. The abstract discusses a deep learning framework for traffic fingerprinting, focusing on feature extraction and input processing heterogeneity, without mentioning any adversarial attacks or defenses related to machine learning systems."
uss_2023_35,Subverting Website Fingerprinting Defenses with Robust Traffic Representation.,"Yes, the abstract is related to AML because it discusses a novel website fingerprinting attack aimed at bypassing defenses and fingerprinting Tor traffic, which involves adversarial techniques against machine learning-based defenses."
uss_2023_36,Rosetta: Enabling Robust TLS Encrypted Traffic Classification in Diverse Network Environments with TCP-Aware Traffic Augmentation.,"No, the abstract is not related to AML because it focuses on improving the robustness of deep learning models for encrypted traffic classification in diverse network environments, rather than discussing adversarial attacks or defenses against machine learning models."
uss_2023_37,Towards Targeted Obfuscation of Adversarial Unsafe Images using Reconstruction and Counterfactual Super Region Attribution Explainability.,"Yes, the abstract is related to AML because it discusses the use of adversarial attacks to evade AI/ML-based detectors on social networks and presents a system to address these adversarial attack threats."
uss_2023_38,TPatch: A Triggered Physical Adversarial Patch.,"Yes, the abstract is related to AML because it discusses the development of a physical adversarial patch (TPatch) designed to manipulate perception models in autonomous vehicles, demonstrating an attack on their machine learning components and considering defenses."
uss_2023_39,CAPatch: Physical Adversarial Patch against Image Captioning Systems.,"Yes, the abstract is related to AML because it discusses the creation of a physical adversarial patch, CAPatch, designed to fool multi-modal image captioning systems, which is a form of adversarial attack in machine learning."
uss_2023_40,Hard-label Black-box Universal Adversarial Patch Attack.,"Yes, the given abstract is related to AML because it discusses a novel method for generating adversarial patches to manipulate deep learning model outputs, raising concerns about the security and robustness of these models."
uss_2023_41,Anatomy of a High-Profile Data Breach: Dissecting the Aftermath of a Crypto-Wallet Case.,"No. The given abstract focuses on data breaches and their impact on individuals, particularly concerning the secure storage of crypto-assets, rather than discussing adversarial attacks or defenses related to machine learning systems."
uss_2023_42,Glimpse: On-Demand PoW Light Client with Constant-Size Storage for DeFi.,"No, the given abstract is not related to AML, as it focuses on blockchain interoperability and does not discuss adversarial attacks, manipulation, or defenses related to machine learning systems.
"
uss_2023_43,Mixed Signals: Analyzing Ground-Truth Data on the Users and Economics of a Bitcoin Mixing Service.,"No, the abstract is related to Bitcoin mixing and privacy concerns, not to adversarial attacks or machine learning systems, so it is not related to AML."
uss_2023_44,Is Your Wallet Snitching On You? An Analysis on the Privacy Implications of Web3.,"No, the abstract is not related to AML because it focuses on privacy implications and information exposure in Web3 technologies, rather than the manipulation or attack of machine learning systems."
uss_2023_45,Capstone: A Capability-based Foundation for Trustless Secure Memory Access.,"No, the abstract is not related to AML. It discusses architectural capability designs for memory isolation, focusing on security and efficiency, not on adversarial attacks or defenses for machine learning systems."
uss_2023_46,FloatZone: Accelerating Memory Error Detection using the Floating Point Unit.,"No, the abstract is unrelated to AML as it discusses memory sanitizers for detecting programming errors, rather than adversarial attacks or defenses in machine learning systems."
uss_2023_47,PUMM: Preventing Use-After-Free Using Execution Unit Partitioning.,"No, the abstract is not related to AML because it focuses on memory security in software written in memory unsafe languages and does not involve machine learning models or their vulnerabilities."
uss_2023_48,MTSan: A Feasible and Practical Memory Sanitizer for Fuzzing COTS Binaries.,"No. The abstract is focused on fuzzing as a technique for finding vulnerabilities in binary programs, which is more related to software testing and debugging rather than adversarial machine learning."
uss_2023_49,"Hidden Reality: Caution, Your Hand Gesture Inputs in the Immersive Virtual World are Visible to All!",No. The abstract focuses on a side-channel attack targeting VR device interactions rather than exploiting or manipulating machine learning systems.
uss_2023_50,LocIn: Inferring Semantic Location from Spatial Maps in Mixed Reality.,"Yes, the abstract is related to AML because it describes a location inference attack that uses a machine learning model to extract and exploit features from 3D spatial maps, which aligns with the concept of adversarially extracting information from machine learning systems."
uss_2023_51,"Unique Identification of 50, 000+ Virtual Reality Users from Head & Hand Motion Data.","No. The abstract is focused on identifying users based on biometric data within virtual reality environments, which pertains more to privacy concerns rather than adversarial attacks in machine learning."
uss_2023_52,Exploring User Reactions and Mental Models Towards Perceptual Manipulation Attacks in Mixed Reality.,"Yes, the abstract is related to AML as it discusses perceptual manipulation attacks in mixed reality, which involves altering user input to influence judgments and actions, akin to adversarial attacks in machine learning."
uss_2023_53,Erebus: Access Control for Augmented Reality Systems.,"No, the abstract is not related to AML because it focuses on access control and permission management for AR platforms rather than addressing adversarial attacks or defenses in machine learning systems."
uss_2023_54,No Single Silver Bullet: Measuring the Accuracy of Password Strength Meters.,"No. The abstract is related to improving password strength meters and evaluating their accuracy, but it doesn't discuss adversarial attacks or defenses in the context of machine learning."
uss_2023_55,Password Guessing Using Random Forest.,"No. The abstract describes research on password guessing using classical machine learning, which does not specifically involve manipulating or attacking machine learning models as in adversarial machine learning."
uss_2023_56,Pass2Edit: A Multi-Step Generative Model for Guessing Edited Passwords.,"No. The abstract focuses on password tweaking attacks and how users modify passwords, which is related to security but does not explicitly address adversarial machine learning or attacks on machine learning models."
uss_2023_57,Improving Real-world Password Guessing Attacks via Bi-directional Transformers.,"No. The abstract discusses password guessing attacks using NLP techniques, but it does not specifically address adversarial attacks or defenses related to machine learning models."
uss_2023_58,Araña: Discovering and Characterizing Password Guessing Attacks in Practice.,No. The abstract is related to analyzing and understanding password guessing attacks rather than adversarial techniques specifically targeting machine learning models.
uss_2023_59,PoliGraph: Automated Privacy Policy Analysis using Knowledge Graphs.,"No. The abstract discusses an NLP-based tool for analyzing privacy policies, which focuses on extracting and analyzing text regarding data collection but does not address adversarial attacks or defenses in machine learning systems."
uss_2023_60,Calpric: Inclusive and Fine-grain Labeling of Privacy Policies with Crowdsourcing and Active Learning.,"No. The abstract focuses on developing a cost-effective method for generating training data for privacy policies using techniques like automatic text selection and active learning, rather than discussing adversarial attacks or defenses in machine learning."
uss_2023_61,POLICYCOMP: Counterpart Comparison of Privacy Policies Uncovers Overbroad Personal Data Collection Practices.,"No. The abstract focuses on evaluating the necessity of personal data collection practices in mobile apps' privacy policies in relation to data minimization principles, rather than addressing adversarial machine learning or attacks on ML systems."
uss_2023_62,Lalaine: Measuring and Characterizing Non-Compliance of Apple Privacy Labels.,"No, the given abstract is not related to AML. It discusses the accuracy and compliance of privacy labels for iOS apps and does not mention any manipulation or attacks on machine learning systems."
uss_2023_63,Automated Cookie Notice Analysis and Enforcement.,"No, the given abstract is not related to AML because it focuses on detecting and interacting with cookie notices on websites to improve privacy compliance, rather than manipulating or extracting information from machine learning systems."
uss_2023_64,Continuous Learning for Android Malware Detection.,"No, the abstract is not related to AML. It discusses the issue of concept drift affecting the performance of malware classifiers, but it does not mention any adversarial attacks or defense mechanisms."
uss_2023_65,Humans vs. Machines in Malware Classification.,"No, the abstract is not related to AML. It discusses the process of file classification using machine learning and other methods without referencing any adversarial techniques or defenses against such attacks."
uss_2023_66,Adversarial Training for Raw-Binary Malware Classifiers.,Yes. The abstract is related to Adversarial Machine Learning (AML) because it discusses creating and using adversarial examples to evaluate and improve the robustness of malware classification models against evasion attacks.
uss_2023_67,Black-box Adversarial Example Attack towards FCG Based Android Malware Detection under Incomplete Feature Information.,"Yes, the abstract is related to AML as it discusses the design of a black-box adversarial example attack against an Android malware detection system, which involves manipulating machine learning inputs to produce misleading outcomes."
uss_2023_68,Evading Provenance-Based ML Detectors with Adversarial System Actions.,Yes. The abstract is related to AML because it discusses a framework designed to generate adversarial attacks that aim to evade machine learning security detectors.
uss_2023_69,TreeSync: Authenticated Group Management for Messaging Layer Security.,"No. The abstract is related to the security and integrity of group messaging protocols, specifically focusing on Messaging Layer Security (MLS), and does not discuss adversarial attacks or defenses related to machine learning systems."
uss_2023_70,Formal Analysis of Session-Handling in Secure Messaging: Lifting Security from Sessions to Conversations.,"No, the abstract is not related to AML. It focuses on the security properties of messaging protocols, specifically discussing secure communication aspects like Forward Secrecy and Post-Compromise Security, rather than dealing with adversarial attacks or defenses in machine learning."
uss_2023_71,Cryptographic Administration for Secure Group Messaging.,"No, the given abstract is not related to AML because it focuses on cryptographic approaches to improve group messaging systems' security rather than addressing attacks or defenses specific to machine learning systems."
uss_2023_72,Wink: Deniable Secure Messaging.,"No, the abstract is not related to Adversarial Machine Learning as it focuses on enhancing message confidentiality within end-to-end encrypted messaging systems using plausible deniability techniques, rather than discussing attacks or defenses related to machine learning models."
uss_2023_73,Three Lessons From Threema: Analysis of a Secure Messenger.,"No, the abstract is not related to AML as it focuses on the cryptographic analysis and security of an encrypted messaging application, rather than manipulating or defending against machine learning systems."
uss_2023_74,MorFuzz: Fuzzing Processor via Runtime Instruction Morphing enhanced Synchronizable Co-simulation.,"No. The abstract is about hardware fuzzing techniques used to verify processor designs, which does not relate to adversarial machine learning or attacks on machine learning models."
uss_2023_75,µFUZZ: Redesign of Parallel Fuzzing using Microservice Architecture.,"No, the given abstract is not related to AML. It discusses software testing techniques for detecting software bugs, rather than attacks or defenses related to machine learning models."
uss_2023_76,FISHFUZZ: Catch Deeper Bugs by Throwing Larger Nets.,"No, the abstract is related to software testing and bug discovery through fuzzing techniques rather than adversarial machine learning or manipulating machine learning systems."
uss_2023_77,HyPFuzz: Formal-Assisted Processor Fuzzing.,"No. The abstract is about hardware fuzzers detecting security vulnerabilities in processors, which relates to hardware security rather than adversarial machine learning."
uss_2023_78,PolyFuzz: Holistic Greybox Fuzzing of Multi-Language Systems.,"No, the given abstract is not related to AML because it focuses on software security testing through fuzzing for multi-language systems, rather than on manipulating or securing machine learning models against adversarial attacks."
uss_2023_79,VIPER: Spotting Syscall-Guard Variables for Data-Only Attacks.,"No. The abstract is focused on data-only attacks and control-flow protection techniques within general software security, not on adversarial attacks or defenses specific to machine learning systems."
uss_2023_80,AURC: Detecting Errors in Program Code and Documentation.,"No. The abstract discusses error detection in program code and documentation, focusing on discovering vulnerabilities and inconsistencies, but it does not address manipulating machine learning models or adversarial attacks."
uss_2023_81,Not All Data are Created Equal: Data and Pointer Prioritization for Scalable Protection Against Data-Oriented Attacks.,"No, the given abstract is not related to AML as it focuses on data-oriented attacks within operating systems and proposes a framework for prioritizing data objects for protection, but does not address attacks or defenses specifically in the context of machine learning systems."
uss_2023_82,SAFER: Efficient and Error-Tolerant Binary Instrumentation.,"No, this abstract is not related to adversarial machine learning (AML) because it focuses on binary instrumentation techniques to improve performance and safety in code transformation, rather than addressing any machine learning models or adversarial attacks on them."
uss_2023_83,Reassembly is Hard: A Reflection on Challenges and Strategies.,"No. The abstract discusses static binary rewriting and error detection in reassemblers, which are not directly related to adversarial machine learning techniques or attacks."
