uuid,title,response
uss_2023_334,Cross Container Attacks: The Bewildered eBPF on Clouds.,"No. The abstract is focused on security risks and attack surfaces associated with eBPF in container environments, rather than manipulating or extracting information from machine learning systems which is the focus of adversarial machine learning."
uss_2023_335,DScope: A Cloud-Native Internet Telescope.,"No. The abstract discusses a cloud-based Internet telescope designed for monitoring and analyzing network traffic, but it does not address machine learning systems or adversarial attacks, which are central to adversarial machine learning."
uss_2023_336,Credit Karma: Understanding Security Implications of Exposed Cloud Services through Automated Capability Inference.,"No. The abstract is focused on data security and over-privileged cloud credentials, which is related to cloud security vulnerabilities rather than adversarial attacks on machine learning models."
uss_2023_337,Detecting Multi-Step IAM Attacks in AWS Environments via Model Checking.,"No. The abstract discusses cloud services, security vulnerabilities, and the use of model checking for verification, but it does not address adversarial attacks or manipulations related to machine learning systems."
uss_2023_338,Remote Direct Memory Introspection.,"No, the abstract is not related to AML as it focuses on hypervisor offloading for cloud security and performance improvements, with no mention of adversarial attacks or defense mechanisms in machine learning systems."
uss_2023_339,Auditing Framework APIs via Inferred App-side Security Specifications.,"No. The abstract focuses on auditing access control implementations for Android private framework APIs, which pertains to security and privacy rather than adversarial attacks or defenses in machine learning systems."
uss_2023_340,WHIP: Improving Static Vulnerability Detection in Web Application by Forcing tools to Collaborate.,"No. The abstract focuses on improving static application security testing (SAST) to detect vulnerabilities in web applications, which is more related to traditional software security rather than adversarial machine learning."
uss_2023_341,SQIRL: Grey-Box Detection of SQL Injection Vulnerabilities Using Reinforcement Learning.,"No, the abstract is not related to AML. It discusses web security scanners and their limitations in detecting SQL injection vulnerabilities but does not involve manipulating machine learning models or adversarial techniques."
uss_2023_342,Hiding in Plain Sight: An Empirical Study of Web Application Abuse in Malware.,"No. The abstract is focused on detecting and analyzing web applications being abused by malware, rather than specifically addressing adversarial attacks or defenses on machine learning models."
uss_2023_343,Bilingual Problems: Studying the Security Risks Incurred by Native Extensions in Scripting Languages.,"No, the abstract is not related to AML. It discusses the security implications of using native extensions in scripting languages, which is a topic more related to software security rather than adversarial machine learning."
uss_2023_344,Did the Shark Eat the Watchdog in the NTP Pool? Deceiving the NTP Pool's Monitoring System.,"No. The abstract focuses on analyzing and enhancing the security of the NTP pool, not on adversarial attacks or defenses against machine learning systems."
uss_2023_345,Device Tracking via Linux's New TCP Source Port Selection Algorithm.,"No. This abstract describes a tracking technique exploiting a network protocol implementation for device identification, which is more related to security and privacy concerns rather than adversarial machine learning."
uss_2023_346,Temporal CDN-Convex Lens: A CDN-Assisted Practical Pulsing DDoS Attack.,"No, the abstract is not related to Adversarial Machine Learning (AML) because it discusses the exploitation of CDNs to compromise service availability, which is more related to network security rather than manipulating machine learning models."
uss_2023_347,An Efficient Design of Intelligent Network Data Plane.,"No. The abstract discusses enhancing intelligent network traffic analysis and model deployment efficiency, but it does not mention adversarial manipulations or threats specific to machine learning models."
uss_2023_348,Glowing in the Dark: Uncovering IPv6 Address Discovery and Scanning Strategies in the Wild.,No. The abstract is focused on identifying scanning strategies of IPv6 scanners on the Internet and does not involve machine learning or adversarial attacks related to it.
uss_2023_349,Oops..! I Glitched It Again! How to Multi-Glitch the Glitching-Protections on ARM TrustZone-M.,"No, the given abstract is not related to AML because it focuses on voltage fault injection attacks, which are more concerned with hardware security rather than manipulating machine learning models or their inputs."
uss_2023_350,SHELTER: Extending Arm CCA with Isolation in User Space.,"No, the abstract is not related to AML as it focuses on confidentiality and security issues related to TrustZone, rather than adversarial machine learning techniques or attacks on machine learning models."
uss_2023_351,"Hot Pixels: Frequency, Power, and Temperature Attacks on GPUs and Arm SoCs.","No. The abstract discusses side-channel attacks related to hardware and computing devices, not adversarial attacks or defenses within machine learning systems."
uss_2023_352,SpectrEM: Exploiting Electromagnetic Emanations During Transient Execution.,"No. This abstract is related to transient execution attacks exploiting physical side channels on processors, which is more relevant to cybersecurity and hardware security rather than adversarial machine learning."
uss_2023_353,ARMore: Pushing Love Back Into Binaries.,"No. The abstract is focused on static rewriting for the ARM architecture to improve software introspection and coverage analysis, without mentioning adversarial machine learning or related attacks/defenses."
uss_2023_354,Secure Floating-Point Training.,"No. The abstract is focused on enhancing secure two-party computation protocols for floating-point arithmetic in the context of deep learning, which relates more to cryptographic efficiency in ML rather than adversarial attacks or defenses."
uss_2023_355,NeuroPots: Realtime Proactive Defense against Bit-Flip Attacks in Neural Networks.,"Yes. The abstract discusses bit-flip attacks on deep neural networks, which are a form of adversarial attack, and presents a defense mechanism to detect and recover from such attacks, aligning with concepts in adversarial machine learning."
uss_2023_356,FedVal: Different good or different bad in federated learning.,"Yes, the abstract is related to AML as it addresses the susceptibility of federated learning systems to poisoning attacks and proposes a method to enhance robustness and fairness against these adversarial threats."
uss_2023_357,Gradient Obfuscation Gives a False Sense of Security in Federated Learning.,"Yes. The abstract is related to AML as it discusses reconstruction attacks on federated learning, highlighting vulnerabilities in privacy protection and proposing a new attack framework related to adversarial tactics."
uss_2023_358,FreeEagle: Detecting Complex Neural Trojans in Data-Free Cases.,"Yes. The abstract addresses a Trojan or backdoor attack on deep neural networks, which is a form of adversarial attack in the context of adversarial machine learning, as well as proposing a method for its detection."
uss_2023_359,Prime Match: A Privacy-Preserving Inventory Matching System.,"No, the abstract is related to financial trading and inventory matching in stock markets, not about machine learning or adversarial attacks."
uss_2023_360,Squirrel: A Scalable Secure Two-Party Computation Framework for Training Gradient Boosting Decision Tree.,"No, the abstract is not related to AML. It focuses on secure multi-party computation for privacy-preserving training of a Gradient Boosting Decision Tree, rather than adversarial attacks or defenses against machine learning models."
uss_2023_361,Eos: Efficient Private Delegation of zkSNARK Provers.,"No. The abstract focuses on cryptographic techniques for privacy protection, rather than addressing adversarial interactions with machine learning systems."
uss_2023_362,Machine-checking Multi-Round Proofs of Shuffle: Terelius-Wikstrom and Bayer-Groth.,"No, the abstract is not related to AML. It focuses on the security of electronic voting systems and the verification of proofs of shuffle, which is more relevant to cryptography and secure computation rather than adversarial machine learning."
uss_2023_363,TAP: Transparent and Privacy-Preserving Data Services.,"No. The abstract focuses on building a multi-user system for data privacy, integrity, and transparency, but it does not address any manipulation or security challenges specifically related to machine learning models."
uss_2023_364,Trojan Source: Invisible Vulnerabilities.,No. The abstract describes an attack exploiting text-encoding subtleties in source code for vulnerabilities but does not mention machine learning or adversarial manipulation of ML systems specifically.
uss_2023_365,Cheesecloth: Zero-Knowledge Proofs of Real World Vulnerabilities.,"No. This abstract discusses the dilemma faced by security analysts when disclosing software vulnerabilities, which is more related to cybersecurity and vulnerability management, not adversarial machine learning."
uss_2023_366,V1SCAN: Discovering 1-day Vulnerabilities in Reused C/C++ Open-source Software Components Using Code Classification Techniques.,"No, the abstract is not related to AML because it focuses on detecting vulnerabilities in open-source software components, rather than exploring or defending against adversarial attacks on machine learning models."
uss_2023_367,VulChecker: Graph-based Vulnerability Localization in Source Code.,"No, the abstract is not related to AML because it focuses on using deep learning for detecting code vulnerabilities without mention of adversarial threats or attacks targeting machine learning models."
uss_2023_368,DISTDET: A Cost-Effective Distributed Cyber Threat Detection System.,"No. The abstract describes a distributed detection system for Advanced Persistent Threat (APT) attacks using provenance graphs, but it does not specifically mention adversarial attacks or adversarial machine learning techniques."
uss_2023_369,Automated Security Analysis of Exposure Notification Systems.,"No. The abstract is focused on analyzing the security of exposure notification systems, which is more about public health data privacy than adversarial machine learning attacks or defenses."
uss_2023_370,Formal Analysis of SPDM: Security Protocol and Data Model version 1.2.,"No, the abstract is not related to AML as it focuses on standardizing a security protocol for securing communication and device attestation, without any mention of machine learning or adversarial attacks."
uss_2023_371,One Size Does Not Fit All: Uncovering and Exploiting Cross Platform Discrepant APIs in WeChat.,"No. The abstract focuses on identifying API discrepancies for platform fingerprinting in mobile and desktop apps, which targets application vulnerabilities rather than specific adversarial manipulations in machine learning models."
uss_2023_372,The Most Dangerous Codec in the World: Finding and Exploiting Vulnerabilities in H.264 Decoders.,"No. The abstract discusses security risks and vulnerabilities associated with video encoding standards, not adversarial machine learning or interactions with machine learning systems."
uss_2023_373,Are You Spying on Me? Large-Scale Analysis on IoT Data Exposure through Companion Apps.,"No. The abstract focuses on analyzing unauthorized data exposure and privacy implications in IoT devices and their companion apps, without discussing any manipulation or adversarial attacks on machine learning models."
uss_2023_374,Strategies and Vulnerabilities of Participants in Venezuelan Influence Operations.,"No, the abstract is not related to AML as it focuses on human participants in influence operations and their strategies on social media platforms, rather than on machine learning systems and adversarial attacks or defenses."
uss_2023_375,TRIDENT: Towards Detecting and Mitigating Web-based Social Engineering Attacks.,"No, the abstract is not related to AML. It focuses on detecting web-based social engineering attacks aimed at human users rather than adversarial attacks or defenses targeting machine learning systems."
uss_2023_376,Fact-Saboteurs: A Taxonomy of Evidence Manipulation Attacks against Fact-Verification Systems.,"Yes, the abstract is related to AML as it discusses adversarial attacks on fact-checking models by tampering with online evidence to degrade their performance."
uss_2023_377,"Reversing, Breaking, and Fixing the French Legislative Election E-Voting Protocol.",No. The abstract is focused on the security analysis of an e-voting protocol and does not involve adversarial machine learning or the manipulation of machine learning models.
uss_2023_378,PROVIDENCE: a Flexible Round-by-Round Risk-Limiting Audit.,"No, the given abstract is not related to AML because it focuses on risk-limiting audits for election tabulation, which pertains to election security and data auditing rather than adversarial machine learning attacks or defenses."
uss_2023_379,NVLeak: Off-Chip Side-Channel Attacks via Non-Volatile Memory Systems.,No. The abstract is focused on microarchitectural side-channel attacks and defenses related to NVRAM hardware rather than on manipulating or defending machine learning models specifically.
uss_2023_380,Cipherfix: Mitigating Ciphertext Side-Channel Attacks in Software.,"No, the abstract is not related to AML. It focuses on side-channel vulnerabilities and hardware security in trusted execution environments, which do not involve machine learning models or adversarial manipulation of such models."
uss_2023_381,Side-Channel Attacks on Optane Persistent Memory.,"No, the given abstract is not related to AML. It focuses on the security implications of a new memory storage technology rather than adversarial attacks or defenses in machine learning systems."
uss_2023_382,Pspray: Timing Side-Channel based Linux Kernel Heap Exploitation Technique.,"No, the given abstract is not related to AML as it focuses on the stealthiness of exploits related to heap-based vulnerabilities in the Linux kernel, which pertains more to cybersecurity rather than adversarial machine learning."
uss_2023_383,CipherH: Automated Detection of Ciphertext Side-channel Vulnerabilities in Cryptographic Implementations.,"No. The abstract focuses on a side-channel attack exploiting vulnerabilities in trusted execution environments and deterministic memory encryption, which pertains to cryptographic security, not adversarial machine learning."
uss_2023_384,ICSPatch: Automated Vulnerability Localization and Non-Intrusive Hotpatching in Industrial Control Systems using Data Dependence Graphs.,"No. The abstract is focused on patching vulnerabilities in Operational Technology (OT) devices using ICSPatch, with no mention of adversarial attacks or defenses related to machine learning systems."
uss_2023_385,Access Denied: Assessing Physical Risks to Internet Access Networks.,"No, the abstract is not related to AML because it discusses the vulnerability of regional access networks to physical attacks, not malicious manipulation or adversarial attacks on machine learning systems."
uss_2023_386,ZBCAN: A Zero-Byte CAN Defense System.,"No. The abstract is focused on securing the Controller Area Network (CAN) protocol against communication attacks in various systems, without explicit reference to adversarial machine learning or attacks targeting machine learning models."
uss_2023_387,RIDAS: Real-time identification of attack sources on controller area networks.,"No, the abstract is not related to AML. The focus is on identification and response to cyber attacks on vehicle networks rather than adversarial manipulation or extraction of information from machine learning models."
uss_2023_388,That Person Moves Like A Car: Misclassification Attack Detection for Autonomous Systems Using Spatiotemporal Consistency.,"Yes. The abstract discusses developing a defense mechanism, PercepGuard, to detect misclassification attacks in object detection and tracking systems, which falls under the domain of adversarial machine learning."
uss_2023_389,TRust: A Compilation Framework for In-process Isolation to Protect Safe Rust against Untrusted Code.,"No, the abstract is not related to AML. It focuses on enhancing security in Rust programming through a compilation framework, rather than discussing adversarial attacks or defenses in machine learning systems."
uss_2023_390,Jinn: Hijacking Safe Programs with Trojans.,"No, the abstract is related to hardware security rather than adversarial machine learning, as it discusses hardware trojans and their impact on hardware-enforced security mechanisms, not attacks or defenses relevant to machine learning systems."
uss_2023_391,ARGUS: A Framework for Staged Static Taint Analysis of GitHub Workflows and Actions.,"No. The abstract focuses on identifying and analyzing code injection vulnerabilities in GitHub Actions, which is a topic related to software security rather than adversarial machine learning."
uss_2023_392,McFIL: Model Counting Functionality-Inherent Leakage.,"No. The abstract focuses on cryptographic techniques for data confidentiality and secure computation, not on adversarial attacks or defenses in machine learning."
uss_2023_393,Extracting Protocol Format as State Machine via Controlled Static Loop Analysis.,"No. The abstract discusses static program analysis for protocol message formats and enhancing protocol fuzzers, but it does not address adversarial machine learning or related attack and defense techniques."
uss_2023_394,Isolated and Exhausted: Attacking Operating Systems via Site Isolation in the Browser.,"No, the abstract is not related to AML because it deals with browser security architecture and OS resource exhaustion attacks, which are unrelated to machine learning models or adversarial attacks on them."
uss_2023_395,Extending a Hand to Attackers: Browser Privilege Escalation Attacks via Extensions.,"No, the abstract is not related to AML. It discusses security practices and architectures in web browsers, specifically concerning the principle of least privilege and browser extensions, but does not mention adversarial attacks or machine learning models."
uss_2023_396,RøB: Ransomware over Modern Web Browsers.,"No, the abstract is not related to AML because it focuses on a new attack vector using the File System Access API and WebAssembly for developing ransomware, rather than manipulating or attacking machine learning models."
uss_2023_397,Pool-Party: Exploiting Browser Resource Pools for Web Tracking.,"No. The abstract discusses covert channels in web browsers used for cross-site tracking, which is related to browser security and privacy vulnerabilities, not adversarial machine learning."
uss_2023_398,Checking Passwords on Leaky Computers: A Side Channel Analysis of Chrome's Password Leak Detect Protocol.,"No, the abstract is not related to AML as it focuses on password leakage detection and credential stuffing attacks, which are more relevant to cybersecurity rather than adversarial attacks on machine learning models."
uss_2023_399,Ultimate SLH: Taking Speculative Load Hardening to the Next Level.,"No, the given abstract is not related to AML as it focuses on addressing the Spectre v1 vulnerability in computer processors and compiler-based defenses rather than on adversarial attacks and defenses in machine learning systems."
uss_2023_400,Speculation at Fault: Modeling and Testing Microarchitectural Leakage of CPU Exceptions.,"No. The abstract discusses microarchitectural leakage models used for secure compilation and verification in hardware and software, which is more related to hardware security rather than adversarial machine learning."
uss_2023_401,ProSpeCT: Provably Secure Speculation for the Constant-Time Policy.,"No, the abstract is not related to AML. It focuses on providing a formal processor model to secure against Spectre attacks in hardware speculation, which is more relevant to hardware security rather than adversarial machine learning."
uss_2023_402,Title Redacted Due to Vulnerability Embargo.,"No. The abstract focuses on transient execution attacks that target hardware vulnerabilities in CPUs, not on adversarial attacks against machine learning models."
uss_2023_403,FACE-AUDITOR: Data Auditing in Facial Recognition Systems.,"Yes. The abstract discusses modifying facial images to prevent misuse and adaptive attacks, which falls under the realm of adversarial machine learning, as it involves defending against unauthorized or malicious use of facial recognition systems."
uss_2023_404,UnGANable: Defending Against GAN-based Face Manipulation.,"Yes. The abstract is related to AML as it discusses a defense mechanism, UnGANable, against GAN-inversion-based face manipulation, an adversarial attack on machine learning models."
uss_2023_405,Fairness Properties of Face Recognition and Obfuscation Systems.,"Yes, the abstract is related to AML because it discusses the use of evasion attacks to create perturbed images that cause face recognition systems, which are based on metric embedding networks, to misidentify users."
uss_2023_406,GlitchHiker: Uncovering Vulnerabilities of Image Signal Transmission with IEMI.,"Yes. The abstract describes a new type of attack, the GlitchHiker attack, that leverages vulnerabilities in the camera's image signal transmission to manipulate camera inputs, potentially affecting object and face detectors, which aligns with the concepts of evasion attacks in adversarial machine learning."
uss_2023_407,(M)WAIT for It: Bridging the Gap between Microarchitectural and Architectural Side Channels.,"No. The abstract is related to microarchitectural attacks on CPUs, which involve exploiting hardware vulnerabilities rather than manipulating inputs or outputs in a machine learning system."
uss_2023_408,Collide+Power: Leaking Inaccessible Data with Software-based Power Side Channels.,"No. The abstract is related to a side-channel attack (Differential Power Analysis) on modern CPUs, which is a hardware security threat, rather than an adversarial machine learning attack on a machine learning model."
uss_2023_409,Inception: Exposing New Attack Surfaces with Training in Transient Execution.,"No. The abstract is focused on hardware-based and microarchitectural attacks rather than adversarial machine learning, which deals with manipulating inputs to deceive machine learning models or extracting information from them."
uss_2023_410,BunnyHop: Exploiting the Instruction Prefetcher.,"No. The given abstract is related to microarchitecture and instruction prefetching, not adversarial machine learning or attacks on machine learning models."
uss_2023_411,Can a Deep Learning Model for One Architecture Be Used for Others? Retargeted-Architecture Binary Code Analysis.,"No, the abstract is not related to AML. It focuses on improving binary code analysis across different ISAs by transferring knowledge, rather than discussing adversarial attacks or defenses in the context of machine learning models."
uss_2023_412,Decompiling x86 Deep Neural Network Executables.,"No. The abstract discusses the use of deep learning compilers to optimize DL model performance on various hardware, which does not pertain to adversarial machine learning attacks or defenses."
uss_2023_413,AIRS: Explanation for Deep Reinforcement Learning based Security Applications.,"No, the abstract is focused on explainability and trust issues in deep reinforcement learning (DRL) models for security applications, but it does not specifically address adversarial attacks or defenses which are the core elements of Adversarial Machine Learning (AML)."
uss_2023_414,Differential Testing of Cross Deep Learning Framework APIs: Revealing Inconsistencies and Vulnerabilities.,"No. The abstract focuses on testing and identifying security bugs in cross-framework API conversions for deep learning models, not on adversarial attacks or defenses aimed at exploiting or mitigating vulnerabilities in the models themselves."
uss_2023_415,Every Signature is Broken: On the Insecurity of Microsoft Office's OOXML Signatures.,"No. The abstract discusses attacks on document integrity protection in Microsoft Office and other office standards, but it does not involve machine learning models or adversarial techniques related to AML."
uss_2023_416,Downgrading DNSSEC: How to Exploit Crypto Agility for Hijacking Signed Zones.,"No. The abstract discusses the deployment and agility of cryptographic algorithms in DNSSEC for security purposes, not related to adversarial attacks or defenses in machine learning."
uss_2023_417,Security Analysis of MongoDB Queryable Encryption.,"No. The abstract discusses the integration of searchable encryption technology in a database system, which relates to data security and privacy rather than adversarial machine learning."
uss_2023_418,All cops are broadcasting: TETRA under scrutiny.,"No, the given abstract is not related to AML as it focuses on the security analysis of a radio communication standard and its cryptographic aspects, without mention of machine learning systems or adversarial attacks."
uss_2023_419,On the Feasibility of Malware Unpacking via Hardware-assisted Loop Profiling.,"No, the abstract is not directly related to AML because it discusses the use of Hardware Performance Counters for general security applications, without specifically mentioning adversarial attacks or defenses in the context of machine learning systems."
