uuid,title,response
uss_2023_84,Measuring Up to (Reasonable) Consumer Expectations: Providing an Empirical Basis for Holding IoT Manufacturers Legally Responsible.,"No, the abstract is not related to AML because it focuses on consumer expectations and responses to security and privacy incidents in IoT devices, rather than discussing adversarial attacks or defenses related to machine learning systems."
uss_2023_85,Are Consumers Willing to Pay for Security and Privacy of IoT Devices?,"No, the abstract is not related to AML because it focuses on consumer behavior and preferences regarding IoT device security and privacy features, rather than discussing adversarial attacks or defenses in machine learning systems."
uss_2023_86,Examining Consumer Reviews to Understand Security and Privacy Issues in the Market of Smart Home Devices.,"No, the abstract is not related to Adversarial Machine Learning (AML). It focuses on analyzing customer reviews for IoT devices to understand consumer concerns about security and privacy, rather than discussing attacks or defenses related to machine learning models."
uss_2023_87,"Internet Service Providers' and Individuals' Attitudes, Barriers, and Incentives to Secure IoT.","No. The abstract is about the attitudes and incentives of ISPs and individuals regarding the security of IoT devices, which is not directly related to adversarial machine learning attacks or defenses."
uss_2023_88,Detecting and Handling IoT Interaction Threats in Multi-Platform Multi-Control-Channel Smart Homes.,"No. The abstract focuses on detecting and handling IoT interaction threats in smart homes, which involves device interaction conflicts and platform integration, but does not mention or relate to adversarial attacks or defenses in machine learning systems."
uss_2023_89,Private Proof-of-Stake Blockchains using Differentially-Private Stake Distortion.,"No. The given abstract is related to private proof-of-stake blockchains and discusses safety, liveness, and privacy concerns, but does not address adversarial attacks or defenses in the context of machine learning."
uss_2023_90,"PrivateFL: Accurate, Differentially Private Federated Learning via Personalized Data Transformation.","Yes. The abstract discusses inference attacks on federated learning, which are a type of adversarial attack focused on extracting sensitive information from local training data."
uss_2023_91,What Are the Chances? Explaining the Epsilon Parameter in Differential Privacy.,"No. The abstract is focused on the communication of differential privacy guarantees to end-users, which is related to privacy and data protection, rather than adversarial machine learning."
uss_2023_92,Tight Auditing of Differentially Private Machine Learning.,"No, this abstract is related to privacy audits and mechanisms for differential privacy estimation in machine learning algorithms, not about adversarial attacks on machine learning models."
uss_2023_93,PrivTrace: Differentially Private Trajectory Synthesis by Adaptive Markov Models.,"No, the abstract is not related to AML. It focuses on using differential privacy and Markov chain models to address privacy concerns in publishing trajectory data, rather than discussing adversarial attacks or manipulation of machine learning systems."
uss_2023_94,Meta-Sift: How to Sift Out a Clean Subset in the Presence of Data Poisoning?,"Yes, the abstract is related to AML as it discusses data poisoning risks and defenses, which are key concepts in adversarial machine learning."
uss_2023_95,Towards A Proactive ML Approach for Detecting Backdoor Poison Samples.,"Yes. The abstract is related to AML because it discusses detecting and mitigating backdoor attacks, which are a form of adversarial attack affecting deep learning models."
uss_2023_96,PORE: Provably Robust Recommender Systems against Data Poisoning Attacks.,"Yes, the abstract is related to AML because it discusses data poisoning attacks on recommender systems and proposes a framework to make them robust against such attacks, which is a core aspect of adversarial machine learning."
uss_2023_97,Every Vote Counts: Ranking-Based Training of Federated Learning to Resist Poisoning Attacks.,"Yes, the abstract is related to AML because it discusses poisoning attacks in federated learning, where malicious clients contribute harmful updates to degrade the accuracy of a machine learning model."
uss_2023_98,Fine-grained Poisoning Attack to Local Differential Privacy Protocols for Mean and Variance Estimation.,"Yes, the abstract is related to AML as it describes a scenario where an attacker uses a data poisoning attack to manipulate data within a local differential privacy (LDP) framework, which is a type of adversarial attack."
uss_2023_99,Your Exploit is Mine: Instantly Synthesizing Counterattack Smart Contract.,"No. The abstract discusses the use of runtime defense mechanisms to protect smart contracts from exploitation, which is focused on security in blockchain technology rather than adversarial machine learning attacks on ML models."
uss_2023_100,Smart Learning to Find Dumb Contracts.,"No. The abstract focuses on detecting vulnerabilities in Ethereum smart contracts using deep learning, but it does not address adversarial attacks or defenses in the context of machine learning systems."
uss_2023_101,Confusum Contractum: Confused Deputy Vulnerabilities in Ethereum Smart Contracts.,No. The abstract focuses on the security considerations of smart contracts on blockchain systems and does not explicitly address adversarial attacks or defenses in the context of machine learning systems.
uss_2023_102,Panda: Security Analysis of Algorand Smart Contracts.,"No, the abstract is not related to AML. It focuses on identifying and analyzing security vulnerabilities in Algorand smart contracts through static analysis, which is about blockchain security rather than adversarial machine learning."
uss_2023_103,Proxy Hunting: Understanding and Characterizing Proxy-based Upgradeable Smart Contracts in Blockchains.,"No. The abstract focuses on upgradeable smart contracts and their security implications within blockchain technology, rather than on machine learning systems or adversarial attacks associated with AML."
uss_2023_104,Fuzztruction: Using Fault Injection-based Fuzzing to Leverage Implicit Domain Knowledge.,"No. The abstract discusses fuzz testing in the context of digital communication protocols and data formats, not adversarial machine learning or attacks on ML systems."
uss_2023_105,FuzzJIT: Oracle-Enhanced Fuzzing for JavaScript Engine JIT Compiler.,"No. The abstract is about a fuzzing technique for identifying bugs in JavaScript Just-In-Time (JIT) compilers, and it does not discuss adversarial attacks or machine learning systems."
uss_2023_106,GLeeFuzz: Fuzzing WebGL Through Error Message Guided Mutation.,"No. The abstract is related to security testing of WebGL interfaces through fuzzing techniques, which focuses on vulnerability discovery and is not associated with adversarial attacks or manipulating machine learning systems."
uss_2023_107,autofz: Automated Fuzzer Composition at Runtime.,"No. The abstract discusses fuzzing, a technique for detecting software vulnerabilities, which is not directly related to adversarial machine learning or attacks on machine learning models."
uss_2023_108,CarpetFuzz: Automatic Program Option Constraint Extraction from Documentation for Fuzzing.,"No. The abstract is related to improving a fuzzing technique for software vulnerability detection using NLP to analyze program options, but it does not discuss adversarial machine learning or techniques intended to manipulate or deceive machine learning models."
uss_2023_109,SCARF - A Low-Latency Block Cipher for Secure Cache-Randomization.,"No, the abstract is related to microarchitecture security via randomized cache design rather than adversarial machine learning, which involves manipulating machine learning models or their inputs."
uss_2023_110,The Gates of Time: Improving Cache Attacks with Transient Execution.,"No. The given abstract is focused on cache attacks and transient-execution attacks in computer security, but it does not discuss manipulating or attacking machine learning models, which is essential for AML."
uss_2023_111,Synchronization Storage Channels (S2C): Timer-less Cache Side-Channel Attacks on the Apple M1 via Hardware Synchronization Instructions.,"No. The abstract is related to side-channel attacks on shared caches, not to adversarial machine learning, as it focuses on observing cache state changes rather than manipulating or attacking machine learning models."
uss_2023_112,ClepsydraCache - Preventing Cache Attacks with Time-Based Evictions.,"No, the abstract is not related to AML because it focuses on hardware-level defenses against microarchitectural CPU cache attacks, which are more related to computer architecture and security rather than machine learning."
uss_2023_113,CacheQL: Quantifying and Localizing Cache Side-Channel Vulnerabilities in Production Software.,"No. The abstract is related to cache side-channel attacks which focus on exploiting hardware vulnerabilities, rather than manipulating machine learning models."
uss_2023_114,InfinityGauntlet: Expose Smartphone Fingerprint Authentication to Brute-force Attack.,"No, the abstract is not related to Adversarial Machine Learning (AML) as it focuses on threats and attacks specific to smartphone fingerprint authentication systems, such as presentation attacks and specific model vulnerabilities, rather than adversarial attacks or defenses targeting machine learning models."
uss_2023_115,A Study of Multi-Factor and Risk-Based Authentication Availability.,"No, the abstract is not related to AML because it focuses on the availability and prevalence of authentication methods like MFA, RBA, and SSO, rather than any adversarial machine learning attacks or defenses related to manipulating or understanding machine learning systems."
uss_2023_116,A Large-Scale Measurement of Website Login Policies.,"No. The abstract discusses evaluating and understanding website login policies and their security implications, rather than focusing on adversarial tactics or defenses in a machine learning context."
uss_2023_117,Security and Privacy Failures in Popular 2FA Apps.,"No. The abstract focuses on the security and privacy analyses of backup mechanisms in TOTP apps, which are not related to adversarial machine learning attacks or defenses."
uss_2023_118,"Multi-Factor Key Derivation Function (MFKDF) for Fast, Flexible, Secure, & Practical Key Management.","No, this abstract is not related to AML as it focuses on improving key derivation functions for cryptographic security, rather than discussing adversarial attacks or defenses in machine learning systems."
uss_2023_119,"Log: It's Big, It's Heavy, It's Filled with Personal Data! Measuring the Logging of Sensitive Information in the Android Ecosystem.",No. The given abstract discusses the logging policy and security mechanisms in Android regarding system logs and does not relate to adversarial techniques or vulnerabilities specific to machine learning systems.
uss_2023_120,CodexLeaks: Privacy Leaks from Code Generation Language Models in GitHub Copilot.,"Yes, the abstract is related to AML because it discusses the potential issue of models inadvertently exposing sensitive personal information from the training data, which is a concern in adversarial settings related to inference attacks."
uss_2023_121,Freaky Leaky SMS: Extracting User Locations by Analyzing SMS Timings.,"Yes, the abstract is related to AML because it describes the use of a machine learning model to perform an inference attack, inferring the location of an SMS recipient based on timing data, which is a characteristic of adversarial machine learning."
uss_2023_122,The Writing on the Wall and 3D Digital Twins: Personal Information in (not so) Private Real Estate.,"No. The abstract is not related to AML as it focuses on the privacy implications of 3D virtual tours in online real estate, rather than discussing attacks or defenses related to machine learning systems."
uss_2023_123,Glaze: Protecting Artists from Style Mimicry by Text-to-Image Models.,"Yes. The abstract describes the use of ""style cloaks"" to apply perturbations on training data, which is a form of adversarial defense against style-mimicking attacks by generative models, making it related to adversarial machine learning."
uss_2023_124,Lost at C: A User Study on the Security Implications of Large Language Model Code Assistants.,"No, the abstract is not related to AML. It focuses on the impact of LLM-assisted coding on software security, rather than describing adversarial attacks or defenses on machine learning models."
uss_2023_125,Two-in-One: A Model Hijacking Attack Against Text Generation Models.,"Yes. The abstract discusses a new model hijacking attack in machine learning, which falls under the broader category of adversarial machine learning by manipulating text classification and generation models."
uss_2023_126,PTW: Pivotal Tuning Watermarking for Pre-Trained Image Generators.,"Yes, the abstract is related to AML because it discusses both the creation and detection of deepfakes, including the security implication of watermarking as a defense mechanism against adversarial white-box attacks."
uss_2023_127,Lessons Lost: Incident Response in the Age of Cyber Insurance and Breach Attorneys.,"No. The abstract is focused on the impacts of cyber insurance and legal influence on incident response processes, rather than discussing adversarial machine learning or related attacks on machine learning systems."
uss_2023_128,Bug Hunters' Perspectives on the Challenges and Benefits of the Bug Bounty Ecosystem.,"No, the abstract is not related to AML. It focuses on understanding the perspectives and motivations of bug hunters in the bug-bounty ecosystem, which is unrelated to adversarial attacks or machine learning systems."
uss_2023_129,Work-From-Home and COVID-19: Trajectories of Endpoint Security Management in a Security Operations Center.,"No. The abstract discusses the impact of increased WFH practices on endpoint security monitoring and the management challenges faced by Security Operations Centers (SOCs), but it does not address adversarial attacks or defenses in machine learning systems."
uss_2023_130,"""Employees Who Don't Accept the Time Security Takes Are Not Aware Enough"": The CISO View of Human-Centred Security.","No, the abstract is not related to Adversarial Machine Learning, as it focuses on the role of Chief Information Security Officers (CISOs) in human-centered security and does not discuss any form of adversarial attacks or defenses related to machine learning systems."
uss_2023_131,Aegis: Mitigating Targeted Bit-flip Attacks against Deep Neural Networks.,"Yes. The abstract discusses bit-flip attacks and defenses in the context of deep neural networks, which are a type of adversarial attack aimed at compromising machine learning models, thus it is related to adversarial machine learning (AML)."
uss_2023_132,Rethinking White-Box Watermarks on Deep Learning Models under Neural Structural Obfuscation.,"No. The abstract focuses on DNN watermarking for copyright protection and securing model ownership, rather than discussing attacks or countermeasures specific to adversarial manipulation or threats."
uss_2023_133,PELICAN: Exploiting Backdoors of Naturally Trained Deep Learning Models In Binary Code Analysis.,"Yes. The abstract is related to AML as it discusses exploiting backdoor vulnerabilities in deep learning models used for binary analysis to induce misclassification, aligning with adversarial attack concepts."
uss_2023_134,IvySyn: Automated Vulnerability Discovery in Deep Learning Frameworks.,"Yes, the abstract is related to AML as it discusses the discovery and exploitation of memory error vulnerabilities in Deep Learning frameworks, which could be leveraged by attackers in adversarial settings."
uss_2023_135,"Hey Kimya, Is My Smart Speaker Spying on Me? Taking Control of Sensor Privacy Through Isolation and Amnesia.","No, the abstract is not related to AML. It focuses on a framework for ensuring data privacy and accountability in devices with event-triggered sensors, without discussing adversarial attacks or defenses involving machine learning."
uss_2023_136,Spying through Your Voice Assistants: Realistic Voice Command Fingerprinting.,"Yes. The abstract is related to AML because it involves analyzing and fingerprinting encrypted traffic to infer user activities, which can pose privacy and security risks, akin to an inference attack on machine learning-enhanced voice assistants."
uss_2023_137,QFA2SR: Query-Free Adversarial Transfer Attacks to Speaker Recognition Systems.,"Yes. The abstract describes an adversarial attack method, QFA2SR, aimed at exploiting speaker recognition systems by leveraging the transferability of adversarial voices, which is directly related to adversarial machine learning."
uss_2023_138,Learning Normality is Enough: A Software-based Mitigation against Inaudible Voice Attacks.,"Yes. The abstract is related to AML as it focuses on detecting inaudible voice attacks, which manipulate inputs to compromise machine learning systems in voice-controlled devices, aligning with the notion of adversarial attacks in AML."
uss_2023_139,Powering for Privacy: Improving User Trust in Smart Speaker Microphones with Intentional Powering and Perceptible Assurance.,"No. The abstract focuses on physical privacy features and perceptible assurance in smart speakers, without addressing adversarial attacks or defenses in machine learning systems."
uss_2023_140,"To Cloud or not to Cloud: A Qualitative Study on Self-Hosters' Motivation, Operation, and Security Mindset.","No. The abstract focuses on the behaviors and challenges of self-hosting services, particularly in terms of data security and operations, without discussing any adversarial machine learning concepts or attacks."
uss_2023_141,"""I wouldn't want my unsafe code to run my pacemaker"": An Interview Study on the Use, Comprehension, and Perceived Risks of Unsafe Rust.","No, the given abstract is not related to Adversarial Machine Learning (AML). The abstract focuses on memory safety issues and security vulnerabilities in the Rust programming language, rather than discussing adversarial attacks or defenses in machine learning systems."
uss_2023_142,Pushed by Accident: A Mixed-Methods Study on Strategies of Handling Secret Information in Source Code Repositories.,"No, the abstract is not related to AML. It focuses on secure code secret management in version control systems and does not address adversarial attacks or defenses related to machine learning models."
uss_2023_143,A Mixed-Methods Study of Security Practices of Smart Contract Developers.,No. The abstract focuses on the security perceptions and practices of smart contract developers and does not discuss adversarial attacks or defenses related to machine learning systems.
uss_2023_144,The Role of Professional Product Reviewers in Evaluating Security and Privacy.,"No. The abstract is not related to Adversarial Machine Learning as it focuses on evaluating consumer product security and privacy by professional reviewers, rather than discussing attacks or defenses on machine learning models."
uss_2023_145,Network Responses to Russia's Invasion of Ukraine in 2022: A Cautionary Tale for Internet Freedom.,"No, the abstract is unrelated to Adversarial Machine Learning (AML) as it discusses geopolitical events, sanctions, and Internet freedom, rather than any specific adversarial attacks or defenses in the context of machine learning systems."
uss_2023_146,A Study of China's Censorship and Its Evasion Through the Lens of Online Gaming.,"Yes, the abstract is related to AML as it discusses evasion techniques used by young online gamers to bypass addiction prevention systems, which aligns with the evasion attack type in adversarial machine learning."
uss_2023_147,DeResistor: Toward Detection-Resistant Probing for Evasion of Internet Censorship.,"No. The abstract is about censorship evasion and detection in internet communication, which relates to network security and privacy rather than adversarial machine learning."
uss_2023_148,Timeless Timing Attacks and Preload Defenses in Tor's DNS Cache.,"No. The abstract is related to a timing attack on the Tor network's DNS cache and does not involve machine learning systems, adversarial attacks on ML models, or defenses related to AML."
uss_2023_149,How the Great Firewall of China Detects and Blocks Fully Encrypted Traffic.,"No, the abstract is not related to AML. It focuses on censorship circumvention and detection by the Great Firewall of China, which is not directly connected to adversarial attacks or defenses on machine learning models."
uss_2023_150,A Data-free Backdoor Injection Approach in Neural Networks.,"Yes, the abstract is related to AML as it discusses a novel backdoor attack method on deep neural networks, focusing on embedding backdoors efficiently using substitute data, which influences the model’s behavior intentionally."
uss_2023_151,Sparsity Brings Vulnerabilities: Exploring New Metrics in Backdoor Attacks.,"Yes, the abstract is related to AML as it discusses a clean-label backdoor attack exploiting vulnerabilities in AI-based malware detectors."
uss_2023_152,Aliasing Backdoor Attacks on Pre-trained Models.,"Yes, the abstract is related to AML because it discusses a novel backdoor attack that exploits aliasing errors in neural networks to manipulate model predictions, which aligns with the notion of adversarial machine learning."
uss_2023_153,ASSET: Robust Backdoor Data Detection Across a Multiplicity of Deep Learning Paradigms.,"Yes. The abstract discusses methods for detecting backdoor data in various learning settings, which is directly related to adversarial machine learning as backdoor attacks are a form of adversarial attack."
uss_2023_154,VILLAIN: Backdoor Attacks Against Vertical Split Learning.,"Yes, the abstract is related to AML as it discusses the use of backdoor attacks in vertical split learning, which is a type of adversarial attack aimed at manipulating machine learning models."
uss_2023_155,ARI: Attestation of Real-time Mission Execution Integrity.,"No. The abstract focuses on remote attestation for verifying the integrity of cyber-physical systems, rather than addressing adversarial machine learning attacks or defenses in the context of autonomous systems."
uss_2023_156,Design of Access Control Mechanisms in Systems-on-Chip with Formal Integrity Guarantees.,"No, the abstract is not related to Adversarial Machine Learning (AML) as it focuses on formal verification methodologies for system-on-chip (SoC) hardware access control systems, rather than machine learning models or adversarial attacks on them."
uss_2023_157,HashTag: Hash-based Integrity Protection for Tagged Architectures.,"No, the abstract is not related to AML because it focuses on enhancing error-correcting codes for data integrity in DRAM systems, rather than addressing adversarial attacks or defenses in machine learning models."
uss_2023_158,XCheck: Verifying Integrity of 3D Printed Patient-Specific Devices via Computing Tomography.,"No, the abstract is not related to AML since it does not discuss attacks or defenses specific to machine learning systems."
uss_2023_159,Demystifying Pointer Authentication on Apple M1.,"No, the given abstract is not related to AML. It focuses on hardware-level security through pointer authentication rather than adversarial attacks or defenses on machine learning systems."
uss_2023_160,DDRace: Finding Concurrency UAF Vulnerabilities in Linux Drivers with Directed Fuzzing.,"No, the abstract is focused on discovering concurrency use-after-free vulnerabilities in Linux drivers using greybox fuzzing, which is more related to software security and testing rather than adversarial machine learning."
uss_2023_161,Automata-Guided Control-Flow-Sensitive Fuzz Driver Generation.,"No. The abstract is about generating fuzz drivers for fuzzing library APIs, which is related to software testing, not adversarial machine learning."
uss_2023_162,Hoedur: Embedded Firmware Fuzzing using Multi-Stream Inputs.,"No. The abstract is related to security and vulnerability analysis in embedded systems rather than adversarial machine learning, as it focuses on the use of fuzzing for vulnerability assessments, not on manipulating machine learning models."
uss_2023_163,Forming Faster Firmware Fuzzers.,"No. The abstract focuses on rehosting and fuzzing for security vulnerability analysis in embedded systems, which is not specifically related to adversarial machine learning."
uss_2023_164,ReUSB: Replay-Guided USB Driver Fuzzing.,"No. The abstract discusses vulnerabilities in USB drivers and the use of fuzzing techniques to find them, which is more related to software security and testing, rather than adversarial machine learning or attacks on machine learning systems."
uss_2023_165,"Exorcising ""Wraith"": Protecting LiDAR-based Object Detector in Automated Driving System from Appearing Attacks.","Yes, the abstract is related to AML as it discusses adversarial attacks on automated driving systems that exploit weaknesses in 3D object detectors by crafting fake obstacles, which is a common topic in adversarial machine learning."
uss_2023_166,Discovering Adversarial Driving Maneuvers against Autonomous Vehicles.,"Yes, the abstract is related to AML because it describes the development of a framework, Acero, that discovers adversarial maneuvers targeting autonomous vehicle systems to exploit vulnerabilities, which relates to adversarial machine learning attacks."
